content,creationTime,score,productSize,location
外形外观：经典有型 屏幕音效：显示细腻，音响效果不错 拍照效果：成像效果非常好 运行速度：流畅不卡顿 待机时间：轻度使用，两天，中度使用，一天 其他特色：灵动岛挺有意思，全天候显示很方便,2023-04-23 21:49:55,5星评论,256GB,山东
外形外观：外观精致，果然时尚是个轮回。 屏幕音效：屏幕显得很细腻，很鲜艳。 拍照效果：拍好比13提升了很多，真实感强。 其他特色：送女朋友的情人节礼物，她自己的11卡的不行，内存也满了，电池损耗也高，自己宁可花1w买包，也不愿意花8k买手机用来工作，或许这就是女人吧。,2023-04-11 17:46:17,5星评论,256GB,江苏
正品，非常喜欢，送给媳妇的礼物 外形外观：好看 屏幕音效：音量大 拍照效果：清晰 运行速度：很快 待机时间：常长 其他特色：喜欢,2023-04-21 17:22:54,5星评论,128GB,辽宁
赶上iPhone降价，果断出手，买电子产品，还得是京东自营，喜欢的颜色深空灰，大气上档次，iPhone14pro包装完好，喜欢iPhone的ios系统，iPhone14pro屏幕分辨率高，高清，拍照有提升，拍照真实，清晰，手机运行速度很快，手机待机时间够用，京东快递速度很快，服务好,2023-04-09 15:56:06,5星评论,256GB,山东
物流很快，物品完好无损，用起来很舒服，特别特别特别好，没有任何破损的地方，外观也好看，好评！ 外形外观：外观漂亮，显大气 屏幕音效：重低音效果很好 拍照效果：拍视频嘎嘎的非常流畅 待机时间：电池用着还不错 其他特色：灵动岛挺好玩,2023-04-17 10:10:57,5星评论,128GB,山西
外形外观：外观颜色很好看，之前用12 现在这个手感拿起来比较重 拍照效果：拍照效果杠杠的呀 运行速度：毕竟是新机 速度肯定快 待机时间：差不多一天一充吧 正常使用的情况下 其他特色：外观和手感感觉挺好的,2023-04-12 11:37:41,5星评论,256GB,广东
外形外观：紫色，是我喜欢的颜色，哈哈哈 屏幕音效：听歌音效很好 拍照效果：拍照清晰，很亮 运行速度：运行速度很快 待机时间：充一次电可以用好久，哈哈哈,2023-04-10 15:35:42,5星评论,256GB,北京
外形外观：金色偏白，不是以前的 屏幕音效：音效很好，声音很大 拍照效果：效果真的不错，比万元安卓机好太多了 运行速度：非常流畅 待机时间：一天差不多吧，中度使用 其他特色：手感比较好，边框比较亮,2023-04-04 20:34:12,5星评论,256GB,江苏
外形外观：直角圆弧设计，很精致 屏幕音效：音效相当不错 拍照效果：个人感觉比华为的好 运行速度：运行速度嘎嘎快 待机时间：新机待机时长都不错,2023-04-16 15:03:12,5星评论,256GB,广东
外形外观：很好看，这个金***的很适合女孩子，气质大气 屏幕音效：没什么问题都挺好的 拍照效果：拍照很清晰，4800很? 运行速度：快快快,2023-04-19 10:15:06,5星评论,256GB,广东
外形外观：银色外观好看。 屏幕音效：音效非常好。 拍照效果：拍照效果优秀，完全能够满足日常需要。 运行速度：运行速度快，高刷无延迟。,2023-04-19 14:35:01,5星评论,128GB,上海
苹果手机系统不错，很流畅，拿在手里的重量也刚刚好合适，不会太重或者难操控，很喜欢灵动岛设计，应该是目前全面屏手机的天花板，也很省电，一天正常使用也就是耗电30%，很不错。,2023-04-06 12:50:43,5星评论,128GB,广东
外形外观：好看 屏幕音效：很不错 拍照效果：很不错 运行速度：很不错 待机时间：还行 其他特色：苹果手机的包装是一如既往的简单，就一台手机，一根官方线和一些三包卡。,2023-04-16 13:52:20,5星评论,256GB,湖南
外观外形尺寸比较小巧。便携好用屏幕音效都是特别不错的拍照效果杠杠的。运行速度咻咻咻的快得很待机时间也够用的。颜色虽然没买到喜欢的。套上壳一样好看,2023-04-26 01:49:45,5星评论,128GB,安徽
果然银色才是我的最爱 等了好久都没货 一有货就立刻下单了 非常的流畅 充电速度也很快 就是拍照有点太过清晰了 导致现在不太喜欢自拍了 玩游戏也很顺畅 反正整个手机看上去非常的漂亮大气 爱了爱了 非常棒,2023-04-25 11:45:42,5星评论,256GB,广东
用了一段时间之后再写评价哦，这样才有说服力！这次外形外观选了一个纯黑的，本来想选个紫色的，还是选了低调的黑色。速度很快，用着很顺手！,2023-04-16 23:19:04,5星评论,256GB,北京
配送服务差 其他的还可以,2023-04-30 13:28:18,3星评论,256GB,湖北
苹果不愧是最强的科技公司，iPhone一直以来都是手机标杆，无论从系统还是做工都是非常完美的，ios丝滑无比，没有bug，很舒服。,2023-04-13 23:16:16,5星评论,256GB,四川
jd物流相当的快，下午买的第二天早上就送到了。新到的手机完美无暇，没有网上说的边框缝隙可以插入一片纸。手机使用非常的流畅，拍照效果也是非常的清晰。,2023-04-18 10:25:43,5星评论,128GB,重庆
完美的手机，真的很不错，已经买好几个了，基本每年都换一个，操作方便好用，显示完美，颜值超高，发货的速度那是更快，当天上午购买当天晚上就送到了，值得推荐。,2023-04-07 00:01:41,5星评论,128GB,湖北
外形外观：外观非常喜欢，特别是这个紫色，有阳光和没阳光两个色，我特喜欢这种渐变 屏幕音效：音效一直挺好的，没毛病 拍照效果：拍照增加了4800万像素，超高清图 运行速度：运行速度没得说，飞一般 待机时间：日常用的话基本都是8个小时左右 其他特色：运行块，外观好看，主要运行,2023-04-12 18:09:40,5星评论,256GB,广东
外形外观：好看，银色很好看 屏幕音效：音效非常好，听音乐看视频无敌 拍照效果：拍照效果好，清晰度高。 运行速度：运行速度快，不卡顿。,2023-04-25 13:06:37,5星评论,128GB,上海
也是飘了，飘得厉害，眼瞅着618快到了不说，放着百补不下手，竟然敢在官方直营店买套装&hellip; 质量很过关，品质有保障，相当不错的选择，好多朋友看我用都想买，我都推荐了 非常满意?，材质做工非常好，而且百搭，手感也很棒，非常nice，实用性非常强，赞?,2023-05-02 19:53:29,5星评论,512GB,江苏
物流快递速度很快 第二天送到 包装完整没有破损 一直用苹果手机质量很好 屏幕音效都不错 用着很舒服 运行速度很快 没有卡顿,2023-04-30 08:12:41,5星评论,256GB,北京
用了好几年的xsmax突然就黑屏不显示了，感觉换屏也不合算就连夜在京东购买了14pro，京东快递还是一如既往的迅速，手机很好用，最新的灵动岛很新颖，运行速度也很快。,2023-04-24 08:03:36,5星评论,256GB,上海
非常的不错，这个新手机苹果的品控，我觉得还可以啊拿到手之后呢，各种的细节照片那些测试都没有问题都很都很烦，这个是苹果的比较忠实的用户了，平常用的手机都是苹果，就是很推荐大家购买真的,2023-04-28 21:43:55,5星评论,256GB,广东
买给家里老人用的，手机质量很好，设计也很合理，用起来很舒服，按键是分开的，很好按，而且不容易按错位，通话声音很，不用贴着耳朵都可以听的很清晰，而且信号的很强，通话很稳定，待机时间很长，手感舒适，老品牌手机就是值得信赖，店家服务也比较周到，送的配件很齐全，必须好评,2023-04-21 16:33:02,5星评论,512GB,山东
外形外观：漂亮， 屏幕音效：高级， 拍照效果：清晰， 运行速度：超级快， 待机时间：后期在评价， 总体感觉还是很不错的，价格在便宜点就更好了！,2023-04-09 18:47:27,5星评论,256GB,辽宁
外形外观：很好，灵动岛还不错 屏幕音效：屏幕高清，色彩很好，音效很棒，听音乐看剧都不错 拍照效果：拍照清晰，高清，色彩比例不错，拍出来的成片挺好的 运行速度：速度快，芯片强,2023-04-23 10:54:11,5星评论,256GB,广东
给朋友买的，她已经很久没有换过手机了，第一次用苹果一开始都用不习惯，跟我吐槽很久哈哈哈哈哈哈，除了信号不好其他的可以。,2023-04-21 15:50:45,5星评论,256GB,山东
第一次用苹果手机！质量没得说！！！打游戏真的体验感爆炸?！！！是正品，特意验证过，拍照也是一级棒！！,2023-04-14 14:11:58,5星评论,256GB,贵州
苹果的手机?无论是设计，还是听觉视觉效果上，都是非常不错的选择。 外形外观：艺术品的质感设计，握持很舒服 屏幕音效：感觉比我用的S21U好很多，很饱满 拍照效果：很快，够用了，哈哈(●&deg;u&deg;●)?&nbsp;」 运行速度：流畅的一匹 待机时间：这个也很优秀啊 其他特色：物流也很快哦,2023-04-07 22:40:55,5星评论,256GB,广西
iPhone有一点厚，游戏运行也不错，其他都不错，真心评价。值得拥有 拍照效果：很清晰的 显示效果：色彩很好，很柔和。 电池续航：电池不错 运行速度：很快的， 通信音质：音质没毛病，底下堵住听筒那边就响声环绕，立体声很好！,2023-04-30 01:11:03,5星评论,256GB,上海
期盼已久的手机终于买了，迫不及待的打开，清晰，系统运行流畅，京东物流真的很快，上午买，下午就收到，满意。,2023-04-30 21:56:00,5星评论,256GB,辽宁
正品国行，物流很快，运行速度很快，续航不错 外形外观：完美无缺 屏幕音效：高刷很爽 拍照效果：提升很大，特别运动防抖 运行速度：很流畅,2023-04-22 21:47:06,5星评论,128GB,湖南
外形外观：很精致。 屏幕音效：还不错。 拍照效果：拍的照片很清晰   。 运行速度：速度很快  也很流畅。 待机时间：要看使用程度了。 其他特色：京东快递很快。,2023-04-07 22:24:53,5星评论,256GB,江苏
外形外观：一如即往的帅气，手感很好 屏幕音效：环绕声很强 拍照效果：很不错 运行速度：四个字:快 待机时间：一天吧 其他特色：宿舍没插头，例外买的usb数据线,2023-05-01 08:00:29,5星评论,256GB,广东
外形外观：暗紫色很漂亮在阳光下可以变换颜色。 屏幕音效：屏幕清晰，色彩鲜艳。声音清晰。 拍照效果：三摄效果不错 运行速度：A16运行流畅无卡顿现象。 待机时间：足够用一天。 其他特色：活动价格可以。,2023-04-23 19:24:54,5星评论,256GB,上海
外形外观：比以往的丑了，为了性能没有办法。 拍照效果：很好，模组大，算法好，成像自然优秀， 运行速度：快，一如既往的好。 京东服务好，送货快！全五分！,2023-04-30 09:57:55,5星评论,256GB,四川
京东自营的服务很好的，这款手机的续航不怎么样，,2023-05-03 20:48:49,3星评论,256GB,北京
外形外观：经典的苹果手机外形，小巧玲珑很好看 屏幕音效：显示屏很清晰，外放也不错 拍照效果：拍照很清晰 运行速度：运行速度很快不卡顿，但是网络信号好像不好，经常没网，同地段插卡到小米手机就有网,2023-04-09 14:47:16,5星评论,256GB,江苏
外形外观：大三眼是真的帅，今年的摄像头模组又大了很多，看起来就很爽 屏幕音效：屏幕也采用120hz高刷，比60的顺滑很多 拍照效果：苹果的像素今年真的很强，4k照片 运行速度：很快，苹果真的一点也不卡 待机时间：电量真的很耐打，一天一充吧,2023-04-11 10:42:23,5星评论,256GB,山西
外形外观：外形外观很有质感。 屏幕音效：屏幕清晰，音效也还不错，重低音效果也还可以。 拍照效果：拍照效果真心不错，4800万像素确实不是盖的。 运行速度：运行速度比较快。 待机时间：待机时长需要一天两充吧,2023-04-15 16:09:57,5星评论,256GB,北京
上岛了，上次用的还是iphone6，完全不一样的体验。网上看了一些列种草最终还是选择了白色，就是好看，系统，刷新率，质感都没的说。非常满意！,2023-04-04 15:56:08,5星评论,256GB,湖北
最近购买了iPhone 14 Pro，我非常喜欢这款手机！首先，它的设计非常漂亮，拥有一个全新的平面边框设计，让它看起来更加现代化和高端。其次，它配备了一块高清显示屏幕，显示效果非常出色，色彩鲜艳、对比度高、亮度充足。另外，它的性能也非常出色，采用了全新芯片，性能比前一代的手机有了很大提升，运行速度非常快。此外，它还有更强大的摄像头功能，支持更多的摄影模式和视频功能，能够满足各种场景下的拍摄需求。最后，它还具有更长的电池续航时间，让我可以更加轻松地使用手机，不用频繁充电。总之，我非常喜欢这款iPhone 14 Pro的性能、设计和功能，是一款非常值得购买的手机！,2023-04-21 16:19:20,5星评论,256GB,四川
京东自营Apple iPhone 14pro 1TB 手机，活动时买的超划算，之前一直用的苹果手机习惯啦。这款做工外观都很不错，喜欢苹果系列的人都知道 外形外观：大平板看着很舒服 屏幕音效：清晰 拍照效果：像素高拍照的清晰度很赞 运行速度：超快 待机时间：下载啦96个APP大约待机28小时,2023-04-19 08:12:08,5星评论,1TB,北京
用到现在，暂时没有什么毛病 外形外观：经典外观 屏幕音效：第一梯队，外放无敌 拍照效果：拍照十分的清楚明亮 运行速度：反应速度很快,2023-04-11 23:10:33,5星评论,256GB,河南
外形外观：暗紫色非常漂亮，颜值超高！ 屏幕音效：立体音效，层次分明！ 拍照效果：4800万像素摄像头非常清晰！?? 运行速度：丝滑流畅！?? 其他特色：值得拥有！,2023-05-01 21:32:32,5星评论,256GB,广东
外形外观：很漂亮。颜色也好看 屏幕音效：非常满意。好听。打游戏超赞 拍照效果：很好。清晰度高。 运行速度：很快。不卡 待机时间：超长。充电速度很快 其他特色：都很满意。,2023-05-01 21:15:16,5星评论,128GB,福建
不错不错，喜欢从京东买电子产品。 外形外观：说实在，进步不大。 屏幕音效：好很多。 拍照效果：苹果最优秀的是视频。 运行速度：丝丝顺滑。 待机时间：用段时间才知道。,2023-04-27 19:24:47,5星评论,256GB,山东
待机续航还不错，屏幕高刷很丝滑，比较跟手，黑色的外观很沉稳，比较经典耐看，视频拍照很清晰，icould 很方便?，夜景还不错,2023-04-11 20:56:47,5星评论,256GB,山东
发货送货速度快，服流服务挺好的。手机已经收到啦。包装完好无损。一直用的苹果手机，这次购入的14pro使用感受不错哦！顺滑方便，特别喜欢金色的，手感很好?。保价处理妥贴。整体感受良好。,2023-04-30 10:18:42,5星评论,256GB,陕西
手机收到没有问题，发货速度很快，第二天就收到了，电量充足，金色好好看呀，运行速度超级快，续航还是有待提升的 运行速度：超级快 待机时间：有待提升 拍照效果：很清晰,2023-04-06 23:05:47,5星评论,256GB,江苏
外形外观：外形一如既往的好，用了一个星期，没任何问题，尺寸拿着刚刚好，电池一天待机没问题。拍照功能没话说，相当不错，后续再来追评。,2023-04-29 22:53:33,5星评论,128GB,广东
屏幕音效：屏幕质量很好，全天候显示屏确实拉轰，音效也拉满 拍照效果：比我的12强太多了，特别清晰 运行速度：速度灰常快 待机时间：待机时间基本1天半吧，使用不是特别多,2023-04-18 15:45:55,5星评论,256GB,河北
外形外观：外形很nice的！ 屏幕音效：屏幕很丝滑，音效也非常赞！ 拍照效果：拍的照片很清晰，不愧是苹果手机！ 运行速度：运行速度很快，非一般的感觉！ 待机时间：待机时长也比之前的产品长了很多！,2023-04-10 18:36:39,5星评论,512GB,湖南
买来拍视频的，像素很好，女生用大小合适。运行速度快，苹果的内存很扛打，电池续航&hellip;嗯&hellip;&hellip;&hellip;，京东自营品质保证，快递小哥很负责。,2023-04-19 13:49:36,5星评论,256GB,福建
给爸爸买的生日礼物，很超值，老人用很方便，苹果的品质值得信赖，黑色大气，高档上档次，推荐入手，3月活动力度大，早用早享受。,2023-04-04 20:36:31,5星评论,128GB,山西
外形外观：14一如既往的耐看，暗紫色是真的非常好看 屏幕音效：屏幕真不错，看久了眼不累， 拍照效果：拍照真好，就是原相机拍人真还原度高。 运行速度：运行速度没得说了，速度杠杠的。 待机时间：待机一般。真的一般 其他特色：灵动岛挺好玩,2023-04-28 18:48:29,5星评论,256GB,河北
还好吧，反正想换了。,2023-05-03 08:14:39,3星评论,256GB,广东
发货快，隔天就收到，安卓四年多转苹果 以前用苹果还是6的时候哈哈啊哈 不得不说确实高刷的畅快太爽了呀呀呀 开机直接给了 安卓转移按钮 这个还是非常便捷 功能上 灵动岛比较鸡 肋所以没咋期待 平时平板看视频多 手机买的14pro手 感很适合 max太大 拍照很清晰 视频广角也很喜欢防 抖厉害,2023-04-28 16:36:34,5星评论,128GB,广东
拍照效果：非常清晰，视频拍摄效果非常稳定清晰 运行速度：运行流程不卡顿 外形外观：外观大气上档次 屏幕音效：屏幕显示清晰，效果好,2023-04-20 20:19:21,5星评论,256GB,湖北
外形外观：从外观上来看，造型独特，顺滑顺手。 屏幕音效：心智，特别棒。画面清晰。 拍照效果：超级适合拍照，自拍无敌好。,2023-04-10 22:49:19,5星评论,256GB,天津
我的xr已经用了快五年了，最近老是让我清理内存。然后又闪退，和朋友念叨了几次想换手机，然后呢昨天吴总说带我去买手机。不看不知道，现在的手机都好贵。不过质量确实不错，速度很快很流畅，不等15了，直接上手买灵动岛吧。,2023-04-22 14:13:54,5星评论,256GB,浙江
14pro 拍照惊艳，而且有强大的核心支持，从京东购买十分放心，验机没有问题，安全下车，不同角度各不相同，外放音质也很好，比11强不少，总体来说，都挺满意的！反光效果好，磨砂后盖手感一流。屏幕音效：冷屏亮度高，显示清晰，音效声音洪亮。拍照效果：拍照无延迟,2023-04-12 16:42:33,5星评论,128GB,北京
说真的，用了十几年安卓机一直不愿意换其他（?）系统的手机，二来也怕用不惯。 这次手机突然摔爆屏了，一时间没有心仪的安卓机，虽然现在的安卓手机都出得挺不错的。 已经用了三代三星机的我最后还是下定决心试一下苹果机 ，目前用了2个月了，简单说一下我的感受：1.不得不说系统真的很丝滑；2.灵动岛给我的感觉科技感确实很强；3.至于被大众吐槽的续航时间目前看来还是比较耐用，可能毕竟是新手机；4.屏幕真的很自然。 最后公正地吐槽一下，用别的软件打开的摄像头聚焦很困难，例如打开微信扫二维码，希望后期系统更新能解决这个问题。,2023-04-05 23:39:50,5星评论,512GB,广东
苹果14pro终于到手啦，果然没有让我失望，系统一如既往的顺畅，颜色外观非常好看，特意买了倍思的壳膜充电器套装，跟新机一起搭配使用，尤其是保护膜护眼效果太赞了，手感也很赞，爱不释手。,2023-05-01 13:38:24,5星评论,256GB,云南
客服服务好很有耐心解答问题，产品外形漂亮大气有质感，品牌审美一直都很在线，我很喜欢，拍照功能很好，续航持久，运行速度流畅，很棒的产品让人有很好的体验。,2023-04-19 02:08:58,5星评论,128GB,海南
运行速度很快，外观漂亮，拍照那肯定是超高清啊，安全性能佳，不会有一些乱七八糟的APP，然后定位查找方便。用了很多年的苹果了，总体还是比较满意的。,2023-04-04 21:28:30,5星评论,256GB,广东
京东自营旗舰店，质量有保障，国行正品。京东物流非常给力，包装完好，物流送货体验很不错。新机外包装简约时尚，新机非常艳丽，深黑色非常经典，推荐内存256G，新功能非常实用，续航也很给力，各方面性能优秀！,2023-04-11 18:00:42,5星评论,256GB,安徽
苹果就是苹果，14看似升级地方不明显，实际使用起来，比13要爽很多，灵动岛让操作方式更高效更快捷，细节处做得很到位，好评好评,2023-04-18 16:02:57,5星评论,128GB,广东
不错，赶上降价直接冲！用了一段时间了，没有遇到什么问题也没有发现毛病，很顺畅丝滑，灵动岛设计还是很特别的，经典白色好搭配手机壳,2023-04-07 00:24:17,5星评论,256GB,北京
真不错，这个黑色很高级，也很有质感。用了10多天成功下车啦！京东品质还是有保障的。除了信号差点之外，其他都很棒！无论是拍照，显示效果，运营速度，都是苹果独有的丝滑。除了自定义不如国产安卓之外，简约风格还是很适合办公室氛围的。,2023-04-06 11:55:41,5星评论,256GB,湖北
紫色是很好看的。价格也便宜了一些，再开个专票也便宜。质感是很好的。第一次有药丸屏幕。价格也下来了。就尝试一下。非常合适的。,2023-04-14 16:09:22,5星评论,128GB,中国香港
iphone忠实粉丝，最新13pro值得入手，新功能非常实用。苹果京东自营店，值得信赖，国行正品，京东物流非常给力，新机非常惊艳，ios系统一如既往的流畅，续航非常不错，各方面性能强悍，推荐入手！！！,2023-04-11 17:55:17,5星评论,256GB,安徽
?非常漂亮，做工精细，颜值相当高。 使用一下，速度相当快，看来苹果的系统超级无敌。 京东购买比专卖店优惠了800元，补差价又找回100元，很满意。,2023-04-04 23:41:14,5星评论,128GB,山东
自营的送货就是快，晚上下单，早上9点就到了，包装完美，机器很喜欢，手感很好，触控跟手，后盖越做越好看了，玻璃镜头和底盖一体的设计太赞了,2023-04-20 09:39:57,5星评论,256GB,湖北
还是得苹果手机，各种性能非常好，显示拍照确实有进步。京东自营商品质量有保障，发货也很快，朝发夕至特别方便，总体来说还不错，值得购买。,2023-04-14 20:13:59,5星评论,128GB,北京
不得不说，京东真的是大手笔。京东自营，第一天下单，第二天就收到了，速度非常的快。加上有补贴，下单还是非常的划算，必须要好评。新手机的手感是真的好呀。,2023-04-19 12:50:22,5星评论,256GB,重庆
很不错啊很不错 应该早点卖出 早买早体验 后置摄像头拍照很牛 前置拍的也太清楚了 脸上瑕疵拍的一清二楚?,2023-04-29 16:07:45,5星评论,512GB,江苏
期待已久的更换手机，为自己选择这款14pro而庆幸。256g的内存，解决了我之前手机内存小不够用的寰场Ｊ只放在手里刚刚好，不大不小，手感很好。待机时间很长，充一次可以用一天。,2023-04-17 20:23:05,5星评论,256GB,广东
京东快递运输速度很快，第二天就到了，外包装完好无损的，快递师傅态度很好。苹果手机的系统很流畅，这款又是120hz，电池比12容量大，外观很喜欢，就是怎么我玩的游戏掉帧呢？,2023-04-05 23:48:18,5星评论,256GB,河北
手感很好，不锈钢边框更有质感。不是很重。黑色很漂亮，特别是黑色边框很耐看。送货也特别快。第二天早上就到了,2023-04-04 04:07:08,5星评论,256GB,河南
给媳妇买的 6.7寸屏幕太大，选了6.1寸的pro 续航实在很普通 但是外观手感是真的棒 趁着这波降价入手，性价比还可以的,2023-04-08 11:51:37,5星评论,128GB,浙江
京东物流没得说就是快。晚上下单。隔天中午就到了。非常开心。这个颜色真好看，比白色的款式好看。之前没发现这个颜色这么不错。满意，好评。,2023-04-23 18:55:31,5星评论,128GB,福建
发货超快，次日达，观察很久了，价格比较稳定，服务很满意，最大的坏处就是没有充电器，单独购买，除了这点，都非常满意啦,2023-04-19 21:02:05,5星评论,128GB,山东
从屏幕到续航都非常满意，拍照质量更是没得说，这是我用苹果手机以来最满意的一款。送上两张照片展现一下拍照效果。,2023-04-14 22:49:35,5星评论,256GB,广东
iPhone14 pro，这个手机很流畅，系统好用，灵动岛很灵动，但是实际适配的app还是有限，好用好用，优惠800性价比还是不错的,2023-04-10 22:33:04,5星评论,128GB,江西
用了一段时间才来评价的，120hz刷新率的屏幕用起来很好，感觉很流畅，电池续航也很好，没有网上说的那一些问题，拍照效果非常棒。,2023-04-11 15:11:23,5星评论,128GB,陕西
