content,creationTime,score,productSize,location宝贝收到了，质量很不错，包装精致，材质优秀，比想象中好，送礼自用非常合适，下次继续购买这个是真的好，材料和做工都特别精致，做工真的非常棒，我觉着我可以推荐给我朋友买大无语事件家人们！咱就是说，太好用了，狠狠的爱住了！,2023-04-11 20:12:42,5星评论,256GB,广东
外形外观：好看 屏幕音效：不错 拍照效果：超级赞 运行速度：特别快 待机时间：很长 其他特色：买对了 送家里人的，超级喜欢，紫色很洋气的，完美！！！！！！,2023-04-05 13:10:55,5星评论,256GB,北京
1外形外观：外观设计继承了苹果一贯的高端品质，用料十足，外观大气，单手握感很好。 1屏幕音效：屏幕显示像素也是一贯的好评，观感很好，清晰度很柔和，屏幕用着很流畅。音效超级好。 1拍照效果：拍照这次升级了主摄像头由1200万升级到了4800万像素，确实很实用，摄像保持很清晰。 1运行速度：运行内存刚刚好，但是确实很快，系统很流畅，丝滑。 1待机时间：待机时间一天的话很正常，毕竟电池容量不算太大，但是绝对够用。,2023-04-12 22:30:06,5星评论,256GB,海南
"外形外观：外形很漂亮，很有质感，喜欢这种直角边框设计。屏幕音效： iPhone 屏幕一如既往的优秀，显示很细腻，喜欢了苹果再去玩安卓手机，感觉屏幕很模糊，分辨率不够清晰。现在加入了高刷更丝滑了。拍照效果：比13系更上一层，我平时不怎么拍照。运行速度：流畅无比，纵享丝滑。待机时间：以前13 PM 待机时间很优秀，这次应该更以前差不多。暂时就想到这些，体验一段时间在回来评论。因为本大爷很懒不想每个产品都写好评所以特地写下这个模板，以前不知道~评论可以涨积分，现在才知道好评的重要性，妥妥的每条都评论下，赚积分，下次还能抵现金用。评论80个字以上,可以得到50个积分，我无论买什么东西都会把这个段话复制粘贴下凑够字数。这是第 N 次在网上买东西了，棒捧棒，东西便宜而且质量好,物美价廉，买的省心,用的开心，感觉都买上瘾了,买买买根本停不下来，东西品种多而且又特别全，划算方便，而且实惠，包装很好，而且没有任何损坏，会一直支持下去，好评，下次再来。",2023-04-27 05:56:04,5星评论,256GB,河南
外形外观：总体不错，还是那样的。老传统设计，比我的Nokia 8重了50g，也厚许多。 屏幕音效：不错，高刷。 拍照效果：挺好的，传说中的传中。手机中的战斗机，满足很了快速需要。 运行速度：这个不用说了，苹果原生，不会有问题。唯一卡过一次就是前天，打不开拔号，点拔号进去是白屏了。要重启才能解决。 待机时间：待机的话正常用就是24小时吧，少点就是36小时左右。 其他特色：对比我的Nokia 8重了不少，厚了不少。总休少了不少。希望比我的Nokia8寿命更长，Nokia 8 64g用了快六年了，电池内存不行了，又因工作需要就买了苹果。诺粉or果粉！,2023-04-11 20:13:22,5星评论,512GB,广东
外形外观：简单大方， 屏幕音效：真实干强，自然 拍照效果：高清 运行速度：够用，顺畅 待机时间：一般,2023-04-13 16:11:17,5星评论,512GB,上海
赶上苹果打折降价，接连入手两台14pro，都是新色，紫色和金色。个人觉得还是金色好看，使用感受符合预期，觉得摄像头比较大，放不平，分量也是比较重，压手，不过总体还好，整体满意，物流飞快，好评！,2023-04-09 13:08:10,5星评论,128GB,北京
运行速度：新一代的芯片，玩游戏运行特别流畅。 外形外观：相比上一代实在没啥变化，可能只有镜头模组相比又大了许多，毕竟更高的像素更大的底。 屏幕音效：前置镜头和面容识别都放在了药丸里。屏幕亮度在户外强光下，也能看的很清楚。新增了熄屏显示。 拍照效果：夜景拍照速度提升，等待时间缩短。2X的成像更好，画质有所提升。,2023-04-15 16:24:25,5星评论,512GB,浙江
从XS换成14 Pro，明显重了好多。镜头更加凸出了orz 拍照挺不错。拍视频的话电影模式很好玩，虽然对焦不是特别准确。,2023-04-05 18:01:20,5星评论,512GB,广东
14 pro 的速度还是不错的，手机的摄像头感觉比之前的 XR好了很多，唯一感觉不足的是耗电貌似快了点，不打游戏看视频，大概能用一天，后来开了节电模式好些,2023-04-14 18:55:50,5星评论,128GB,北京
外形外观：买了银色，很喜欢，漂亮 运行速度：浏览顺畅不卡顿 全部好评，我是从12换过来的，总体满意，就是希望电池耐用一点就完美了,2023-04-30 08:22:23,5星评论,512GB,上海
录了开箱视频，完全没问题，安全下车。一开始在金色和银色里面纠结了好久。最后还是选了金色。拿到手就是奶白色，没有原来的那么黄。个人觉得还挺不错的。照片是在昏暗光线下的效果。,2023-04-23 08:50:21,5星评论,128GB,陕西
去年618买的13，绿色的挺好看，价格也很划算，今年又赶上活动价，必须下手，先下单了银色的，看了一下立马退了换金色，都懂的！,2023-04-28 12:01:52,5星评论,128GB,江苏
手机到了，给妈妈买的，她喜欢用苹果，女生的大多数都这样吧，拍照比较牛批点嘛，快递但是挺不错的，就是多个充电头就贵一百多，真有你的苹果20w快充是吧！,2023-04-10 22:49:39,5星评论,128GB,重庆
外形外观：还行吧，看着也就那样，好几代了没啥特色 屏幕音效：还可以吧，看起来也就那样， 拍照效果：好点，比两个摄像头的强点 运行速度：还可以，运行没什么问题 待机时间：一天那样吧 其他特色：没了,2023-05-03 11:18:42,5星评论,256GB,河北
外形外观：黑色颜值不错，边框没有过渡有点硌手 屏幕音效：很好，音质不错，杜比音效还是很香的 拍照效果：人像yyds，3倍长焦稍微能拍拍，比安卓拍照旗舰还是差一些的，夜景欠火候，锐化感人 运行速度：启动速度快，后台留存能力不错 待机时间：双卡亮屏6小时左右吧，正常上班够用,2023-04-27 13:37:06,5星评论,256GB,陕西
外形外观：外观都差不多，感觉过得去，不过小屏的手感确实不错。 屏幕音效：这个不错，可以有。 拍照效果：拍照怎么说呢，只能说过得去吧。 运行速度：这个不用说，苹果的强项，好用不卡。 待机时间：这个一般般，充电大家都懂的。 其他特色：主要就是流畅不卡，其它的嘛，过得去。,2023-04-12 01:35:14,5星评论,256GB,广东
外形外观：基本还是原来的配方，习惯了。 屏幕音效：屏幕有所提升。感觉还不错！ 拍照效果：拍照效果对比13提升真的很小！感觉有时候还不如13拍出来的 运行速度：买回来没升级前经常出现卡顿。升级之后解决了 其他特色：还在使用中。 待机时间：待机一般般，充电还是贼慢！,2023-04-06 16:08:21,5星评论,256GB,北京
外形外观：外观还行吧，仁者见仁 智者见智 屏幕音效：声音不错，屏幕也还行 拍照效果：说实话，拍照这东西，对于非专业人士，没太大感觉 运行速度：速度挺快的 待机时间：没测过，新机器总归会好一点 第一次买苹果手机，还在适应中，图个新鲜感吧！,2023-04-15 18:43:03,5星评论,256GB,江苏
外形外观：好 屏幕音效：好 拍照效果：录像好，拍照一般有点带美颜感觉 待机时间：差不多可以用一天 运行速度：快 用了一 周没有什么毛病，打视频打了一个小时会有一点点烫但不卡，手手速快，拍照要在阳光好的地方才拍得清楚，看了很久这款手机了8099降价了400马上买?,2023-05-01 21:37:00,5星评论,256GB,广西
外形外观：紫色很好看 屏幕音效：丝滑 拍照效果：毕竟三个摄像头像素都是有提升的 运行速度：速度很快 待机时间：还行 从13换到pro 我就是为了紫色和摄像头 13还是很香,2023-04-29 10:45:18,5星评论,256GB,重庆
外形外观：暗紫色真的很好看呀，但是手机有点太重了，摄像头凸出来感觉贼不舒服 屏幕音效：屏幕很不错，顺滑清晰 拍照效果：拍照好像很多功能，还不太会设置 待机时间：新手机待机时间确实不错，充满可以用一天没问题的，看看视频啥的,2023-04-28 11:05:46,5星评论,256GB,河北
外形外观：刚柔并济，像经典 屏幕音效：顺，强 拍照效果：不输安卓 运行速度：强劲有力，不跑手游没办法测 待机时间：常充满 其他特色：比13强，连交通卡都好用了,2023-04-30 06:46:12,5星评论,256GB,上海
手感很好，单手操作方便，屏幕支持高刷新率，OLED屏幕，暗紫色配色挺好看的，送的是type-c转lighting线，需要额外购买充电头才能用，线是支持20w快充。拍照效果挺好的，三摄像头，细节清晰可见，总体不错,2023-04-24 23:15:39,5星评论,256GB,广东
外形外观：手感舒适，重量一只手遮天 屏幕音效：清晰，阳光下看得清 拍照效果：4800w摄像，保留了太多细节，后期制作 运行速度：第二台了，丝滑丝滑的流畅速度 待机时间：一天一冲 其他特色：一切体验感受都靠自己体验过才能评,2023-05-02 23:01:44,5星评论,256GB,广东
外形外观：外观边框有一小点掉漆，联系客服做了一些补偿，另外不得不说，不锈钢边框真的很容易留指纹有压痕，一有压痕就会变暗，反光看起来很难受哈哈哈 屏幕音效：音效非常好，一耳朵提升，对比其他系列，屏幕也舒服多了，之前13闪的眼疼 拍照效果：拍照感觉48mp也一般般，毕竟电子味有点重 运行速度：非常快，大内存真的舒服,2023-05-01 17:46:35,5星评论,256GB,安徽
之前用的iphone三四年了，有点年久失修，，这次买了14，虽然买的时候没有货，不过过两天就有货了，送货还算快，刚用手机，感觉还行,2023-04-13 12:15:41,5星评论,512GB,广东
外形外观：外观方正 相比前几款有棱角? 屏幕音效：音效悦耳动听 拍照效果：拍照很强大 自带修饰功能 高清晰度 运行速度：运行迅速 待机时间：待机略有点短,2023-04-15 15:47:22,5星评论,256GB,河北
外形外观：时尚简洁大方挺好 屏幕音效：目前使用还不错 拍照效果：拍照挺好的！ 运行速度：手机运行速度可以，处理器不错 待机时间：待机时间还是比安卓的差了一点啊！ 其他特色：总之缺点就是信号不好，电池容量不大。优点就是系统强！后期使用后在看看,2023-04-12 21:10:35,5星评论,256GB,广东
外形外观：暗紫色喜欢的颜色 看着比黑色的好看 加点个性 屏幕音效：还行 我耳朵听不出好赖 听个响 拍照效果：跟之前我用的11比 进步很多了 还在摸索中 运行速度：流畅 待机时间：不错 有进步 其他特色：灵动岛就那样吧,2023-04-29 19:29:39,5星评论,256GB,江西
外形外观：酷炫简约大气 屏幕音效：清晰 拍照效果：感觉还行吧 清晰色彩度高 运行速度：还可以 新机都挺快的 待机时间：还可以 一天一冲差不多,2023-04-08 21:48:54,5星评论,256GB,广东
外形外观：小巧比较适合女生用 屏幕音效：高刷确实可以，屏幕清晰 拍照效果：拍照太太太太清晰了 待机时间：待机一般，不知道是不是系统的问题,2023-04-13 08:05:38,5星评论,256GB,四川
拍照效果：画质和上一代基本一致，像素提高了很多 运行速度：新一代芯片，Ios运行很流畅 外形外观：有点重，摄像头过于突出 待机时间：还可以,2023-04-13 08:51:01,5星评论,256GB,天津
外形外观：虽说外观没有什么改变，但是手感还是很好。 屏幕音效：高刷屏幕配合A16玩游戏真的很流畅。 拍照效果：像素提升了不止一档 待机时间：iPhone 一天一充正常的。,2023-04-11 23:55:23,5星评论,128GB,四川
谁会不喜欢14pro呢 外形外观：苹果外观真的很好看 拍照效果：苹果特色锐化效果拉满 运行速度：这个还是很快的，但是有时候也不知道是我网不好，还是怎么了点不上 待机时间：感觉续航时间一般吧 其他特色：灵动岛感觉毫无特色,2023-04-22 11:12:43,5星评论,128GB,北京
"拍照效果：很强,虽然我很少拍照,但是你不能没有 运行速度：目前使用还是比较流畅，没有卡顿 外形外观：摄像头凸起很高，其他没有毛病",2023-04-17 16:29:15,5星评论,256GB,湖南
总体还不错。 本来想等15的超大杯，无奈手机摔坏了，只好提前换机。 pro大小重量都很合适，手小的我用起来很舒服。 电池小了点，习惯Max电量的我，有些不适应。掉电飞快的感觉。不过正常使用一天也够了。 屏幕音效都不错，拍照有提升。,2023-04-11 12:52:16,5星评论,256GB,山东
暗紫色；256GB 做工精细质感上乘，工艺精湛细节无暇，屏幕优秀超清显示，希望下一代能上高频PWM 调 光，扬声器很大声，拍照还可以，上个潜望式 长焦镜头更完美了，系统优化很流畅，功耗控制待机长久，大小合适厚薄适宜，握持舒适手 感不错，信号方面还行，还能更好，京东自营王品保障；综合来说这次购物相对满意，值得 购买！,2023-04-09 13:42:20,4星评论,256GB,广东
手机正品，挺好的，紫色今年新款，不错好用， 外形外观：时尚灵动岛很方便 拍照效果：微距有所提升 待机时间：电池100，还是可以的,2023-04-06 08:21:25,5星评论,256GB,北京
外形外观：外形就是灵动岛联动岛好不好呢，我觉得比原来那个好一点 屏幕音效：色彩要比原来的iPhone 13要跟龙预习很浓郁的色彩 拍照效果：更好的拍照效果 运行速度：运行速度确实快反应速度非常快 其他特色：相比iPhone 14有高刷，但是高刷在省电模式下不能用，所以意义不大待机时间其实也不太好，所以用处没那么大，还有就是三摄，感觉好像也没有太有用了，花了翻倍的价格，实际上比iPhone 14强在什么地方？并非物超所值。,2023-04-20 12:43:53,4星评论,128GB,陕西
用了三年的11终于退休了，试用了三天简单说下，第一重！感觉比11重了好多，跟块砖一样，第二感觉续航没有那么好，也可能太爱不释手玩个没停？总归来说还是OK，系统是真不错，很流畅,2023-04-17 09:09:00,5星评论,256GB,北京
新的苹果14PRO，金色的，从京东自营购买，重量有点沉，比原来用的x重不少，也厚了不少，不过处理速度确实快，APP间切换很流畅，新手机电池自然满分。,2023-05-02 12:46:15,5星评论,512GB,河北
外形外观：外观手感很方正但不硌手，弧形四角的圆润感十足，灵动岛辨识度高 拍照效果：拍照效果不错，有点构图底子就能直出发朋友圈，夜间防抖效果好，没有涂抹感，噪点控制还行,2023-04-18 15:04:55,5星评论,256GB,广东
用了两周了没有发现什么问题，一如既往地流畅，续航提升了不少，拍照也好看了许多，就是拿在手里有点重，灵动岛还需要进一步适配。用一段时间再看看吧,2023-04-12 16:46:12,5星评论,128GB,河北
【优点】拍视频真不错，别人都夸 质感还好 暗黑模式适配的好 【缺点】bug太多啦，真的是太多啦！通知栏都掉帧！ 糟糕的打字体验 王者荣耀帧率想笑，别说这是啥啥啥，反正是这台手机出现的问题,2023-04-05 14:29:05,5星评论,128GB,河南
续航时间确实不太好  但对于不打游戏的人来说还好  手感很棒  拍照是真的清晰  系统也是一如既往的流畅   信号还好没太大的感觉  颜色是好看的奶黄色没有图片那么重,2023-04-16 09:34:39,5星评论,256GB,河南
外形外观：相当的商务风了 屏幕音效：还没开始用 拍照效果：4800w可以说是相当牛了 运行速度：有一说一第一第一 待机时间：后续测评 其他特色：贵贵的,2023-04-05 14:12:43,5星评论,256GB,河南
还是黑色的最好看，最耐看，拿的时间久了也不会觉得腻，磨砂的手感比11的光面玻璃好多了，特别喜欢这个质感，就是边框怕磨掉漆就很丑了，续航一般吧，好像没有11刚出的时候换上的那时候给力，不过消耗品而已，体验还不错，看习惯高刷就再也回不去了。,2023-04-21 22:25:48,5星评论,256GB,甘肃
用了半个月还行，8换过来的，苹果还是耐用原来的充电口不太好了、原来用了5年的诺基亚都没这么好，电池还能接受，一天一冲，外观，拍照升级还是很大的。声音外放有质感，信号和原来的没什么区别不行。,2023-04-18 18:22:10,5星评论,256GB,重庆
超高性能，流畅的系统，优秀拍照体验，握持感很舒服，重量合适，屏幕清晰，就是充电有点慢，相机美颜比较少。,2023-04-26 23:48:49,5星评论,128GB,陕西
手机收到了，京东自营店购买，正品无疑。灵动岛挺好看的，比刘海屏强一些，背面看上去很精致。屏幕高刷，分辨率高，电池续航还行，一天一充，买苹果手机主要还是看生态，整体体验较好，推荐。,2023-04-09 09:14:07,5星评论,256GB,上海
外形外观：完美无瑕 屏幕音效：完美无瑕 拍照效果：略逊于华为旧机 运行速度：快速但不知道怎么有时候会卡一下 待机时间：非常长，有一次没插好充电，20%的电用了11小时(改省电模式)期间上网导航这些都没问题 非常强 其他特色：这辈子都用安卓，人生第一次跳槽到苹果有点担心、幸好除了华为云要慢慢转换外，直接**升级太棒了，从此就晋升苹果粉啦,2023-04-12 20:54:09,5星评论,256GB,中国台湾
物流速度：物流速度快 电池待航能力：手机用的比较勤，目前基本上一天充电一次。 用户体验：个人苹果14不好用，信号不好，接收微信信息卡顿，延迟? 之前手机出来问题，打电话给客服对方也比较有耐心帮我把问题处理好,2023-04-22 20:12:45,5星评论,256GB,广东
信号非常不好，用快充充电时发热严重。其他的各方面表现还是不错的。 外观设计漂亮，尺寸大小合适，包装仔细完整，宝贝手感不错，感觉很好，发货速度快，服务态度一流，给力！5星好评！,2023-04-16 13:44:59,4星评论,256GB,广东
买来拍视频用的，像素挺好的！金色绝绝子！都给我去买金色！奶金奶金的～好好看！而且偏光又有点像银色！买了金色同时拥有两种颜色！戴透明壳也好好看！,2023-04-10 22:56:21,5星评论,256GB,河南
随着智能手机技术的不断进步，手机外观设计也成为用户选择手机的重要考量因素之一。iPhone 14 Pro的灵动岛设计吸引了用户的眼球，这种设计是将前置摄像头和面容 ID传感器等组件嵌入到机身中，并带来了新奇的交互功能，同时也打破了传统的刘海设计。同时，超瓷晶面板也是这款手机的一大亮点。这种材料具有高硬度、高耐磨损性和高透明度等特点，使得手机具有更强的耐用性和更好的屏幕显示效果。,2023-04-20 00:03:02,5星评论,256GB,西藏
第一次用苹果手机，目前用起来比较好，快充1个多小时也搞定了，主要是为了拍照摄影方便，目前只是用了部分功能，无槽点。感觉还不错。,2023-04-29 21:15:39,5星评论,256GB,北京
买给我老公用的 他嫌弃摄像头太大，就留下自己用了。淘汰了自己原来的iPhone 12Pro。实话相机效果真的比12好很多，双卡双待也是赞爆了。目前用来流畅，就是第二天就发现屏幕有个无法修复的划痕 赶紧贴膜上了,2023-04-08 23:28:10,5星评论,256GB,江苏
习惯了一直用苹果手机，上午到手用了半天，没觉得比13pro有多大出奇的地方，续航无优势。运行速度上比13pro快那么一点点。个别app运行没有13pro润滑，信号依旧。也就多了个灵动岛。整体屏幕比13pro好。还是值得购买，本来要等15，只是太多评论说15pro会更贵，等15发布过段时间来看看吧，相信14pro能扛几年，金色就是大爱。,2023-05-02 21:47:01,5星评论,256GB,海南
手机手感不错 紫色也很好看 用了两个月才评价 有点发言权了 发现放在手机壳里以后有地方被蹭掉漆了看来苹果14容易掉漆是真的 其他使用上没什么问题 速度也挺快的,2023-04-12 16:32:44,5星评论,256GB,北京
手机没任何问题，反应速度快，屏幕清晰，运行速度快。唯一就是网络的问题，不过用久了就习惯了，拍照很清晰。,2023-04-08 23:25:19,5星评论,256GB,宁夏
外形外观：紫色炫酷好看 拍照效果：14相机真的不一样，原片直出 待机时间：第一次在iPhone手机感受到出门不用带充电宝的快乐,2023-04-15 21:04:56,5星评论,256GB,重庆
有货 速度? 电话坏了 速度解决问题！   白色的干净、个人喜欢这颜色、 机器挺沉、 手感好、配充电器一起买的,2023-04-21 06:49:00,5星评论,256GB,辽宁
早晨起床打开京东发现前几天加入购物车的iphone14pro有个新优惠券，赶紧下单，本来也是打算618买的，早买早用，下午就送到了，质量应该没问题，京东自营应该靠谱。,2023-04-29 18:05:22,5星评论,512GB,北京
买的14Pro256G，送老婆的礼物，京东百亿补贴活动价格更优惠但是一直都无法下单，没办法只能在京东自营店8099元买了，外形很酷，拍照效果很好，屏幕和音效也很好，缺点：1、电池容量小了点；2、手机很容易发热，比华为的发热要严重；3、还要自己买个充电器,2023-04-05 21:16:27,5星评论,256GB,浙江
白色颜值确实yyds，系统非常流畅，虽然信号看起来不能满格但是在电梯里和小米12su同样用的电信卡对比还是14pro反应快，安卓的感觉有点虚。打算这部手机好好用个几年。,2023-04-05 10:57:11,5星评论,256GB,湖南
不愧是?，非常的顺滑，不过刚从安卓手机过来，还不太适应，是正品新机，没有拆过的，黑色和暗紫色都很好看，充满电玩游戏刷视频一条就只充一次电,2023-04-17 01:08:39,5星评论,256GB,新疆
用了差不多半个月 除了续航 不玩游戏基本一天一充 整体效果不错 很丝滑 考虑续航建议升pro max,2023-04-09 09:33:12,5星评论,256GB,江西
手机质感不错，拍照也牛的，充电速度终于不是以前那种慢的要死的速度了，总体来说很不错，灵动岛打游戏有点烦，老是误触，希望能改进一下，京东物流很快,2023-04-06 22:49:35,5星评论,256GB,浙江
最近两年经常国外跑，国内手机在国外限制太多，许多软件必须要google功能，坚持了两年还是决定需要一个更方便的手机，当然老手机也不能丢，第一次用苹果确实做工精良点，系统流畅但是性价比相对不大优美，反正方便自己就行,2023-04-04 11:23:08,5星评论,256GB,重庆
目前用起来感觉还下雨流畅，不过感觉跟我的iPhone X差不多的很多功能，其实都用不上，主要就是拍照要好一些，然后就是稍微的顺畅一些,2023-04-05 05:58:57,5星评论,128GB,湖南
"客服小姐姐很有耐心,使用一段时间了,系统整体还算流畅,购物感觉还是可以的，跟实体店没有区别，还便宜，喜欢！",2023-04-30 18:13:11,5星评论,256GB,福建
图片上看不到啊，咋摄像头那么高呢，其他方面都还不错，唯一诟病的就是摄像头太高了，套个壳更觉得不搭了，手机还是很好用的，没毛病，配送速度也非常快。总的来说还是得给五星好评！还是很信任京东自营商品的,2023-04-13 16:08:15,5星评论,256GB,广东
手机拿到手，体验了一段时间，非常好，一直使用iPhone所以没有不适应感，只是这个比较重，没有之前的屏幕大，但,2023-05-02 18:14:30,5星评论,256GB,湖北
京东物流没得说，非常快，虽然没有抢到补贴，不过这次购买的价格还算便宜，苹果这么多年，难的有点性价比。机器正常使用，没什么问题,2023-04-12 23:16:10,5星评论,256GB,江西
媳妇挺喜欢，她说灵动岛基本上用不到，瞎用吧，流畅不卡就行，本来想买max的，无奈这代厚度感人，她手拿不下又嫌沉&hellip;,2023-04-23 22:54:08,5星评论,256GB,河北
临时起意换的手机 到货很快 纠结银色和金色 银色没货就直接买了金色 到手颜色还是挺好看的 套上手机壳有点挡颜色了 裸机颜色更美丽,2023-04-21 18:37:43,5星评论,256GB,吉林
在苹果体验店体验过购买的，京东优惠力度真大。pro机身小巧，上手操作方便，颜值高，关键是相机真不错，拍照拍视频好清晰，其他用后在来追评！,2023-04-19 10:18:38,5星评论,256GB,重庆
