content,creationTime,score,productSize,location外形外观：苹果的外观设计没得说，颜值很高 屏幕音效：屏幕显示效果出色，音效也是第一梯队 拍照效果：拍照不咋用，感知不是很强烈 运行速度：搭载a16处理器，运行速度飞快 待机时间：比之前的手机省电多了，一天一充，有时候还用不完nv,2023-02-19 17:26:44,5星评论,256GB,Not Found ip
外形外观：紫色很神秘，在实体店选购时，第一眼就看中了紫色 拍照效果：拍照比较接近真实，非常清晰 待机时间：待机时间，每天冲一次，可惜不支持快充  运行速度：运行速度还不错，之前用的华为手机，还在适应苹果系统中。,2023-02-11 09:28:00,5星评论,512GB,Not Found ip
外形外观：这款设计非常的漂亮，暗紫色非常的好看，总体感觉很好。 屏幕音效：音效杠杠的，听起来非常的舒服 拍照效果：拍出来的照片，非常的漂亮，像素没有打折。 运行速度非常的快,2023-02-25 15:01:44,5星评论,256GB,Not Found ip
外形外观：这不用多说，天生的高级感 屏幕音效：屏幕很顶，音效很赞 拍照效果：这是苹果的最大优势之一，特别是拍视频 运行速度：很丝滑 待机时间：正常使用一天一充，中规中矩 其他特色：信号也算一大&ldquo;特色&rdquo;了,2023-03-05 15:43:59,5星评论,256GB,Not Found ip
以前用的是iPhone12，当时内存买小了，现在用着不方便。就想换一个，在国行版和美版kt机纠结了半天，美版价格真便宜呀，就是有风险。最后在Apple产品京东自营店买的这部iPhone14pro，还买了京东的A+会员。iPhone14pro真机上手效果非常好，很有分量，大小我用正合适。拍照效果杠杠的。,2023-02-20 15:47:49,5星评论,128GB,Not Found ip
手机功能齐全，屏幕尺寸大小合适，拍照功能非常强大， 屏幕音效：声音要比之前有所提升 拍照效果：完美 运行速度：非常快 外形外观：时尚靓丽,2023-02-05 21:47:37,5星评论,128GB,Not Found ip
外形外观：外观延续苹果手机的精致，仍在进步。 屏幕音效：屏幕显示效果细腻，高刷用着舒服，音效很好。 拍照效果：拍照清晰，比之前用的提高不少。 运行速度：运行速度很快，还是一贯的CPU王者。 待机时间：正常使用还可以，可以自己配一个快充。,2023-02-13 19:24:51,5星评论,128GB,Not Found ip
14香很不错，屏幕分辨率很高，看视频很清晰，手机很流畅，尤其是暗紫色，特别漂亮，双扬声器，音量很大，听音乐特别爽快，马达反馈很强，打游戏略微有点发热,2023-03-10 00:26:49,5星评论,256GB,Not Found ip
外形外观：时尚潮流，好看 屏幕音效：屏幕清晰，声音很大 拍照效果：清晰度很高，视频拍出来的效果非常好 运行速度：目前很好 待机时间：不错哦！,2023-03-10 12:26:22,5星评论,256GB,Not Found ip
外形外观：很好拿，握持感一流，手机比较重，很有分量 屏幕音效：顶级屏幕，最爱苹果的屏幕，亮度，色彩都很好 拍照效果：拍照自然不必说，每一年的旗舰都是拍照排行榜的前茅 运行速度：很流畅 待机时间：还行 其他特色：系统很好用，灵动岛很有特色,2023-03-02 23:03:56,5星评论,256GB,Not Found ip
外形外观：好看，大气，黑色yyds 屏幕音效：不错 拍照效果：很好，不失真，不变形。 运行速度：很快，不卡，很流畅 待机时间：不打游戏，能用两天 其他特色：不错。,2023-02-27 16:21:08,5星评论,256GB,Not Found ip
外形外观：优美和谐流线舒适视觉效果好，喜欢直屏手机，自己好贴膜！ 拍照效果：效果一流，颜色一流 运行速度：流畅 待机时间：有进步 屏幕音效：听得清,2023-03-29 17:11:19,5星评论,512GB,河北
外形外观：做工精细质感上乘，用料考究匠心制作，工艺精湛细节无暇，外形时尚外观靓丽！ 屏幕音效：屏幕优秀超清显示，声音悦耳音效超赞，拍照快速效果惊艳！ 拍照效果：拍照快速效果惊艳，电影模式成像超级棒，一秒拍出大片质感！ 运行速度：运行流畅反应灵敏，功耗控制待机长久 其他特色：大小合适厚薄适宜，握持舒适手感不错，信号优化网速较快，系统强悍功能强大，潮流风范高档享受，京东自营正品保障，货真价实质量可靠，物超所值体验良好，五星好评值得推荐！,2023-02-10 09:27:51,5星评论,256GB,Not Found ip
外形外观：外形外观：外观 延续苹果一贯的精致，又增加灵动岛屏幕，很喜欢。 屏幕音效：屏显效果细腻，音质很棒。 拍照效果：拍照速度提升，画质更加清晰。 运行速度：很快。 待机时间：够用。,2023-02-15 11:53:09,5星评论,128GB,Not Found ip
京东的快递非常结实，包装也很到位，这一款苹果14 pro京东的快递非常结实，包装也很到位，这一款苹果14 pro是苹果公司最新的一款产品，pro比普通版的苹果14要多一个金属外框，多一个摄像头，重量也要重一些,2023-02-25 17:35:41,5星评论,256GB,Not Found ip
"外观设计继承了苹果一贯的高端品质, 用料十足, 外观大气, 单手握感很好，屏幕显示像素也是一贯的好评, 观感很好。清晰度很柔和, 屏幕用着很流畅. 音效超级好，拍照这次升级了主摄像头由1200万升级到了4800万像素, 确实很实用, 摄像保持很清晰。，运行内存刚刚好, 但是确实很快, 系统很流 畅, 丝滑。待机时间一天的话很正常, 毕竟电池容量不算太大, 但是绝对够用。",2023-04-01 00:35:39,5星评论,256GB,内蒙古
使用了一段时间了，选择是暗紫色的款，颜色非常的漂亮，低调奢华有内涵！7.85毫米的厚度，206克的重量，拿在手上感觉非常轻便，拍照时的观看视频电影时，画面上的色彩对比非常完美非常深邃的对比度，真的太喜欢了,2023-03-26 16:28:09,5星评论,128GB,江苏
外形外观：一如既往的赞 屏幕音效：不错 拍照效果：很赞 运行速度：挺快 待机时间：还为测试 其他特色：只能说苹果还是可以的。灵动岛蛮绝的，本来想等15的，结果等不及了,2023-02-15 15:23:47,5星评论,256GB,Not Found ip
外形外观：外观设计风格非常好看，手感很好。 屏幕音效：音效比8，11好太多了。 拍照效果：试拍效果挺好的，晚上灯光不足也不影响 运行速度：很细滑，没有任何的卡顿，没有玩游戏，128足够用,2023-02-08 10:01:20,5星评论,128GB,Not Found ip
外形外观：外观上很靓丽，金属边框，很有质感 屏幕音效：屏幕显示出色，非常细腻，色彩的饱和度不错，外放音质动听 拍照效果：14pro的拍照效果非常不错，4800万像素，暗光也很清晰 运行速度：手机运行非常快，A16cpu，120hz的刷新率，加上苹果的系统，真是丝般的顺滑,2023-02-20 10:54:19,5星评论,256GB,Not Found ip
正品，京东就是快，上午下单，下午就送到了? 外形外观：经典苹果风 屏幕音效：很棒 拍照效果：很清晰，4800w不是吹的 运行速度：很快，加上ios独特优化。打游戏杠杠的 待机时间：一天稳稳的,2023-02-09 22:42:13,5星评论,256GB,Not Found ip
外形外观：回归棱角手感 屏幕音效：无瑕疵 拍照效果：超广角和夜拍不错 运行速度：很顺畅，原神完全不卡，也不发热 待机时间：一天一充高强度使用没问题,2023-02-09 22:02:24,5星评论,512GB,Not Found ip
质感上乘，匠心制作，工艺精湛细节无暇，外形时尚外观靓丽，屏幕优秀超清显示，声音悦耳音效超赞?，拍照效果惊艳，运行流畅反应灵敏，功耗控制待机长久，大小合适厚薄适宜，握持舒适手感不错，信号优化网速较快，系统强悍功能强大，潮流风范高档享受，京东自营正品保障，货真价实质量可靠，物超所值体验良好，五星好评值得推荐!,2023-03-20 11:52:19,5星评论,256GB,广东
外形外观：非常的漂亮有气质，相信苹果的水准。 屏幕音效：市面上最好的屏了，没有之一。 拍照效果：不是非常惊艳，但是非常稳定，成片率高。 运行速度：非常流畅。,2023-02-13 19:54:46,5星评论,256GB,Not Found ip
外形外观：暗夜紫低调奢华 屏幕音效：音效特别棒 屏幕色彩完整 拍照效果：像素特别高 运行速度：软件几乎秒开 也不杀后台了 待机时间：续航很强 一晚上掉10%左右 其他特色：可惜刚买第二天就降价500元了 很服气,2023-02-08 11:43:10,5星评论,128GB,Not Found ip
外形外观：外观大气，买的黑色的，永远不过时的颜色，厚重 屏幕音效：高刷屏幕很清晰，音响效果也不错 拍照效果：1200像素都没问题，更何况4800像素 运行速度：运行速度很快，非常喜欢,2023-02-13 18:04:48,5星评论,256GB,Not Found ip
外形外观：银色最为经典，永远不会被淘汰，带什么壳都好看 屏幕音效：音质非常好 拍照效果：拍照效果一绝 运行速度：很快，旗舰机 待机时间：很长差不多一天两冲 其他特色：又大又重割手,2023-02-16 14:39:21,5星评论,256GB,Not Found ip
苹果手机已经使用一段时间了，没有买流行的紫色，买了经典的珍珠白，特别漂亮，尤其在阳光下闪闪发光，苹果手机续航一直都不是很长，每天正常使用得一天一充，我使用手机频率很高，如果用蓝牙拍摄视频工作，一天带不下来，触感丝滑，我觉得是我用过手机里最好的，照相摄像功能特别棒，有广角，视频不卡顿，超满意！,2023-03-18 13:27:49,5星评论,256GB,北京
外形外观：可以 屏幕音效：不错 拍照效果：还行 运行速度：很快 待机时间：还行 其他特色：暂时没有 用了7年的苹果6sPlus终于可以用我媳妇的苹果11了，非常开心。,2023-02-14 23:09:10,5星评论,256GB,Not Found ip
银色也太太太好看了吧！！！！非常好搭配手机壳。然后系统流畅就不说了，主要是拍照啊，我用了俩天了，拍照和拍视频都是清晰版的 xsmax，会显得人比例很好，然后肤色会拍成稍微一丢丢冷色调的，会比较显白，不会黄。重量确实有一点点重的，用惯普拉斯版手机的会觉得还可以，我没下载游戏，这个手机我是买来拍照拍视频用的，非常nice,2023-02-26 11:04:04,5星评论,256GB,Not Found ip
趁着这次降价 买来送人的 他很喜欢 用了这么多年苹果手机 灵动岛是很大的变化 手感各方面感觉都很不错 拍照清晰 快递发货真是速度 隔天就到了 整体感觉很棒,2023-02-15 15:41:00,5星评论,128GB,Not Found ip
挑了很久，最终决定入手银色，趁着有活动，赶紧入手。非常好看，妥妥的高级感。拍照效果非常好，像素很高，运行速度流畅，6.1英寸很适合女生使用，灵动岛很有创意。音质比上一代有了明显的提升。,2023-03-26 18:26:30,5星评论,256GB,广东
手机很好，非常不错，货真价实，价格实惠，拍照很清晰，出去旅游拍的照片超级不错， 拍照效果：非常好 运行速度：好 屏幕音效：好 待机时间：长,2023-02-19 13:45:57,5星评论,256GB,Not Found ip
昨天下的单，今天就收到了。有疑问及时联系售后，很快就解决了。很喜欢现在14pr，小巧又有质感，一如既往的苹果品质，确实值得信赖。 外形外观：很有质感，简约经典 屏幕音效：音质一流 拍照效果：自带的相机还是很有镜头感的 运行速度：快，就一个字,2023-03-12 19:25:18,5星评论,256GB,Not Found ip
外形外观：外形不用说的啦 苹果肯定大家都喜欢 屏幕音效：屏幕很满意 非常喜欢 拍照效果：效果非常好看 拍照巨漂亮 比某些1亿像素好看多了 运行速度：a16非常的nice 必须行业顶尖cpu 运行速度杠杠的 待机时间：就是待机有点不足 一天两充 非常不错,2023-02-07 19:22:40,5星评论,256GB,Not Found ip
外形外观：一如既往的好看 屏幕音效：都很不错 拍照效果：很棒完全比的上相机 运行速度：运行速度很快a16处理器 待机时间：待机时间可以达到一天,2023-03-05 22:42:35,5星评论,128GB,Not Found ip
很满意的一次网购，京东自营iPhone14pro，价格优惠，用软件验机，是新品，22年12月生产，屏幕是三星屏。用国产蓝牙耳机也可以连手机，灵动岛使用很便捷，以后第三方会配合灵动岛，很期待。,2023-02-10 18:53:16,5星评论,256GB,Not Found ip
苹果审美一直很好，金色非常漂亮，14pro升级的4800万像素真的是没的说，拍照很好，运行速度反应很快，用上三五年也不会卡顿的，之前的7P用到现在也不卡，磨砂金真的太好看了，不太高调，看不出明显的金色，也不至于没有特点，非常耐看，好得很！,2023-03-05 16:50:21,5星评论,256GB,Not Found ip
iPhone14Pro黑色，不愧是苹果的手机，质感很好拿在手里很有份量，屏幕很清晰，顶级屏幕，续航时间很长，双扬声器立体感很强，音场很强，音量很大，低音感很足，值得推荐,2023-03-10 00:07:32,5星评论,256GB,Not Found ip
我在京东上买了iPhone 14 Pro 256GB银色的手机，非常满意。手机外观很漂亮很高级，手感也很好。屏幕清晰明亮，色彩还原度很高。拍照效果也很棒，可以拍出细节丰富的照片和视频。性能方面也没得说，运行速度快，不卡顿不发热。续航时间也很长，一天一冲足够用了。这是我用过最好的iPhone了！,2023-03-02 17:46:25,5星评论,256GB,Not Found ip
外形外观：超级好看的。 屏幕音效：非常不错呢。 拍照效果：苹果的像素真的不是盖的，很真实啊。 运行速度：超级快。 待机时间：还可以。 其他特色：我很爱国，但我还是要用这个手机。,2023-03-04 20:31:24,5星评论,256GB,Not Found ip
期待已久的宝贝终于到了，物流很快，服务态度很好，下次还会光顾的。 外形外观：美观大方 屏幕音效：贴合无指纹 拍照效果：像素质量好 运行速度：起飞?感 待机时间：不怎么玩，1天左右充一次。,2023-03-31 20:10:46,5星评论,256GB,广东
拍照清晰 运行畅快 续航很好 通信音质：音质非常好，比iphone11简直不 要好太多 其他特色：灵动岛蛮好用的，慢慢 的第三方app也都在适配，看习惯了感觉比留 海舒服了 品示效果：显示效果很不错，2000 尼特的屏幕亮度白天显示效果确实好很多,2023-02-13 23:10:26,5星评论,256GB,Not Found ip
外形外观：外观真的好看，刘海屏没有了，有个灵动岛，视觉效果很好 屏幕音效：音效很好，立体声浑厚。 拍照效果：拍照太厉害了，绝绝子。 运行速度：运行速度快得很，给力。推荐推荐咱们就是说,2023-02-23 19:36:46,5星评论,256GB,Not Found ip
买给老婆的手机。刚好赶上京东搞活动，非常的实惠，而且送货速度超级快，128G的内存足够日常生活使用了。非常的不错，值得购买。 外形外观：好 屏幕音效：好 拍照效果：非常好 运行速度：快 待机时间：很不错 其他特色：值得买,2023-02-17 01:30:18,5星评论,128GB,Not Found ip
外形外观：大气，做工精细，手感舒服，金属边框设计很喜欢？ 屏幕音效：高清屏幕细腻入微，音效卓越。 拍照效果：4800万像表高清图，每一张都很惊艳，防抖拍摄电影模式广角拍摄都很好用 运行速度：超级流肠，苹果手机没卡过。 待机时间：电池升级待机时间很nice 其他特色 ：灵动鸟设计很不错。,2023-02-12 12:49:52,5星评论,128GB,Not Found ip
外形外观：很不错，喜欢直屏 运行速度：选它不就是为了系统流畅 拍照效果：很长拍照，日常肯定没问题 屏幕音效：还可以吧，比我以前的手机音效好,2023-03-04 12:51:56,5星评论,256GB,Not Found ip
外形外观：炫酷十足 屏幕音效：手感极佳音效无敌 拍照效果：好看 运行速度：非常快，流畅自然，体验感拉满 待机时间：还不错有待实验 其他特色：黑色好看耐看,2023-02-15 19:10:12,5星评论,256GB,Not Found ip
外形外观：摸着很舒服，大小合适，刚好能一个手用 拍照效果：非常清晰，像素真的不错 其他特色：外观的颜色很好看，很喜欢这个紫色,2023-03-16 11:20:52,5星评论,128GB,Not Found ip
外形外观：外形外观：外形很漂亮，很有质感，喜欢这种直会边框设计。屏草音效：iPhone屏享 一如既往的优秀，显示很细鼠，喜欢了苹果秀去玩安 卓手机，感觉屏募很模翻，分k率不r清浙。 现在加入了高元更丝滑了。拍民效果：比13 系更上一层，我平时不怎么拍照。运行速度： 流肠无此，纵享丝滑。待机时间：以前13PM 待机时问很优秀，这次应该更以前差不多。暂时就想到这些，体验一段时问在回来评,2023-02-06 11:33:00,5星评论,256GB,Not Found ip
外形外观：很简约大方的风格，紫色看起来很高贵 屏幕音效：音效很不错， 拍照效果：拍照效果很逼真，很还原 运行速度：还不错，苹果手机一向很好 待机时间：很不错,2023-03-26 17:15:37,5星评论,256GB,江西
外形外观：外观设计很经典，白色耐看！ 屏幕音效：屏幕大小刚好，分辨率很高，音质很好！ 拍照效果：摄像头像素很高，拍出的照片很清晰！ 运行速度：手机一点都不卡顿，反应很快！,2023-03-03 15:09:35,5星评论,128GB,Not Found ip
外形外观：苹果手机一如既往的颜值很高，紫色也很漂亮，优惠期间，值得入手，京东直营店值得信任，至少能保证正品。 屏幕音效：6.1英寸的屏幕，够用。 拍照效果：这个就不用说了，拍照神器。 运行速度：没有卡顿 待机时间：对于我来说够用，和国产品牌旗舰机待机时间差不多。,2023-02-13 14:42:05,5星评论,256GB,Not Found ip
外形外观：非常高档大气 屏幕音效：屏幕高清 拍照效果：视频和照片画质细腻 运行速度：快 待机时间：一般,2023-03-31 18:47:33,5星评论,256GB,北京
外形外观：做工精致，堪称经典 屏幕音效：丝滑、低音有下潜的效果 拍照效果：微距杠杠滴 运行速度：忒快 待机时间：打开全天侯显示比较耗电,2023-02-17 18:36:53,5星评论,128GB,Not Found ip
运行速度：非常流畅 待机时间：待机时间长 外形外观：新款造型非常炫酷 屏幕音效：屏幕刷新率120hz，很丝滑 非常愉快的一次购物体验,2023-03-17 14:32:12,5星评论,128GB,上海
真的太棒了，手感很好，大小正合适，可以单手操控，屏幕也很好，关键是可以常亮，解决以前经常按得问题，去拍照功能太强大了，以后不要相机了，就用14pro就够了,2023-02-23 20:46:30,5星评论,256GB,Not Found ip
外形外观：14pro的外观真的非常漂亮 屏幕音效：音响很棒，看电影很给力 拍照效果：4800w像素，拍照特别的清晰，尤其是夜景 运行速度：运行速度丝滑流畅,2023-02-19 13:00:23,5星评论,512GB,Not Found ip
外形外观：苹果的设计越来越好看了，我很喜欢第2次用苹果手机，我觉得苹果手机是全世界最好的手机。 屏幕音效：音效十分的棒，能听到远处的近处的各种的声音。 拍照效果：我用来这个拍视频4K60帧。 运行速度：速度是比安卓的手机都快，自由切换无卡顿。,2023-02-25 17:59:48,5星评论,256GB,Not Found ip
使用3天，无网传各种问题。总的来水值得拥有。音响效果非常棒，有立体感。续航时间长，这几天使用频繁，一天一充，电量有余。拍照色彩还原度高，灵动岛设计别致，体验很棒。,2023-03-06 10:49:32,5星评论,256GB,Not Found ip
续航比我的12好多了 用起来也很流畅 活动时候买的 没有瑕疵 安全下车 喜欢 拍照也特别清晰 搭配上新买的手机壳 感觉非常不错?,2023-02-17 15:42:58,5星评论,256GB,Not Found ip
外形外观：太帅了，镜头大大了比例在max上可能会舒服点 屏幕音效：一如既往的优秀！ 拍照效果：非常给力，可以拍RAW格式，差不多80M一张l，并且噪点控制的非常好，比我早期的XPRO1还牛逼！ 运行速度：十几年了，一如既往的丝滑流畅,2023-03-07 16:03:52,5星评论,256GB,Not Found ip
外形外观：紫色非常漂亮 屏幕音效：很顺畅，颜色很好看 拍照效果：非常好 运行速度：很快 待机时间：时间长 其他特色：还是苹果的手机非常好用,2023-03-10 21:08:42,5星评论,256GB,Not Found ip
宝贝已经收到了，外形设计好好看，外观灵动岛小巧精致，屏幕大小合适，音响效果比较好，拍照高清，前置摄像头相当清楚，效果杠杠的，高清运行速度很快，非常满意的购物。,2023-03-03 11:27:41,5星评论,256GB,Not Found ip
手机外观是没什么问题，当天晚上下单，隔天就到了手上，各方面的体验都是很不错的。灵动岛太鸡肋了。还挡了部分屏幕。拍照效果很好。运行速度很快。个个感觉和原来的13pro区别不大。就是想换换。好评。,2023-03-15 23:10:55,5星评论,256GB,Not Found ip
外形外观：小巧便携 颜色搭配很独特 拍照效果：图一是今天拍的夕阳很满意 运行速度：嗖嗖快 待机时间：目前还没充电 待机状态暂时满意,2023-02-15 22:07:34,5星评论,256GB,Not Found ip
苹果14确实惊艳！ 屏幕音效：屏幕非常清晰，音质好！ 拍照效果：4800W高像素摄像头? 其他特色：京东发货超级快，精致,2023-02-13 15:29:32,5星评论,256GB,Not Found ip
很顺滑，原封的哟！用起来很不错，第二天就到了自营的安全放心！灵动岛设计比较新颖！音质太好了。赞一个，214活动价格也给力,2023-02-20 21:34:07,5星评论,128GB,Not Found ip
虽然跟13pro比没有提升多少，但提升的很明显，更加强大，丝滑&hellip; 灵动岛设计很新颖，期待更多软件适配灵动岛的交互。 苹果首台搭配4800像素，晚上拍出来的照片更加清晰&hellip; 屏幕只有更强&hellip;，强光下清晰通透。,2023-03-21 10:05:04,5星评论,128GB,云南
外形外观：完美漂亮 拍照效果：效果很好 运行速度：运行流畅，完美无缺 待机时间：待机时间不错日常通勤没问题 屏幕音效：屏幕一个大感叹号,2023-02-12 18:38:58,5星评论,128GB,Not Found ip
外形外观：在新领域的创新，易识别，大气，丝滑 屏幕音效：清晰，舒适， 拍照效果：4800像素，质的突破，前所未有的好 运行速度：120高刷，速度快，稳定 待机时间：教之前有很大提升， 其他特色：新颜色新感觉，灵动岛，焕然一新，给人眼前一亮，你值得拥有好的苹果手机，没回来就迫不及待的换上了,2023-03-06 18:33:14,5星评论,128GB,Not Found ip
用了一段时间后感觉很不错，屏幕非常细腻，很好，看上去非常舒服，，音效也很高，听歌很舒适，值得推荐。早买早享受！14拍照真的很好看！比13强太多啦，拍视频也绝绝子！,2023-03-12 21:45:25,5星评论,256GB,Not Found ip
我买的银色， 很漂亮也很大气， 这代手机握感也硌手， 屏幕素质OK，触感非常流畅， 灵动岛不如意料之中的好，感觉没什么太大的作用。,2023-02-06 12:00:24,5星评论,256GB,Not Found ip
颜值非常好，我特别喜欢这一款，流畅度也非常之快。充电速度也比前几代强的要多，主要是像素特别真。一代更比一代强。芯片也随之增强。音乐放歌特别清脆。响亮，待机时间也比前几代待的时间长了。,2023-03-10 17:35:27,5星评论,128GB,Not Found ip
这手机没得说，特别棒，手感还好，买着舒服用着安心 外形外观：外观漂亮，光滑 屏幕音效：屏幕舒服音效悦耳 拍照效果：拍照速度特别快，舒服 运行速度：速度一直很流畅，所有苹果都这样的,2023-02-22 23:01:07,5星评论,256GB,Not Found ip
送给男朋友的生日礼物，因为工作原因，需要内存大一些，选了1T的，开机运行很顺畅， 外形外观：很有质感，选了黑色，大气一些,2023-02-11 08:56:31,5星评论,1TB,Not Found ip
高端大气上档次， 屏幕音效：屏幕透视性好，清晰度高，声音好 拍照效果：像素高，效果好 运行速度：非常快，操作智能便捷,2023-02-15 14:21:09,5星评论,256GB,Not Found ip
外形外观：苹果现在的外观还是很人性化的，握感也特别舒适 屏幕音效：自从用了高刷屏之后，根本回不去了，高刷屏是真的流畅，音效也很不错 拍照效果：拍照效果不比相机差 运行速度：苹果手机的运行速度一直很流畅，基本不容易卡顿 待机时间：待机时间满足日常需求，一天还是没问题的,2023-02-18 08:36:02,5星评论,256GB,Not Found ip
电池耗电＇用一段时间再评价,2022-11-03 15:44:24,3星评论,256GB,Not Found ip
