content,creationTime,score,productSize,location机器收到了，京东自营速度就是快，不到24小时就收到了，给孩子买的，机器颜值不错，孩子很喜欢，机器充电速度也非常快，oppo大品牌值得信赖！,2023-04-09 22:47:46,5星评论,8GB+128GB,河南
京豆的送货速度是真快。比较了多款机子，最终选择了这款很有性价比的K10。屏幕色彩饱和度高，机子运行速度流畅，很不错。,2023-04-12 12:45:14,5星评论,8GB+128GB,江苏
手机已经收到了，打开挺好的，屏幕挺大的，感觉非常满意，颜值挺高的，颜色也非常好看，物流也很快，非常满意,2023-04-20 08:15:23,5星评论,8GB+128GB,广东
使用起来特别好，买给老公的，屏幕大，声音清楚，比之前的手机好多了，值得购买，赞一个，京东还送了蓝牙音箱，官方送了耳机，赠品也很多,2023-04-27 14:03:44,5星评论,8GB+128GB,陕西
给家里老人买的，老人认准了oppo，对比了很多品牌，很多不同的款式，挑选了x10k 颜值高，品控好，大厂不会出严重问题，反正就是好,2023-04-04 12:26:08,5星评论,8GB+128GB,吉林
买了给爸爸做网约车手机使用的，搜索了一下销量排名第一，屏幕续航都适合，发货快，服务好，直播间还送耳机，自带手机壳数据线等！家里买了好多台oppo手机了，支持，五星好评！,2023-04-26 14:40:55,5星评论,8GB+128GB,广东
挺好的  外观漂亮 是给妈妈买的  这个内存 足够了就是刷视频啥的 性价比非常高  ，到的很快，快递员说给我放超市了 我去拿的时候只看到了赠品 给他打电话  ，又给我把主品送回来的，也很快,2023-04-10 06:16:04,5星评论,8GB+128GB,河北
还是很不错的，给妈妈换的，也比较顺畅，续航能力不错，拍照片也可以，比较性价比很高，比较价格就在这里了，很不错了,2023-04-06 11:08:51,5星评论,8GB+128GB,江苏
收到货后试了一下，很不错，质量很好，值得拥有！五星好评！款式很大方，质量非常好，价钱也很合理真的好喜欢，客服态度也挺好的，值！以后有需要还会来买,2023-04-22 08:03:50,5星评论,8GB+128GB,福建
充电速度很快，待机时间也够用，性价比很高，现在运行还是流畅的，没有卡顿，差不多这样，后续有新体验我再来留言。,2023-04-14 08:29:42,5星评论,8GB+128GB,山西
品质很不错?，性价比比较高的的商品?，用了一段时间了，系统挺流畅的，反应也很快，好评。整体感觉很好，物有所值。后续继续加油吧。,2023-04-08 17:22:35,5星评论,8GB+128GB,河北
不错不错，性价比很高，使用起来比较流畅，颜值也可以，关键是便宜，这个价格比较起来简直是十分划算，尤其是适合年龄大点的老人用。,2023-05-03 09:35:25,5星评论,8GB+128GB,河北
机器颜色很好看，千元机里面不错的机器，隔日就到了，京东物流还是非常快的，试用了一下能满足日常需要，值得推荐。,2023-04-10 22:11:24,5星评论,8GB+128GB,陕西
心心念念的新手机总算买了，完成了一件事，过年的时候就准备买的，机型我都看好了，老爸不要，就搁置了，最近听说旧手机电不经用了，果断给他买个新的，老人家不喜欢网上的东西，认为质量不靠谱，我非要京东购买，希望质量一如既往的好（以前买过几台oppo），不要让我被打脸啊！,2023-04-04 17:39:30,5星评论,8GB+128GB,湖南
京东购物很方便，前一天买第二天就到了。给老人买的手机，运行内存都够用，在使用一段时间看看。新机目前还是可以的。,2023-04-17 10:37:15,5星评论,8GB+128GB,山东
物流特快，从下单到收货，时间还不到24小时！买给老爸用的，他非常满意！需要的亲可以考虑k10x，颜值担当，配置高上网快，值得购买！,2023-04-22 22:13:36,5星评论,8GB+256GB,贵州
买手机到京东自营店买，到货快，早上下单下午到货快快快，～包装严实，手机外观简单大方，运行速度快，拍照图像也很清晰。性价比高，值得推荐购买。,2023-04-10 11:03:32,5星评论,8GB+128GB,广东
给爸爸换的新手机   性价比很好   对比了很多牌子   很不错   手机颜值高   然后充电速度也很快  很满意   京东快递也很快,2023-04-25 16:17:42,5星评论,8GB+128GB,浙江
用了一段时间了，没什么问题，给家里老人买的，性价比非常高，一直用的这个品牌，旧手机和新手机互传资料也方便，推荐购买。,2023-04-13 18:29:45,5星评论,8GB+128GB,内蒙古
手机拿到手外观特别好看，是我喜欢的类型，玩了两天手机还蛮流畅的，不错，然后也买了喜欢的保护套，看着很是喜欢了?,2023-04-04 21:29:47,5星评论,8GB+256GB,浙江
手机已经到了，手感很好，挺流畅的，性价比很高的一款手机，充电速度也特别快，送货速度也是特别快。前一天晚上买的第二天上午就送到了，京东就是给力??,2023-05-01 06:19:04,5星评论,8GB+256GB,河北
外观设计漂亮   上网速度顺畅  千元机的首选产品   以前我都是用华为手机的     现在买的第一款oppo    感觉也很好,2023-04-04 16:22:23,5星评论,8GB+128GB,湖北
手机买了很久，特意过来评价的。国内厂现在做工真的很牛，用着很流畅，反应速度很灵敏，下次还会回购OPPO！给商家，物流都大赞??赞！！,2023-04-25 22:47:12,5星评论,8GB+128GB,广东
婆婆的包被偷了，手机钱身份证都在里面，给婆婆买的，第二天就收到了，京东物流快品质有保障，值得信任。手机够大，用起来也顺手，婆婆很满意。,2023-04-13 12:57:33,5星评论,8GB+128GB,辽宁
给妈妈送的生日礼物，她很开心，刚才还视频教她怎么把数据从旧手机上倒过来，使用简单，物美价廉，很不错。,2023-04-05 00:31:24,5星评论,8GB+128GB,北京
性价比挺高的，昨天手机不小心摔坏了，急需一个新手机救急，室友推荐的，还不错，对于大学生来说这个价格也很好啦,2023-04-21 15:51:49,5星评论,8GB+256GB,山东
京东买手机，感觉这个手机还不错就给老妈买了一台oppok10x手机流畅度很高老年人用也不会卡顿价格比线下要便宜好多，还有价格保护，也不怕老人有不会用的，我这边还可以远程操作，很方便手机手感质感都很不错京东物流送货是真的快！,2023-04-28 10:37:09,5星评论,8GB+128GB,江苏
设备很齐全  给妈妈买的  用着正好合适  千元机里面可以说是性价比最高的  非常不错  很值得推荐,2023-04-15 11:36:54,5星评论,8GB+128GB,山东
真没想到现在国产千元机能做到这种品质。 这个手机是给母亲买的，之前用过华为和红米，用一段时间就会出现各种小问题，这次又到换机的时候查了很多评论，筛选机款之后最终还是确定OPPO K10X，屏幕和电池和竞品差别不大，胜出的是8+128的大内存，还有前后摄像头的参数，所以很快速的就决定了。 这次用了京东以旧换新，还额外优惠了150，师傅上门验机送货，非常专业便捷。 oppo好手机，京东好服务，非常满意,2023-04-28 11:00:51,5星评论,8GB+128GB,湖北
从苹果，华为，小米，三星，诺基亚，飞利浦，魅族等等主流非主流的牌子都用过了，这次终于用到oppo了，希望能用个两年时间吧。要不，下次都不知道该换啥手机给老婆用了。致爱摔坏手机的老婆大人。,2023-04-16 17:19:30,5星评论,8GB+128GB,广东
很流畅，速度很快，颜色也很好看，手感舒适，1000多块钱的手机性价比很高，第一天买下午就收到了，发货速度也很快。值得推荐。,2023-04-13 06:57:28,5星评论,8GB+128GB,天津
宝贝收到 卖家发货快 物流也很强大 客服态度极好 很有耐心 非常喜欢 宝贝真的很好 和图片一致没有区别 物有所值 精美的包装 卖家非常细心 亲身体验这家店 信誉是相当地不错 宝贝质量更像钻石一般 太感谢了,2023-05-02 16:57:44,5星评论,8GB+256GB,山西
想了好久，最终下单买了这款手机?购买过程中有不清楚使用的咨询客服，客服很耐心回复哦，而且讲解很清楚使用方法。早上下单手机，下午就收到了！收到货马上打开使用，用起来一点都不卡顿，手感很好?手机很通畅～以后手机坏还来这里回头购买哦。强烈推荐购买这款手机?经济实惠，很通畅、客服很耐心讲解,2023-04-12 14:03:14,5星评论,8GB+128GB,广西
性价比超级划算，2000价位以下十分耐打。京东物流隔日达，直播间送的礼品等了半个月也收到了。很满意。,2023-04-27 16:54:21,5星评论,12GB+256GB,湖南
非常好，连续买了两台，父母一人一个，明天带回家给他们配置上！ 上周买银色的，有送耳机，昨天买黑色的没有了，小变化，体验不好,2023-05-03 11:14:46,5星评论,8GB+256GB,广东
很好看，手感也不错，这个价值很合适，物美价廉，拍照效果非常好，送给家人的，很喜欢，这个品牌还是很值得信赖?,2023-05-03 21:48:27,5星评论,8GB+128GB,天津
手机完美配色，真的很好，厚度很薄，手感极佳，送了保护壳和贴膜，售后有电话回访，不错，点赞???????????,2023-04-05 07:35:32,5星评论,8GB+128GB,湖北
手机收到了，上午下单，下午口袋了，买给妈妈的，外形设计非常好看，屏幕够大，屏幕分辨率好，拍照不错，非常满意！,2023-04-17 13:57:33,5星评论,8GB+128GB,广东
非常不错的手机，性价比很高，屏幕刷新率很高而且观感也舒服，不是重度游戏玩家的话性能平时打打游戏也足够用了,2023-04-12 11:04:16,5星评论,8GB+128GB,北京
外形外观：整体修长，还是很好看的。 屏幕音效：屏幕清晰，声音蛮大的。 拍照效果：可以满足平时的正常使用。 运行速度：8G运行正常，没打过游戏，买给家里老人用的，蛮好的。,2023-05-03 21:33:21,5星评论,8GB+128GB,江苏
oppo的这款k10x，8+128版性价比超高，oppo的质量很好，品质有保证，系统也很流畅，非常满意,2023-05-03 20:44:06,5星评论,8GB+128GB,四川
找了好久才找到这款适合买给妈妈的手机，买回来已经使用了几天，目前使用没有什么问题，手机背面颜色很好看。,2023-04-23 08:32:39,5星评论,8GB+256GB,陕西
京东快递非常地给力  很快就收到货了  包装也很结实 这个OPPO的k10x是买的第二部了 同样是给家里的老人用的  就是因为上一部用的满意,2023-04-14 11:47:24,5星评论,8GB+128GB,江苏
京东下单，速度非常快，第二天就送到了。京东自营，品质也值得信赖，用起来也很方便，手机功能强大，性价比很高。,2023-04-23 18:13:08,5星评论,8GB+128GB,辽宁
OPPO的手机现在是越来越好用了，最近帮亲人买了好几部。拍照、速度、耐用性方面都很不错。国产品牌值得推荐。,2023-04-13 22:26:26,5星评论,8GB+256GB,福建
外形外观：非常好很喜欢 屏幕音效：很不错我有所值 拍照效果：很不错，拍照效果杠杠的 运行速度：很快 待机时间：理想时长,2023-04-16 22:27:09,5星评论,8GB+128GB,内蒙古
东西不错，还有优惠，可以放心省钱购买，不要犹豫了质量很好，收到货第一时间打开看了，很不错，很满意，还会回购的,2023-04-04 18:18:20,5星评论,8GB+128GB,江苏
非常好用，拍照清晰，电量充足。。。。。。。。。。。。。色彩清晰，老人喜欢。。。。。。。。。？？？。？？？？。。。。？？。,2023-04-19 23:33:50,5星评论,8GB+128GB,北京
宝贝收到了，和实物描述的一样，每年都必买，首先这家，发货速度很快，物美价廉，值得大家放心购买价格实惠，质量杠杠的，非常好的一次购物，下次还来上实物与描述的一样，质量相当好，卖家态度也好，有问必答，发货速度杠杠的，值得购买哦~这个是真的好，材料和做工都特别精致，做工真的非常棒，我觉着我可以推荐给我朋友买~快递小哥不错。服务也很周到，产品真的很赞,2023-04-30 23:59:05,5星评论,12GB+256GB,广东
帮老人买的，京东自营就是快，隔日达。手机非常好，样子也好看。总之京东就是给力。已经在京东买了好几个手机了，没问题,2023-04-14 10:47:07,5星评论,8GB+128GB,山西
手机不错，京东也很给力，前一天下单，第二天就到了，很方便。给老妈买的，希望老人家快速适应，并能够用久一点,2023-04-14 15:39:27,5星评论,8GB+256GB,湖南
性价比很高的一款手机，手感特别好，像素也不错?发货速度杠杠的，昨晚下单今天一早就到了，还在探索中，很喜欢！,2023-04-11 20:46:43,5星评论,8GB+128GB,北京
外形外观：大小合适 拍照效果：拍照清晰，不会失真 运行速度：不卡顿，很流畅 待机时间：充电快，而且可用时间长  这款手机真的是性价比很高，用着舒服，很喜欢,2023-04-07 20:57:23,5星评论,8GB+128GB,山东
外形外观：外观大气时尚，干元机了真是没的说 屏幕音效：6.59的大屏，刷新率也高不会卡顿 拍照效果：后置6400百万，前置1600百万，OPPO手机 一贯的高像素，非常nice! 运行速度：8G运存是真的够用了，游戏体验直接起飞 待机时间：5000毫安的大电池，67瓦的闪充，这种续航 能力还值得怀疑吗？ 其他特色：这款手机绝对是老人和学生党的福利，可以闭眼冲了，最主要的是还送了一副原厂耳机。一家人现在都用的OPPO，一如既往的支持!,2023-05-02 10:49:33,5星评论,12GB+256GB,浙江
外形外观：看着很漂亮 屏幕音效：音效也不错 拍照效果：拍照效果很好，很清晰 运行速度：速度快 待机时间：待机时间长,2023-04-15 22:16:31,5星评论,8GB+128GB,河北
挺不错的一款千元机，这是我在京东上买的第三部手机了，物流也很快，昨天下午买的今天下午就到了，其余功能要等用一段时间才知道，到时候再来追评,2023-04-26 18:49:03,5星评论,8GB+256GB,安徽
宝贝很满意真的很喜欢，完全超出期望值，发货速度非常快，包装非常仔细、严实，运送速度很快，很满意的一次购物,2023-04-09 10:30:03,5星评论,8GB+128GB,江苏
给家里老人买的，性价比比较高，设置了老年人模式父母用起来方便很多，不需要那么复杂的逻辑设置，这个价位非常出色的手机，好评,2023-04-08 16:24:47,5星评论,8GB+128GB,浙江
正品，棒棒哒，价格很优惠，总而言之挺好的，还会再买第一次在网上购买，也是看评价才买的，质量还不错，也很便宜，有需要的朋友可放心购买宝贝已收到?，超级喜欢，颜值高又实用，超级喜欢！???本来还很担心东西不好，拿到手发现完全多虑了，五星好评本来还很担心东西不好，拿到手发现完全多虑了，五星好评宝贝已收到?，超级喜欢，颜值高又实用，超级喜欢！???第一次在网上购买，也是看评价才买的，质量还不错，也很便宜，有需要的朋友可放心购买第一次在网上购买，也是看评价才买的，质量还不错，也很便宜，有需要的朋友可放心购买正品，棒棒哒，价格很优惠，总而言之挺好的，还会再买正品，棒棒哒，价格很优惠，总而言之挺好的，还会再买第一次在网上购买，也是看评价才买的，质量还不错，也很便宜，有需要的朋友可放心购买宝贝已收到?，超级喜欢，颜值高又实用，超级喜欢！???本来还很担心东西不好，拿到手发现完全多虑了，五星好评本来还很担心东西不好，拿到手发现完全多虑了，五星好评本来还很担心东西不好，拿到手发现完全多虑了，五星好评,2023-04-30 11:38:05,5星评论,8GB+128GB,内蒙古
、手机收到了，特意用了几天才来评价，手机包装的很好，时尚方，外观漂亮，性价比很高，质量很好和描述一致，，应速度很快，外观和手感握持都很好，像素高，拍照清晰，,2023-04-22 19:38:13,5星评论,8GB+128GB,北京
物流超级快，我在内存地区也是一样次日到达，非常好，OPPO的屏幕共享功能非常好，适合买回去给老年人或者初学者使用，客服回复也非常快！,2023-04-09 08:14:55,5星评论,8GB+128GB,浙江
服务态度非常好，买的时候没有显示蓝牙音箱的画面后来又给补发一个赠品，手机是给老人买的很轻薄颜色也好看,2023-04-25 12:12:31,5星评论,8GB+128GB,吉林
手机收到，京东物流超快，昨晚下单今早就收到了，这个手机颜色也好看，也不贵，帮姑姑买的，他开心的很啊，,2023-04-12 23:15:19,5星评论,8GB+128GB,福建
外形外观：外观沉着大气，手握感好，单手操作很方便，相机布局合理 屏幕音效：屏幕大，显示清晰，高刷新率，细节展示很好 拍照效果：照片处理效果好，配合各种算法，不亚于单反相机 运行速度：运行速度快，流畅度很好，完全胜任各种多任务环境 待机时间：电池容量大，两天一冲完全没问题,2023-04-26 10:22:24,5星评论,8GB+128GB,广东
".收到了 很满意,音质非常好。看电影时像是整个房间有立体声,拍照效果非常满意,很清晰,电池很耐用,对我这种待机时间将近20小时的人,充满一次电能用2天,这个让我很满意",2023-05-03 15:39:56,5星评论,8GB+128GB,广东
下单后第二天就拿到了，京东物流真的是太赞了，oppo手机质量是一直的好，买了几部oppo了，以后还会支持oppo,2023-04-28 12:04:20,5星评论,8GB+256GB,广西
头天晚上23点下单，第二天早上8点多就送上门了，京东太快了！我家所有人都用OPPO，送给老妈的礼物，80岁的老太太用的贼溜，???,2023-05-02 10:00:51,5星评论,8GB+128GB,天津
现在的京东快递已经这么快了吗？我在内蒙古晚上快11点了，下的单第2天不到11点就收到了，都吓到我了，太快了，手机也不错啊，充电满了可以用10个小时，我是一直在视频直播里面,2023-04-27 18:00:50,5星评论,8GB+128GB,内蒙古
拍照不错，一如既往的好品质，非常喜欢的一款产品，非常棒！o(*￣幔*)o价格很实惠，性价比很高，算是平价好物，会回购的,2023-04-28 10:09:52,5星评论,8GB+128GB,山东
"拿到手用了一段时间，重量真的很轻，质量不错,与卖家店铺描述的基本一致, 没什么问题，性价比也挺高的，在同等的价位里是很划算的，而且卖家发货速 度也快,包装的非常仔细、严实,物流公司运送速度也挺快的,可以说挺满意的一次购物体验吧,",2023-04-30 23:06:29,5星评论,8GB+256GB,安徽
已经用过一段时间了，效果不错?，客服服务有耐心，解答详细，赞一个本来还很担心东西不好，拿到手发现完全多虑了，五星好评好产品、好品质、好服务，宝贝确实值这个价钱，在这给商家点个赞?大品牌！值得信赖的！效果超级好！贵有贵的道理！很棒的商品！,2023-04-16 20:33:19,5星评论,8GB+128GB,上海
发货迅速，晚上快十一点了下的单，第二天早上九点过就收到货了。是全新机，没有拆封。全五星好评奉上！&hellip;,2023-05-02 22:00:58,5星评论,8GB+128GB,四川
?从没想过这么实惠的价格，?能买到这么好的宝贝，?性价比非常高，我很喜欢哦?充电很快，电量也很抗用，给老人买的，特别喜欢！,2023-04-06 20:35:09,5星评论,8GB+128GB,辽宁
上午下单，下午就收到了，京东送货就是速度，手机外观时尚漂亮，拍照效果好，运行速度也很快，待机时间很长，非常满意的一次购物。,2023-05-02 11:09:45,5星评论,8GB+256GB,辽宁
特别特别满意，超级好看，客服很有礼貌，很客气，良心商家，支持！ 屏幕音效：音质很不错，值得购买 运行速度：还是很可以的,2023-04-16 16:42:39,5星评论,8GB+128GB,云南
外形外观：外观很时尚，极光很好看。 屏幕音效：屏幕挺大的，声音也挺大。 拍照效果：拍照效果不错，像素挺高，色彩自然，清晰度不错。 运行速度：目前看运行速度不错。 待机时间：待机时间长。 其他特色：买给老爸的，OPPO还是值得信赖的。,2023-04-30 12:18:59,5星评论,12GB+256GB,辽宁
外形很美。运行流畅。电池很耐用，且充电速度极快。拍照效果尤其好出色。软件设计越来越人性化，操作简单化。值得推荐的手机。,2023-05-02 10:39:54,5星评论,8GB+128GB,北京
很精致，质量非常好，很满意的一次购物。谢谢店家！想买的别犹豫哇！没有廉价的感觉，很高端，特别棒！物流和产品都不错，性价比高，赞赞赞???,2023-04-07 14:38:10,5星评论,8GB+128GB,辽宁
一直很喜欢的Oppo手机K10X终于买到手了，今天非常 的开心 这下子有新手机用了，可以拍下美美的照 片啦，这么优惠的价格能够买到这么好的手机值了!,2023-04-11 19:48:46,5星评论,8GB+128GB,黑龙江
新买的手机挺好用，拍照清晰，功能齐全，感觉这款手机满足应用，颜值也高，商家贴好了膜，手机壳也有。很贴心，买来直接可以用。,2023-04-12 19:27:16,5星评论,8GB+128GB,安徽
外形外观：看起来不错 屏幕音效：不错 拍照效果：后像素很好 待机时间：充一次可以用一天，不用再找充电宝了,2023-04-10 20:48:49,5星评论,12GB+256GB,重庆
手机到了，非常喜欢，外观很好看，手机流畅度很好，千元机中很划算的一款，经济实惠，强烈向大家推荐！！！,2023-05-03 22:16:56,5星评论,8GB+128GB,河北
"这款手机性价比很高,分辨率高，轻便，总之表色很喜欢，试用了几天本评价，京东快递送货超快，次日 达，赞赞赞!",2023-04-09 12:21:56,5星评论,8GB+128GB,天津
外形外观：外形好看，大气 屏幕音效：屏幕很清晰 拍照效果：拍摄效果不错 运行速度：很快 待机时间：5000毫安电池，待机时间很长,2023-05-03 20:18:39,5星评论,8GB+256GB,辽宁
外观做的很鲜丽，系统的应用太多太多,2023-03-10 20:34:12,3星评论,8GB+256GB,Not Found ip
很快就到了，全新正品?，包装很仔细，没有问题性价比非常高?，可以放心购买?，做工非常精致?，值得购买?！,2023-04-12 12:10:09,5星评论,8GB+128GB,山东
发货很快，包装的很好，价格也特别实惠，还有这么多功效也是不错了，值得购。包装没有破损也没有变形 外形外观：完美 运行速度：畅通 拍照效果：赞 屏幕音效：舒服,2023-04-12 19:34:12,5星评论,8GB+128GB,四川
质量非常好，完全超出期望值，发货速度非常快，包装非常仔细、严实，很满意的一次购物，直播间搞活动买的，外观和描述一致，美观实用，材质手感都不错，好评！,2023-04-10 22:41:06,5星评论,12GB+256GB,广东
先说商品质量：产品总体不错，包装严实。再说商家服务：点赞啦。最后点评快递：发货很快。其他就希望店家多多优惠，及时通知老客户，祝生意兴隆。,2023-04-28 15:50:05,5星评论,8GB+128GB,湖北
外形外观：很大气很漂亮 屏幕音效：很好 拍照效果：很清晰，像素很好 运行速度：特别快，一点都不卡 待机时间：时间长,2023-05-01 16:40:45,5星评论,8GB+128GB,山东
实物与描述的一样，质量相当好，卖家态度也好，有问必答，发货速度杠杠的，值得购买哦~真的很喜欢，完全超出期望值，发货速度非常快，包装非常仔细、严实，运送速度很快，很满意的一次购物！终于收到我需要的宝贝了，东西很好，价美物廉，谢谢掌柜的！,2023-05-03 17:35:32,5星评论,8GB+128GB,四川
宝贝收到啦，实物真的好看，价格非常实惠，强烈推荐这款，超级喜欢，价格真实惠，给老人使用非常棒，经济实惠，做工很好，自带贴膜和手机壳,2023-04-29 16:20:21,5星评论,8GB+128GB,北京
外形外观：都很好 屏幕音效：很好 拍照效果：很好 运行速度：很好 待机时间：很好 其他特色：很好   买回来用了一段时间了    挺不错的    续航时间也挺长    值得购买,2023-04-29 09:12:09,5星评论,8GB+128GB,山东
这款手机是不错的。我一直用的是这个牌子。手机拍照自带的美颜，拍出的效果非常好，很讨人喜欢哦，音乐效果好，音质特别棒！硬件配置都不错优化的比较好，同时外观也是很令人舒服的。同时手机的手感也特别不错，用起来也特别的丝滑。总之是一款不错的手机。,2023-04-09 21:29:05,5星评论,8GB+128GB,江苏
宝贝已收到，是我想要的，手感很好，质量也挺好，有问题客服也很快就解决了，态度非常好，一定好评！整体来说还是很不错的，店家服务态度很好，而且质量也很好,2023-04-24 15:48:27,5星评论,8GB+128GB,辽宁
