content,creationTime,score,productSize,location手机手感好， 拍照效果：好，清晰度高 外形外观：好看 运行速度：很快 待机时间：很长 屏幕音效：音乐质感很好,2023-02-28 20:34:09,5星评论,8GB+256GB,Not Found ip
快递速度快，手机样式美观好看，运行速度快，人脸识别开锁速度杠杠滴，超快，非常棒！包装精美，手机质感不错，手感好，性价比高！,2023-03-18 13:31:35,5星评论,8GB+256GB,湖北
外形外观：漂亮，颜色好看 屏幕音效：很好声音很大清脆 运行速度：很快， 拍照效果：很清晰 待机时间：超长 其他特色：新机未开封,2023-03-12 15:39:31,5星评论,8GB+128GB,Not Found ip
手机收货非常快，昨天下单今天就收到了，包装完整，全新手机，内存大，运行速度非常快，拍照也非常的不错，这个手机的颜色也是我最喜欢的颜色，值得购买。,2023-03-14 12:47:38,5星评论,12GB+256GB,Not Found ip
手机速度快。漂亮，质感好，有重量。功能强大，充电速度神速，掉电慢。反应灵敏，快速。价格还不贵。不错不错，两个电信卡能同时使用，不用切换，太高兴了，发货，送货非常快，提前打电话送上楼。,2023-03-18 11:16:41,5星评论,8GB+256GB,海南
外形外观：外观很时尚，而且看着很舒服 屏幕音效：放音乐，通话，屏幕流畅度都迫不及待的试了一下都很好 拍照效果：拍照效果超乎我的想象，很清晰， 运行速度：速度很快，8+128的内存对于老年人够用连年轻人平常用都够用，总之对这个手机的各项指标很满意，下单第二天就到货了，很快，快递员态度很好，京东自营值得信任,2023-02-24 08:56:07,5星评论,8GB+128GB,Not Found ip
极光;8GB+128GB 颜值不错，5000毫安大电池用一天完全没问题，流畅度还可以，是一款很不错的备用机 拍照效果:6400像素还可以吧屏幕音效:音效不错 运行速度:还可以挺流畅的待机时间:一天没问题,2023-03-17 23:21:08,5星评论,8GB+128GB,新疆
给家里老人买的。屏幕大，声音大，显示效果很好。照相完全满足老人需要了。256G存储也足够用了。电池大容量，充电速度快。对于老人来说还是不错的选择，价格也适中，满意。,2023-03-20 10:18:11,5星评论,8GB+256GB,四川
外形外观：外观中规中矩，直屏就是舒服 屏幕音效：显示色彩鲜艳，无漏光瑕疵 拍照效果：中规中矩，完全够用 运行速度：系统流畅操作舒适，UI很友好 其他特色：给亲戚买的，T2X缺货选的这款，很满意啦,2023-02-12 15:51:59,5星评论,12GB+256GB,Not Found ip
手机颜色好看，大气，拿在手上手感好，使用起来，速度挺快，大电量不用天天充电挺好其他特色：手机整体性价比较高；拍照效果：很棒的，手机会自动根据不同环境会补光；电池续航：快速充电，,2023-02-11 22:06:41,5星评论,8GB+256GB,Not Found ip
外形外观：颜值特别高，光线不同颜色也不一样  拍照效果：相机响应特别快，色彩很漂亮  运行速度：12+256嘎嘎快  待机时间：67瓦快充加大电池，续航嘎嘎久,2023-02-04 14:47:38,5星评论,12GB+256GB,Not Found ip
"运行非常流畅,手机拿到手包装完好，超级喜欢！ 拍照效果：拍照非常清晰明亮 运行速度：运行顺畅无卡顿 屏幕音效：高清有质感，音效不错 外形外观：美观大气，炫彩斑斓。 到手使用没任何问题。感谢客服介绍。",2023-02-12 20:24:53,5星评论,12GB+256GB,Not Found ip
很好，我的OPPO reno ACE用了三年，现在依然很 流畅，因为需要买一个备用机，选了很久，选了这款，因为相信OPPO，买了之前还担心相机问题，发现拍照很OK呀，反正我觉得可以，没有评论里有些人说的那么不好，才1000多一点，非常值，就两个颜色可选，网上看的不怎么好看，收到货觉得颜色挺好看。晒图就是这个手机拍的，供大家参考,2023-03-18 12:13:20,5星评论,8GB+256GB,广东
外形外观：高大上 屏幕音效：柔和舒适 拍照效果：非常喜欢 运行速度：无卡顿，运行很快 待机时间：不玩游戏.两天用不完,2023-02-07 16:24:16,5星评论,8GB+128GB,Not Found ip
闪电发货，性能稳定，运行快，高端大气上档次，手感好，很得劲，能快充电池散热性待考察，机身薄，性价比很高，值得拥有，反应特别，，客服服务也很好,2023-03-19 07:28:15,5星评论,12GB+256GB,广西
手机收到了，质量很好，外观大气 外形外观：很满意，做工精致 屏幕音效：有高刷，这个价没的说，一流。 拍照效果：6400万像素，记录生活点点滴滴 运行速度：有8+128的大小，刚好合适 待机时间：一整天没问题,2023-03-12 20:43:17,5星评论,8GB+128GB,Not Found ip
颜值不错，反应流畅，因为不玩游戏，完全满足日常生活需求，拍照也不错，特别是电池，非常耐用，基本上可以用两天，,2023-03-29 10:39:30,5星评论,8GB+256GB,四川
手机很漂亮，运行很流畅，买了好几个oppo，上一个用的k9，这一个是k10x，也很漂亮，上手手感不错，主要是充电，速度相当快,2023-02-28 10:23:12,5星评论,8GB+256GB,Not Found ip
本来想买K9X的，结果刚好K10X搞活动，这个价格比多多才贵几十，必须京东这里下单了，现在的千元机，性能够够了，不打游戏完全够用，大电池加快充，老人和办公用都非常棒，,2023-03-02 13:50:31,5星评论,8GB+128GB,Not Found ip
外形外观：外形高端大气上档次 屏幕音效：音质非常好 拍照效果：像素刚刚滴 这个价位顶配 运行速度：打游戏一点都不卡 用的时间长了也不发烫,2023-02-04 15:26:08,5星评论,8GB+256GB,Not Found ip
从外形来看，前面的屏幕，这款的前置摄像头在旁边了。不会太影响屏幕的使用，后面手机本身的颜色也是渐变色，不会感觉太单调， 运行速度：运行速度很快，没有卡顿情况，内存很大，足够正常使用的， 拍照效果：拍照效果也极佳的。,2023-03-31 02:43:27,5星评论,12GB+256GB,江苏
手机妈妈很喜欢，速度也很快，很流畅，家里已经买了好几个oppo，声音大，颜值高，更新也快，不卡机，妈妈们用，刚刚好哦！,2023-02-23 09:02:33,5星评论,8GB+256GB,Not Found ip
外形很美。运行流畅。电池很耐用，旦充电速度极快。拍照效果尤其好出色。软件设计越来越人性化，操作简单化。值得推荐的手机。,2023-03-24 17:31:46,5星评论,8GB+128GB,北京
外形外观：配色很漂亮，给妈妈买的，这个配置足够用了 拍照效果：拍照很清楚，放大看也不失真 运行速度：速度没有卡顿，用了两天，感觉还是挺流畅的，没玩过游戏，就是日常看看微信看看语音视频 其他特色：充电速度非常快，配的64W快充非常给力，20多分钟就充满电了,2023-02-26 15:51:40,5星评论,8GB+128GB,Not Found ip
外形外观：外观非常大气，很有质感，光面儿很亮。  屏幕音效：屏幕像素很高，音质比较好。 拍照效果：拍照效果白天更好一些，夜间在灯光下像素质量还有待提高。 运行速度：新手机刚使用，运行速度还比较流畅。  待机时间：待机时间充电比较快，具体时长使用后再评价。 其他特色：手机总体评价还比较高，性价比比较高，价格比较合理。通过京东购买，手机质量有保障。,2023-02-26 20:59:01,5星评论,8GB+128GB,Not Found ip
京东自营oppo店老客户了，k系列性价比高。开机试了一下，系统流畅，内存够大，67瓦充电快，目前还没有什么问题，下载安装软件快，赞一个，全五星好评先！good。,2023-03-25 17:53:03,5星评论,8GB+256GB,浙江
1.67w的快充相当快，再加上大电池，彻底解决电量焦虑。 2.ui反应很快，相比手上的mate30，有过之而无不及。 3.屏占比很高，拿在手上不嫌大。,2023-03-15 21:10:46,5星评论,8GB+128GB,Not Found ip
用了一段时间非常好，很喜欢 外形外观：好看，非常喜欢 屏幕音效：非常好 拍照效果：超清楚 运行速度：非常快 待机时间：待机时间挺长的,2023-02-09 13:12:35,5星评论,8GB+256GB,Not Found ip
手机还不错，外观也好看 外形外观：好看 屏幕音效：非常高 拍照效果：很清楚 运行速度：很快 待机时间：持久 其他特色：还可以,2023-03-14 15:42:46,5星评论,8GB+128GB,Not Found ip
外形外观：好看，到手就是高级感 屏幕音效：还不错，声音挺大的 拍照效果：只能说是够用的 运行速度：非常快，丝滑无卡顿 待机时间：使用一段时间在看看，现在很顶,2023-03-04 13:10:51,5星评论,8GB+256GB,Not Found ip
外形外观：很好看 屏幕音效：屏幕很大声音也很大 拍照效果：拍照像素很高 运行速度：运行速度挺快的 待机时间：待机时间很长 买给我爸使用的性价比很高，很适合很好用,2023-02-12 09:59:34,5星评论,8GB+128GB,Not Found ip
手机很好看，买给爸爸用的，对于一个没有用过智能手机的人很友好，操作很容易上手，铃声可以从主题商店选，铃声有很多种可以选，充电绝对快，待机时间长，送的手机壳也很实用很好看，全包型的壳能很好的保护手机，这已经是家里买的第三个OPPOK10X了。,2023-02-14 18:16:25,5星评论,8GB+128GB,Not Found ip
手机性价比很高，屏幕很大，分辨率很清晰，充电速度快，电池容量大，值得推荐 运行速度：很快 拍照效果：很清晰 外形外观：时尚,2023-02-06 17:31:28,5星评论,8GB+256GB,Not Found ip
通话音质很好，人声清晰，声音很大。字体也可以调整很大，有很多小细节地方，都是供中老人用的，细节满满。前置摄像头拍人物很清晰，不错不错。,2023-02-22 21:38:16,5星评论,8GB+128GB,Not Found ip
外形外观：颜色挺好看，手感也不错 屏幕音效：120hz顺滑 待机时间：大电池确实耐用 其他特色：67w快充都普及到千元机了，确实厉害,2023-03-08 12:00:15,5星评论,8GB+128GB,Not Found ip
OPPOK10x极光还挺好用的。67W超级闪充，5000mAh长续航，续航能力杠杠的，充电速度还快，关键是手机不贵，性价比很高。 8GB运行，打开多款软件，也很流畅,2023-04-02 11:46:49,5星评论,8GB+256GB,山西
主用机用的小米10，选个备用机之前看了红米12，质感比OPPOK10X差，价格还要高一些，选了K10X做备用机，用了一天感觉还不错，京东物流也很快，给个赞，,2023-03-11 11:40:29,5星评论,8GB+256GB,Not Found ip
通话质量高，声音清晰很大，字体调整方便，细节满满，，握感舒服，系统运行流畅，黑色不粘指纹，高端大气，充电速度很快,2023-02-08 09:29:33,5星评论,8GB+128GB,Not Found ip
屏幕显示很好，支持120HZ刷新率，流畅度有保证，机身颜值也不错，背板金属材质显得比较高端，还有镭射刻字，这个价位下很用心。cpu日常使用无压力。,2023-03-15 21:40:50,5星评论,8GB+128GB,Not Found ip
外形外观：外观时尚简单大气，线头流畅，与卖家描述的完全一致，非常满意，真的很喜欢，完全超出期望值，发货速度非常快，包装非常仔细、严 实，物流公司服务态度很好，运送速度很快 拍照效果：非常清晰 屏幕音效：音效清晰没杂质,2023-02-12 19:52:14,5星评论,8GB+128GB,Not Found ip
京东速度飞一般的给力！赞赞赞！一天准时到达，开心！包装完美，折箱快感！品牌手机就是强，工艺精，手感舒适，开机运转一切正常，好用。已升到最新系统，满意。充电快速，再也不用怕没电紧张了。正在使用中，以后再来评。,2023-03-05 22:40:59,5星评论,8GB+128GB,Not Found ip
用了一段时间了，续航非常满意，外观中规中矩背面颜色好看，使用挺顺手的，千元机老人用，也不玩游戏，偶尔拍拍照，对于千元的机像素要超出我的想象哈，感觉还蛮清楚的。,2023-02-26 15:57:46,5星评论,8GB+128GB,Not Found ip
外形外观：极光版，好看！年轻时尚  运行速度：不卡顿，不发烫！屏幕刷新很快  待机时间：极速闪充！待机时间长！,2023-02-17 09:18:51,5星评论,8GB+128GB,Not Found ip
这个手机非常好，价格很实惠，质量有保证，送货也很快。 外形外观：外观很不错。 屏幕音效：屏幕色彩很好，音效也不错。 拍照效果：拍照效果也不错。 运行速度：运行速度很快，反应很灵敏。,2023-03-04 16:06:19,5星评论,8GB+128GB,Not Found ip
这款手机太好了。买给我妈用的。外观也比较好看，屏幕也大，拍照效果也比较哇塞，充电效果贼快。运行速度也很快，待机时间非常长。,2023-03-15 21:57:21,5星评论,8GB+128GB,Not Found ip
给小孩买的，连续买了两部，心痛的感觉&hellip; 外形外观：颜色还是这个好看， 屏幕音效：这个价位算很好的！ 拍照效果：还不错 运行速度：一点不卡， 待机时间：大电池随便玩,2023-03-26 08:07:32,5星评论,8GB+128GB,广东
性价比非常高，手机运行速度快，拍照清晰。内存大，机身轻巧，手感好 屏幕音效：好 拍照效果：清晰 运行速度：快 外形外观：简洁大方,2023-02-16 22:32:15,5星评论,8GB+128GB,Not Found ip
全家支持OPPO，性能一直很好，很满意 外形外观：简单美观大方 屏幕音效：清晰明亮 拍照效果：像素很好，清晰明亮， 运行速度：反应很快 待机时间：两天一充电,2023-02-10 08:19:10,5星评论,8GB+256GB,Not Found ip
手机很好用，很喜欢。电池续航能力太强大了，听一天不用充电，而且配置也比较好，256完全够用，价格也非常便宜。预算1500左右的首选机型！,2023-03-17 12:00:52,5星评论,12GB+256GB,Not Found ip
是给老人买的，首先颜值是可以的，虽然老人用，但是也是需要颜值的。容量够用，oppo的手机拍摄一直可以信耐。字体调节也很方便，用起来也很顺手，闪充也很快。值得入手。,2023-02-20 08:36:34,5星评论,8GB+128GB,Not Found ip
外形外观：纤薄纤细，手感很舒服！ 屏幕音效：没想到这个价格能买到这样清晰的屏幕！太赞了！秒杀一切机商！没有对手！ 拍照效果：像素可以的，同级别佼佼者。 运行速度：速度很快，满足父亲的日常使用。 待机时间：电池大，快充快！ 其他特色：真的很让人惊喜！不管是送人还是自用还是备用强烈推荐！,2023-03-13 20:38:19,5星评论,8GB+128GB,Not Found ip
外形外观：颜值高 拍照效果：像素好 待机时间：待机时间不知道多久但充电很快 屏幕音效：音质好 运行速度：新买的肯定速度快喽 其他特色：综合性价比较高，适合爸妈用,2023-02-05 10:13:03,5星评论,8GB+128GB,Not Found ip
非常好看！送给妈妈的，用起来也非常流畅 充电快！很适合中老年人 电池也很耐用，京东第二天就送到了，好评！,2023-02-18 13:18:47,5星评论,8GB+128GB,Not Found ip
外形外观：外形轻薄 运行速度：十分流畅 屏幕音效：感觉不错 拍照效果：非常好 待机时间：待机时间很久 其他特色：不错,2023-03-03 14:08:29,5星评论,12GB+256GB,Not Found ip
外形外观：时尚简约 屏幕音效：音效很好 运行速度：速度比自己买的4000多的手机还快 待机时间：两天没问题，67W充电速度超快的 其他特色：极光炫彩很好看，1000多骁龙695还能兼顾67W闪充和120高刷新,2023-02-12 09:26:04,5星评论,8GB+128GB,Not Found ip
买手机还是在京东上放心，送货速度快，质量有保证。手机外观很漂亮，运行流畅，拍照效果清晰，大电池待机时间长，给家里父母买的，性价比很高，充电速度快，妥妥的好评。,2023-03-21 16:37:42,5星评论,8GB+128GB,天津
外形外观：外形时尚好看漂亮 屏幕音效：屏幕效果显示很棒，音效也不错 拍照效果：拍照效果不错，可以够用 运行速度：运行目前没有卡的 待机时间：待机一天够用，家人很喜欢 其他特色：外形时尚,2023-02-07 01:50:25,5星评论,8GB+128GB,Not Found ip
外形外观：这款手机外形外观设计非常好看时尚不掉价 屏幕音效：屏幕音效非常好，用起来很舒适 拍照效果：拍照效果超棒，像素很高 运行速度：运行速度超快 待机时间：待机时间超长，充电也很快,2023-03-19 20:33:15,5星评论,12GB+256GB,四川
外形外观：这个颜色真的是超级好看，灯光下还会变色，爱了爱了 运行速度：满足日常使用需求是没问题的，高分辨率搭配120hz屏幕，无论是显示效果还是滑动速度都无可挑剔 待机时间：5000毫安电池的加持下续航能力非常的出色 综合来说千元这个价位oppo做的是非常的出色，支持！,2023-03-03 16:37:30,5星评论,8GB+128GB,Not Found ip
oppo的质量确实做的不错，买给老妈用的。她非常喜欢，说比原来那个其它牌子的好用。显示效果不错，运行流畅不卡，待机时间也比较长，充电速度很快。,2023-03-07 07:28:10,5星评论,8GB+128GB,Not Found ip
下单后，第2天就拿到了。内还有手机壳套。是一款性价比很高的手机。 67W充电器给力。照相功能挺好的。内存256g够用。,2023-02-17 18:39:04,5星评论,12GB+256GB,Not Found ip
快递包装严实，送货速度快，色彩非常漂亮，开机运行速度流畅，8G+128G够用了，背部摄像头6400万像素，拍照效果非常好。超级闪充，充电速度非常快。5000mah长续航，基本保持一天的用电了。,2023-04-03 15:52:54,5星评论,8GB+128GB,江苏
拍照效果：很清晰孩子很喜欢 运行速度：8+128够用了1299元子 外形外观：外形精致，简洁，手机带个个原厂膜,2023-02-24 11:30:05,5星评论,8GB+128GB,Not Found ip
家里父母用的也是oppo的手机，这次购买工作备用机，因为要求就是续航能力强，内存够用，不卡就可以了。做了功课买了这款，整体续航很好，拍照也够用，快递送货也特别快，后续换手机还会考虑这个牌子,2023-02-11 11:51:56,5星评论,8GB+128GB,Not Found ip
外形外观：大方优雅。 屏幕音效：声音洪亮优雅有感觉 拍照效果：拍照人像特别好。 运行速度：运行速度很快 不卡顿。 待机时间：一天没有问题。 其他特色：好看。,2023-02-14 16:22:33,5星评论,8GB+128GB,Not Found ip
整体性还可以，就是说送耳机最后又没有！有遗憾！,2022-10-02 19:56:22,3星评论,12+256GB,Not Found ip
外形外观：外形外观很靓丽，做工扎实， 屏幕音效：屏幕显示效果很丰富，音质很棒， 拍照效果：拍照效果很一般，拍照速度很快， 待机时间：待机很省电， 其他特色：价格实惠，运行速度很快。,2023-02-16 22:21:51,5星评论,8GB+128GB,Not Found ip
外形外观：外观好看，大气，颜色很正， 屏幕音效：声音清晰洪亮 拍照效果：拍照清楚， 运行速度：运行速度很快， 待机时间：待机时间长 其他特色：非常适合，物流速度给力,2023-03-11 06:22:38,5星评论,8GB+128GB,Not Found ip
性能还可以，买给老人用的， 外形外观：很漂亮 屏幕音效：屏幕音效：挺好  拍照效果：清晰 待机时间：超长 运行速度：很快,2023-02-18 18:22:33,5星评论,8GB+128GB,Not Found ip
买给家里长辈用的，拿来刷视频之类的日常使用确实好用，oppo的价格亲民，外观也挺时尚。大电池+快充使用起来非常顺手。趁着活动入手的，价格合适。没想到这手机自带手机壳和钢化膜，很贴心。,2023-03-05 20:48:59,5星评论,8GB+128GB,Not Found ip
屏幕音效：很好 拍照效果：很清晰 外形外观：屏幕很大 运行速度：老人用很够用了 待机时间：正常用可以用两天 其他特色：还送了一个小音响和耳机,2023-03-12 20:45:16,5星评论,8GB+128GB,Not Found ip
就这个价位来看，性价比很高了，所有的功能一应俱全，主要还是拍照手机，续航时间还不错，67W快充大大缩短了等待时间 外形外观：手感很好 待机时间：目前来看不错 运行速度：虽说配置是之前的中端，但这个价位很具性价比 拍照效果：像素很高,2023-03-16 11:33:48,5星评论,8GB+128GB,Not Found ip
外形外观：外观好看 屏幕音效：音质清晰，音量好 拍照效果：拍照清晰可辨。 运行速度：运行速度超快。 待机时间：超长的待机时间。充电也蛮快的。,2023-03-02 19:06:21,5星评论,12GB+256GB,Not Found ip
Oppo手机用了好几个了！ 现在手上用的就是Reno系列！ 相信oppo的品质又购入了这部 给家人用！ 打开包装最让我惊讶的就是这个硕大的充电器，比我Reno 的充电器还大！看来这个快充是又升级了，闪电充电真是太香了，消除续航焦虑，又节省时间！关键这个手机比Reno 便宜好多啊！,2023-04-03 19:08:52,5星评论,8GB+128GB,山东
c***e N PLUS &bull; 『 食食食食，脂夜黑、12GB+256GB 我买的最高配，使用起来非常快捷，很流畅，速度很快 就是感觉电池还是不够大，因为刷视频一上午可能就会 没有电，好在这是快充的。充电也很快，半个小时就能 充70%。屏幕也很清晰，送了卖保护壳套，基本不用再 买什么配件，使用了一周，还没有发现不好的地方，性 价比比较高，比较满意。,2023-02-12 16:18:33,5星评论,8GB+128GB,Not Found ip
外形外观：外观好看 运行速度：速度还是很快的，买给老爸用的，不打游戏够用了 待机时间：大电池，待机时间挺长,2023-03-22 18:49:33,5星评论,8GB+128GB,上海
手机外形很漂亮，大小适中，手感不错。运行速度很快，内存足够用，用起来比较合适。千元机内很推荐的一款手机。手机指纹识别人脸识别也很方便。性价比很高。手机适用人群较为广泛。,2023-03-19 09:58:09,5星评论,8GB+256GB,河北
感觉oppo的手机做的很好。家里都用的oppo。老人手机坏了，又换了个oppo。屏幕清晰，反应很灵敏。而且是快充。一会就充满电。京东也很给力。前一天下单，第二天就到了。不耽误使用。价钱也比实体店便宜。,2023-02-21 08:14:42,5星评论,8GB+256GB,Not Found ip
京东物流一如既往的快，物美价廉，推荐购买，哈哈哈 外形外观：漂亮 屏幕音效：质感不错 拍照效果：给妈妈买的，完全够用 运行速度：不错,2023-02-08 17:18:50,5星评论,8GB+256GB,Not Found ip
给女儿买的，因为疫情原因，年前买了半个月一直没到货。客服特别有耐心的给一一解答，虽然是在线上购买，感觉到了客服宾至如归，给客服点赞?女儿特别喜欢，还跟我说这回内存256G内存强大，可以多给自己拍照片啦。还经常喊着她的闺蜜跟她打游戏。打游戏也特别顺畅哟。,2023-02-11 00:06:47,5星评论,8GB+256GB,Not Found ip
一直在京东买手机，以前没用过oppo手机，自从我老婆用了oppo之后，也毫不犹豫买了，还真的不错，颜值高，手机很流畅，当天下单，第二天就收到了。客服态度也好，服务非常周到，感谢,2023-02-23 07:15:35,5星评论,8GB+256GB,Not Found ip
当天下单第二天就到货了 很适合老年人用 屏幕大 字体大 老年人看很方便 拍照效果也足够 手机出厂就贴了高清膜 还带保护壳 拆开即可用,2023-02-26 11:30:06,5星评论,8GB+128GB,Not Found ip
它的续航能力很出色，外出一天，都是有电的，无惧电量的压力。搭载更强悍的系统，运行稳定，加载速度更快。而且它还能很好地散热，玩游戏、充电等，都不用担心手机会发烫，手感更清凉。高清音质，带来别样的体验感。,2023-02-07 00:16:41,5星评论,8GB+128GB,Not Found ip
外形外观：手感非常好 给老公买的他很喜欢 拍照效果：6400万像素 拍照效果完美 屏幕音效：大屏幕用起来方便 追剧 太爽了 运行速度：运行速度快,2023-03-18 21:30:13,5星评论,8GB+128GB,广东
手机非常好用，流畅运行，反应速度极好，充电时间很短，是一款全新的创新手机，音效都是刚刚的，外观漂亮，家人很喜欢，等到用过一段时间再来评价！希望越来越好！,2023-02-14 08:09:24,5星评论,8GB+256GB,Not Found ip
母亲的手机都是5年前的了，卡的很，还是oppo的，正值母亲节，就准备给她把手机换了。因为以前也是oppo的，系统一样就没换牌子，看到这个价格和配置都不错就果断下单，然后旧机换了还省了，很棒。,2023-03-06 18:54:34,5星评论,8GB+128GB,Not Found ip
