content,creationTime,score,productSize,location外形外观：淡粉色清爽很漂亮 屏幕音效：不错 拍照效果：各种滤镜根据自己需要很好调节 运行速度：本人不打游戏，日常用够了 待机时间：今日刚收到等用几天再追评 拿到手玩了十几分钟电池发烫，赶紧关屏，过了几分钟不烫了。再试用几天看看。 京东的物流真的很快！,2021-09-24 21:59:38,5星评论,256GB,Not Found ip
纯正的颜值担当，因为手小买的mini，大小非常合适，一键装机一小时搞定新机器，棒,2022-07-23 15:58:10,5星评论,256GB,Not Found ip
13比原来的升级很多，电池耐用多了，系统也快很多，以后没mini了，还是很怀念的,2021-11-06 09:33:58,5星评论,128GB,Not Found ip
外形外观：小巧精致很适合女生用 运行速度：很灵敏反应很快,2021-12-10 08:52:11,5星评论,128GB,Not Found ip
非常划算，有优惠，有了很多大手机，突然很怀念之前的iphone4，确实很经典的设计。小小的很方便单手拿，iOS的操作系统使用的也很习惯，当然了，我也有华为同时用，所以 支持国产。,2022-06-11 23:59:53,5星评论,128GB,Not Found ip
物流非常快，包装完好，发货速度快 外形外观：简介大气，非常耐看 屏幕音效：音质优秀 拍照效果：拍照效果清晰 运行速度：运行速度绝对顶流,2022-04-13 16:17:01,5星评论,128GB,Not Found ip
外形外观：合适 屏幕音效：提升了不少 拍照效果：好 运行速度：快的。 等来等去终于抢到了粉色款，手感不啊错了，颜色也非常耐看的，系统升级了，续航能力也得到了提升了，。,2021-11-06 22:50:12,5星评论,128GB,Not Found ip
外形外观：mini手感无敌，时不时就想拿在手上把玩 屏幕音效：没翻车，无绿屏偏色现象 拍照效果：电影模式很惊喜 待机时间：轻度使用一天一充完全没问题，续航很满意,2022-03-05 15:39:17,5星评论,128GB,Not Found ip
外形外观：奈斯 屏幕音效：完美 拍照效果：不输安卓旗舰机 运行速度：非常快 不愧是苹果A15仿生处理器奈斯 待机时间：正常使用一天 其他特色：声音好听也特别大声,2023-03-12 07:55:33,5星评论,128GB,Not Found ip
宝贝收到啦，实物真的好看，价格非常实惠，强烈推荐这款，超级喜欢 外形外观：大小适中 屏幕音效：鲜艳 拍照效果：一绝 运行速度：飞快 待机时间：挺长,2022-02-15 10:07:18,5星评论,128GB,Not Found ip
这个迷你版的就是好用，以前那个手机都太大了，我们不玩游戏，这个刚好 ，省得口袋里放不下，抓手里还嫌麻烦，而且价格也适中，性能也不错，关键运行速度真的很快，不像以前的，卡到你怀疑人生了！！！,2022-06-13 12:23:02,5星评论,128GB,Not Found ip
phone 13 Pro 做工质感：很精致，开封拿取都很有仪式 感。 触摸手感：官方的壳果然没得比，手感极好，不粘手，拿在手里很舒服。 颜色外观：磨秒黑，有深度。 防摔性：不测试了，不怕一万就怕万一 适配性：完美！ 收起,2022-12-01 22:19:02,5星评论,128GB,Not Found ip
还没有激活，给老婆用的，很喜欢，手感超级好??！很适合女孩子用。,2022-07-29 16:31:13,5星评论,128GB,Not Found ip
刚到手的机子，心情很激动? 手感很不错??整体效果看起来很舒服 新一代的芯片速度很快?? 用起来轻轻松松，很顺畅 屏幕显示效果很清晰，画面感很强?? 而拍照效果也非常不错??像素高，很清晰??,2022-01-02 13:52:43,5星评论,256GB,Not Found ip
手机很好，是正品 配送速度很快，隔天就收到了 迷你很轻，单手操作666，电量也还可以接受，普通拍照很ok，拍远距离的放大的还是不如华为,2021-11-25 23:03:50,5星评论,512GB,Not Found ip
外形外观：漂亮，小巧，很适合单手拿在手上 屏幕音效：清晰 拍照效果：拍照还行 待机时间：待机时间可以管一天，还不错 运行速度：新手机，当然速度很快，哈哈,2022-08-28 18:28:04,5星评论,128GB,Not Found ip
迷你的手感真是不错，大小正好，适合单手操作，颜色也很美丽，比别的大手机好多了，系统优化很好,2022-01-21 16:00:01,5星评论,256GB,Not Found ip
小屏幕，单手操作没有问题，很轻盈，感觉前所未有的轻松。颜色很漂亮，爱不释手，当然要套透明套。信号快。,2022-03-11 07:37:12,5星评论,128GB,Not Found ip
手机到货很快。小小的，掌握起来很方便，非常喜欢,2022-10-21 21:52:47,5星评论,128GB,Not Found ip
东西昨天已经收到了，等了一个礼拜不到，苹果13mini比想象中的还要小，真的很小巧可爱，适合女生使用。外观比较典型的苹果风格。速度非常流畅，ios不是盖的。,2021-09-26 12:02:07,5星评论,256GB,Not Found ip
真的非常棒的手机，系统非常顺畅，屏幕也非常细腻，用起来高端大气上档次，用一段时间看看,2022-07-29 21:02:44,5星评论,256GB,Not Found ip
外形外观：苹果的外观不用多说，安逸 屏幕音效：完美无缺 拍照效果：不知道应该不咋地 运行速度：杠杠滴不解释 待机时间：顶两个12mini 其他特色：香,2022-04-08 23:22:53,5星评论,128GB,Not Found ip
外形外观：小巧可爱 屏幕音效：顺滑声音好听 拍照效果：像素很高，自拍好看的 运行速度：很快流畅 待机时间：差不多一天,2022-11-10 19:42:13,5星评论,256GB,Not Found ip
非常好看的颜色，小巧精致可爱！！！！！喜欢的不要犹豫啦！实在是太好看了哈哈哈哈！！！！！！！冲冲冲,2022-11-06 19:08:27,5星评论,128GB,Not Found ip
外形外观：外形尺寸有点小，适合手小的 屏幕音效：音效很好 拍照效果：拍照非常清晰 运行速度：很快 待机时间：中度使用的话一天一充没问题,2022-07-18 07:47:08,5星评论,128GB,Not Found ip
京东送货快。全新正品。师傅先电话联系，上门收取老手机，再进行新手机同步。服务态度非常好。非常好的服务体验。屏幕比我iphone6的长点，手感和重量都很好。,2022-07-24 12:55:57,5星评论,128GB,Not Found ip
一句话评价iPhone13mini，是一款性能强劲，使用丝滑流畅，机身体积小巧，能单手操作，非常方便携带的小屏幕旗舰手机。 芯片上 iPhone13mini用的A15芯片，iPhone13mini的性能也优于绝大多数旗舰机。 机身尺寸屏幕上 5.4寸的屏幕实际上并不算太小，今年缩小的刘海，屏幕观感更佳。 摄像头系统上 iPhone12Pro系列上的摄像头系统也下放到了iPhone13mini上，尤其是夜拍效果更好，摄影的可玩性更强。 电池续航上 iPhone13mini的电池续航时间更长，甚至优于iPhone12。 一句话总结:如果你需要一款性能强劲，电池续航给力，又十分便携的小屏幕5G旗舰机手机，就买iPhone13mini。,2022-02-18 11:37:42,5星评论,256GB,Not Found ip
手机收到了，外观特别的好看，精致小巧，拿着很方便，苹果系统的流畅度没的说，必须好评！哈哈哈,2022-08-09 15:43:13,5星评论,128GB,Not Found ip
外形外观：外观小巧 最强小屏旗舰机 屏幕音效：音效可以双喇叭 拍照效果：拍照效果完美电影模式无敌 运行速度：处理器速度很快 待机时间：待机时间一天全玩没问题,2022-08-24 15:10:49,5星评论,128GB,Not Found ip
老公很喜欢，他说这款的大小最合适，是一手可以掌控的，太大了反而不好操作！,2022-11-13 15:07:38,5星评论,128GB,Not Found ip
外形外观：小巧便于携带！ 屏幕音效：屏幕清晰，音质很好 拍照效果：很好 运行速度：快 待机时间：一般,2022-07-18 16:43:00,5星评论,256GB,Not Found ip
外观非常精致，大小合适，单手操作非常舒服，屏幕显示效果也很好，色彩还原非常满意，系统很流畅，商家活动给力，性价比很高，商家发货速度很快，第二天就收到,2022-03-17 15:16:15,5星评论,128GB,Not Found ip
买来送给家里人的，用着挺好的，颜色也很好看，然后大小很迷你，但是感觉用网比12好&hellip;,2022-08-23 15:05:58,5星评论,256GB,Not Found ip
外形外观：包装非常牢固，方方正正 小屏手机完美 屏幕音效：完美 外放不错 拍照效果：清晰度可以 运行速度：系统真心太快了 非常省电,2022-01-04 17:38:27,5星评论,128GB,Not Found ip
外形外观：外观十分好看迷人魅力大 屏幕音效：屏幕十分mini音效质感也好 拍照效果：拍照效果真的超级好看 运行速度：运行速度极快,2022-01-13 03:12:11,5星评论,256GB,Not Found ip
宝贝收到了，质量很不错，mini单手好拿，比想象中好，送礼自用感觉都非常合适，下次继续购买，宝贝收到，包装也很到位，很喜欢，大品牌值得信赖,2022-04-10 10:08:01,5星评论,128GB,Not Found ip
外形外观：小巧 单手可控 方便携带 拍照效果：多了个广角镜头 夜景也不错 运行速度：流畅度很高 待机时间：本来以为待机时间会很短 其实还好 正常使用一天不充电也没有问题,2021-10-16 07:36:03,5星评论,256GB,Not Found ip
质量很好，用起来很流畅，屏幕也很清晰，尺寸小，用起来手感也很好，系统也很流畅，支持京东,2022-06-12 15:37:17,5星评论,128GB,Not Found ip
比对了很久以后，决定入手这款mini，京东购物，就是快快快！上午下单，下午就到了，我买的墨绿色的，颜色很好看，手感特别好，适合手小的人使用，没有贴膜，没有弄外壳，要的就是最真实的感触！,2022-03-26 22:21:55,5星评论,256GB,Not Found ip
外形外观：好的很，非常好，相当的好 屏幕音效：好的很，非常好，相当的好 拍照效果：超清，然后相当的清楚。不错 运行速度：非常快，快到飞起。,2023-03-23 08:47:31,5星评论,128GB,山东
手机真的超级好用，颜色也很好看， 拍照效果：拍照效果非常棒， 运行速度：运行速度特别快，后台不卡。 屏幕音效：按键音效不刺耳,2022-04-27 20:27:36,5星评论,128GB,Not Found ip
红色小屏，是我需要的，颜值很高，单手很好把控。关注了很久，趁618搞活动，果断入手。把以前的果6s数据全部转到新手机里，很快很方便。新手机反应快，比果6s快不是一点点，赞一下。,2022-06-12 12:45:50,5星评论,256GB,Not Found ip
疫情在家隔离期间，无聊买个苹果13mini来用用，质感很好，从4s到6s，还是喜欢主角边框的，否则买个se3更实惠，听说下一代14就没有mini了，就买了款3月刚上市的13mini，4月中旬下单，5月1日到货，20日激活，质量有待时间的考验。,2022-05-21 16:00:26,5星评论,128GB,Not Found ip
手感不错，支持单手操作，功能强大，尤其是拍照功能非常满意。,2023-01-01 15:27:11,5星评论,256GB,Not Found ip
京东客户端自营店购买的商品质量非常不错的选择。这个产品送达时间很快，价格比较高， 外形外观：可以 屏幕音效：可以 拍照效果：可以,2022-07-19 18:10:05,5星评论,256GB,Not Found ip
很可手，小手肉手的福音！小女生最爱！,2022-09-20 19:09:37,5星评论,256GB,Not Found ip
心心念念了好久终于下手，是我喜欢的小屏手机没错了，续航确实拉胯一些，但其他方面确实很满意。,2022-10-11 13:13:43,5星评论,256GB,Not Found ip
红色的上手效果特别好，侧面是磨砂质感的金属，颜色也是特别正的红色，对比白色来看，白色虽然经典但是就有点清淡了，另外 mini 的手感也是一如既往的绝了，非手机重度用户一只手操控的手感，加上改进的续航，非常香了,2021-11-20 10:59:23,5星评论,512GB,Not Found ip
首先说手感，mini手感无敌，虽然屏幕比13小，但是胜就胜在手感。很多人买mini就是因为喜欢她的尺寸，我就跟中意这个大小。拍照和续航我觉得和13差不多，运行速度也很流畅，很喜欢装口袋不影响美观。,2022-01-20 14:30:11,5星评论,256GB,Not Found ip
10号凌晨12点拍，粉色要北京调货，12号下午收到了。买给爸妈的，iPhone 7到13 mini完美过度，OLED屏幕色彩真好看。只是系统15.0.2，现在最新是15.4.1了，看来是库存好久了。粉色颜色非常淡。新旧机数据传输很方便。,2022-04-18 20:39:47,5星评论,128GB,Not Found ip
外形外观：就喜欢迷你这样的小屏手机 手感正好 屏幕音效：给力 分辨率刷新率都是性价比很高的 拍照效果：平时本人也就用手机扫码啥的 绝对够用了 运行速度：这个处理器就不用多说了吧 用个三五年不成问题,2022-08-19 16:59:43,5星评论,128GB,Not Found ip
太喜欢小mini啦！入手一周来说说自己的体验吧，手感一流，小小的一个握持感非常好，图二是和mate30的大小对比。我不是果粉，这也是第一次购买苹果手机，作为一部手机来说，系统挺流畅的，一些功能也比较人性化，比如可以设置敲两下后背，自动锁屏，另外，隐私方面做的比较好，可以拒绝app弹出通知，追踪位置信息等。自己对苹果手机几乎没有了解，也没有情结，真的是完全看颜值买的，所幸到手后没有失望，目前mini还是作为备用机使用，所以还是很满意的！,2022-02-18 11:07:18,5星评论,256GB,Not Found ip
Apple iPhone 13 mini (A2629) 128GB 粉色 手机 支持移动联通电信5G，买给侄女的新年礼物，她非常喜欢，简直爱不释手，这个小mini非常适合手小的女生，一只手轻松操控，颜色也是女孩都喜欢的粉色，萌粉萌粉的，非常漂亮，拍照清晰逼真，系统流畅不卡顿，屏幕靓丽显示细腻，iphone还是一如既往地好，不愧为手机界的标杆，无可撼动。,2022-01-10 18:04:27,5星评论,128GB,Not Found ip
手机小巧精致 ，拍照效果也特别好，运行速度很快，很喜欢,2022-12-12 17:14:18,5星评论,128GB,Not Found ip
很喜欢mini，很好用很舒服大小合适！ 屏幕音效：屏幕用惯了觉得其他手机的太大了 拍照效果：还好，赶紧锐度比较高呢 运行速度：实际体验较pro还是很明显的 外形外观：喜欢喜欢喜欢,2021-11-20 14:31:36,5星评论,256GB,Not Found ip
外形外观：非常美观好看 屏幕音效：也非常美妙 拍照效果：非常清晰美丽 运行速度：特别流畅，特别快，非常满意， 待机时间：非常好，时间特别长，一下可以用好几天，特别理想 其他特色：每次都用苹果，确实很快！,2021-11-08 18:41:34,5星评论,128GB,Not Found ip
小13用的很开心，尺寸合适，一手掌握，相机也是满意的超级棒。系统很流畅，没有任何卡顿。总之，很喜欢。,2022-02-23 13:39:55,5星评论,128GB,Not Found ip
苹果13mini这款手机外观设计非常轻薄，搭载苹果最新 Apple A15芯片，满足大多数人日常性能需求。并且苹果这次推出的新款13mini支持终于用上了高通的X60基带，信号问题也得到了很好的解决。 另外，值得一提的是，苹果13mini防溅、抗水、防尘功能非常好，苹果官方称 iPhone 机型可在深6米的水下停留时间最长可达30分钟，苹果13mini的价格美丽，因此 iPhone 13mini在小屏手机市场的销量也非常俊俏。,2022-03-11 12:52:57,5星评论,128GB,Not Found ip
原装正品行货，速度很快内存很大，128版本，内存够用。,2022-11-11 10:44:38,5星评论,128GB,Not Found ip
外形外观：我以为星光色没抢到是遗憾，其实一体感超强的午夜色也很不错，可惜有点指纹收集器。手感真的拉满了，我已经很久没有体会过一手握住手机的掌控感了，太舒服了。 待机时间：续航真的顶，比我想象中要好很多，中度使用感觉没有问题 运行速度：没什么好说的，A15默秒全  总体来说这是真正的小屏旗舰。,2021-10-16 23:40:48,5星评论,128GB,Not Found ip
嗯，A15芯片名不虚传，用起来速度非常快。而且mini 用起来非常小巧，放在口袋里一点儿也没有负担。电池续航也比12mini好了不少。非常满意。,2021-12-21 19:06:34,5星评论,128GB,Not Found ip
新手机，容量很大，用起来很快，物流很快，验货签收，确保手机没有问题才签收的，不错的手机。,2022-08-21 18:59:03,5星评论,512GB,Not Found ip
外形外观：星光色很好看，手感非常舒服 屏幕音效：音效也不错，屏幕分辨率很高 拍照效果：拍照真的是很不错 待机时间：刚到手两天感觉待机时间还可以， 运行速度：除了偶尔网速慢点其它还好，使用中，希望十三香真的香！,2022-06-04 18:53:04,5星评论,256GB,Not Found ip
刚买就开始送***，还优惠四五百，伤心透了,2022-02-01 14:32:41,3星评论,128GB,Not Found ip
外形外观：圆形边框换成了直的，握感好了不少，一只手也能拿稳了，媳妇很喜欢。 屏幕音效：苹果的手机一直都挺好。 拍照效果：还不错，有提升。 运行速度：快啊，比11要快不少感觉。,2021-10-18 16:49:33,5星评论,128GB,Not Found ip
外形外观：粉粉的，小小的很可爱。 屏幕音效：音质非常不错，电话铃声不像华为那么震撼 拍照效果：很好，图三是用它拍的月亮，大爱！ 运行速度：速度感觉一般，可能还没用习惯吧~ 待机时间：电池消耗比较快,2021-11-17 23:51:33,5星评论,256GB,Not Found ip
新机，优惠券，安全下车，手感不错，白色很好看，色像头换了个位置真是创世纪般的技术革新，真是百年未有的科技成果，五千年人类文明的浓缩精华，值得点赞?,2022-04-14 14:39:07,5星评论,128GB,Not Found ip
外形外观：外形非常漂亮！大方！ 屏幕音效：屏幕小巧，非常喜欢小屏幕才买的mini 拍照效果：拍照效果一绝！  运行速度：苹果不会卡，打算用五年,2022-01-31 10:38:24,5星评论,128GB,Not Found ip
手机已经收到了，很漂亮。给我老婆买的很喜欢，刚上市第一时间就入手了，大小刚好。,2021-09-27 10:50:11,5星评论,128GB,Not Found ip
小巧好用，续航优秀，发热控制良好。比起iPhone pro Max的尺寸非常便于单手操作。苹果系统流畅度和便捷性，经过使用期间的充分探索，相比于Android平台要优秀很多，不容易找到替代方案。权限设置清晰严格。,2021-12-30 12:53:15,5星评论,128GB,Not Found ip
13mini真的超级可爱，之前一直用大屏手机，换了mini真的是解放双手了，爱了爱了！,2022-08-06 17:08:06,5星评论,128GB,Not Found ip
外形外观：小巧轻便，拿着手感极佳。 屏幕音效：非常棒?！ 拍照效果：图片清晰度高，色彩还原度高！ 运行速度：运行速度有所提升，工作中需要开大图毫无压力！ 待机时间：基本可以一整天不需要充电，再也不用随身携带充电宝。,2021-11-19 23:41:46,5星评论,256GB,Not Found ip
早就想换小尺寸一点的手机，iphone 13mini真的香！ 外形外观：小巧便捷，很精致，手感也很好。 待机时间：没有网上说的那么恐怖，加上苹果系统的优化，低强度使用有时2-3天一充，日常用用一天一充，一直玩的话一天两充。,2022-07-14 01:26:10,5星评论,128GB,Not Found ip
快递超级快呢 外形外观：很大气哦，很可爱的粉色，爱了爱了 屏幕音效：很清晰，怕划坏还没怎么用呢 拍照效果：很好很好很清楚不错的我喜欢 运行速度：很流畅呢 待机时间：也还可以啦就是掉电快，充电就好啦！,2021-11-03 14:12:15,5星评论,128GB,Not Found ip
对 iPhone 13 mini种草已久，尤其是看到了广告主打的粉色款。在京东金融做活动时领了一个12期免息券，正好就直接决定入了。ios系统一如既往的流畅，处理器性能强劲，拍照方面可以满足日常需求，接收wifi信号也比现用的11好。最主要大小适合，单手操作非常方便，纯粹的喜欢。,2022-02-25 10:16:40,5星评论,256GB,Not Found ip
颜值很高 拍照也给力 mini手感很好。携带方便 就是续航不行 手机发热,2022-11-17 15:27:28,5星评论,128GB,Not Found ip
屏幕音效：屏幕也非常的舒服。 拍照效果：拍照还是可以接受的录视频是很棒的yyds。 运行速度：很流畅，但是出现过卡顿。 待机时间：可能八个小时吧。 拍的视频也还可以，手机也很轻巧特别喜欢。很适合妹子使用,2022-07-07 11:46:52,5星评论,128GB,Not Found ip
爱不释手的喜爱，小巧适合女孩子使用，视频像头清晰，颜色超赞。,2022-12-21 10:55:17,5星评论,128GB,Not Found ip
外形外观：外观太好了，小巧玲珑，太喜欢了 屏幕音效：好好好好好好好好好好好好好好 拍照效果：祖传1200万像素天下第一 运行速度：超级快的，无卡顿 其他特色：这才是手机该有的样子，现在的手机除了大屏就是大屏，看着太傻了，力挺mini,2021-11-02 16:42:12,5星评论,128GB,Not Found ip
不管iPad，还是iPhone，都一如既往的选择在京东购买，品质值得信赖。 送货速度也快得很，晚上下的单，第二天一大早就送来了。,2022-07-24 13:57:06,5星评论,128GB,Not Found ip
外形外观：外观设计非常好看，非常有手感 屏幕音效：音效音质都不错，非常棒 拍照效果：拍照也很清晰明了 运行速度：运行速度真的很快，网络不卡的话打游戏很是流畅 待机时间：待机时间还可以,2022-06-22 03:37:56,5星评论,128GB,Not Found ip
选了这个颜色，非常好，因为我喜欢蓝色，蓝色也代表了永恒，之前用了 xr因为太大无法适应，一直想换小屏幕的，特别给力，比xr运行速度要快，还能5G信号有点弱，有时候经常无服务，其他还没问题，拍照一如既往清楚，也可能我是老果粉，用习惯了苹果，所以对13总体还是特别满意，尤其是这个5.4的屏幕。,2021-12-27 20:13:59,5星评论,256GB,Not Found ip
关注好久了，618果断拿下。机器小巧，操作流畅顺手 外形外观：漂亮 屏幕音效：很好 拍照效果：很好 运行速度：快 待机时间：一天,2022-06-20 17:41:30,5星评论,256GB,Not Found ip
从小8换过来的，A15芯片确实不错，新手机用起来纵享丝滑，因为我用的移动的卡，信号这方面感觉跟以前差不多，室内3格，室外满格。5.4英寸全面屏，一手握住的感觉确实很爽。,2022-02-16 18:46:34,5星评论,128GB,Not Found ip
系统真的不错，非常流畅，很爽，比安卓好多了，预算不够就选择mini，也不错！！！！,2022-02-23 17:46:43,5星评论,128GB,Not Found ip
帮同事以旧换新iPhone8换的iPhone13mini，目前用着没有什么问题，以旧换新确实很方便，评估价基本与自己的预估吻合，挺不错的一次购物体验 ，13 mini性价比高小巧方便，是喜欢小屏手机的不二之选。,2022-04-30 12:12:23,5星评论,128GB,Not Found ip
参与以旧换新活动，之前用11 pro，感觉太大了，便携性不好，最不方便的是没有戴口罩解锁功能，这个功能在疫情常态化下觉得非常重要。技术员专业、细致、周到。由于旧机保护的很好，折价合理，还有补贴，新机非常便携，解锁方便。总体很满意！,2022-05-12 19:52:12,5星评论,512GB,Not Found ip
运行速度畅快拍照效果:清晰续航能力:很好 A15用的很流畅，拿在手里小巧很舒服，电池也刚刚够用一 天一冲，拍照很清晰，官网买的就是靠谱，物流也很快，今 天下单，明天就到了，不过客服都是机器人不怎么好沟通，整体感觉下来还是非常棒的,2022-03-09 19:35:54,5星评论,128GB,Not Found ip
手机非常漂亮，买的是白色的，做工一流，非常精致，适合小女生和女士使用，小巧玲珑。线条流畅拿在手里非常舒服。大爱???,2022-03-07 19:18:13,5星评论,128GB,Not Found ip
外形外观：非常精致，握感很舒服，一只手轻松操作 屏幕音效：显示很完美，比大屏的看着精致 拍照效果：拍照功能多，很清晰 运行速度：速度快 待机时间：比12时间长 其他特色：小屏党的福音，送货速度非常快，第一天就收到了,2021-09-24 23:00:05,5星评论,128GB,Not Found ip
机身足够小巧，已经好多年没有用过这样轻薄的手机了。 系统运行速度很快，处理器和系统配合的很好，确实不卡。 屏幕和拍照够用就好，低配也完全可以接受。 通话信号感觉没有华为的好，这点还是国货威武。,2022-05-29 21:29:14,5星评论,128GB,Not Found ip
外形外观：粉色太好看了 拍照效果：比12效果好很多 运行速度：运行非常快，关键的是电池非常耐用，重度使用一天都用不完,2022-03-11 16:37:07,5星评论,256GB,Not Found ip
