content,creationTime,score,productSize,location外形外观：终于，等到直角边再次回归 屏幕音效：屏幕有些太亮，声音反正够用就好 拍照效果：用得不多，满足全部需求 运行速度：非常快了 待机时间：非常满意 其他特色：最新一代就是爽，满足一切需求，也许是最后一代mini,2022-03-04 15:30:47,5星评论,128GB,Not Found ip
各方面都不错，完全满足我的日常需求，操作很顺滑无卡顿，手感细腻舒适，很满意的一次购物！,2022-07-30 08:57:43,5星评论,128GB,Not Found ip
手感刚刚好 ，特别的丝滑,2021-10-31 09:49:58,3星评论,128GB,Not Found ip
手机大小个人特别喜欢，外形比苹果6s小，屏幕比苹果6s大，重量上轻一些，拿在手里的手感很好，，系统升级到16.2我更喜欢，，，我不玩游戏，就看看小说，低电量模式可以用两天，别问我图片背景为什么不一样，因为图片网上找的，13mini正在评论拍照不了哈哈哈哈哈哈哈哈哈哈哈,2022-12-16 12:55:07,5星评论,128GB,Not Found ip
外形外观：小巧精致 屏幕音效：细腻清晰 拍照效果：我不在乎 运行速度：非常快速 待机时间：不玩游戏一天一充,2022-07-17 14:20:03,5星评论,128GB,Not Found ip
通信音质：良好。显示效果:优秀。mini尺寸握感绝 佳单手操作舒服，白色外观漂亮，直角边框颜值不 错 略影响手感。ioS15系统流畅稳定，动画效果很 棒U也不错，电池容量小所以续航- 一般 一天至少两 充，20W快充的充电速度尚可。总体评价：赞！,2022-08-19 16:05:44,5星评论,128GB,Not Found ip
尺寸小的好处就是手感好，单手操作非常便利，用了几天就习惯了，流畅丝滑，相机很牛，夜景特别厉害，和iphone13一样的配置而且小巧精致，iPhone14没有mini了，喜欢的老铁不要错过,2022-08-04 12:42:17,5星评论,128GB,Not Found ip
外形外观：美观，工艺自然，如艺术品般； 屏幕音效：屏幕不伤眼，音质相当nice； 拍照效果：画质清晰； 运行速度：相当流畅； 快递及时送到，服务好。,2022-08-29 22:43:51,5星评论,128GB,Not Found ip
外形外观：非常非常小巧，携带超级方便，一手在握，手感特别好 运行速度：速度快，不卡顿，一如既往地刘畅  待机时间：唯一不足就是待机时间不长，但也够日常使用,2022-10-21 14:46:42,5星评论,512GB,Not Found ip
外形外观：和12mini基本一致，厚度有所增加 屏幕音效：屏幕很棒，视野更广 拍照效果：听说主摄是12pm同款，扫码就完了 运行速度：A15功耗比确实nb，低电量模式yyds 待机时间：日常使用续航略高于12，完爆12mini 其他特色：送货超级快，12免息还送ac+，岂不美哉？ 最后附送与12mini对比图,2021-09-25 22:30:36,5星评论,128GB,Not Found ip
手机棒棒的，一直钟爱的小屏手机，单手操作棒，系统运行流程，256够用，机型精致小巧，超爱的刘海依然在，除非全屏没任何设计，否则还是刘海最好看。电池续航稍微有些改进，还行吧。对于不太依赖手机的我来说，也够了，之前的4S到现在的mini，很满意！,2022-09-02 11:56:21,5星评论,256GB,Not Found ip
终于拔草了！mini小而精致，单手操作毫无压力，运营流畅，速度快！电池待机时间能接受。最重要的是录制的视频很有大片的感觉！还有就是非常喜欢苍山绿,2022-08-06 13:32:24,5星评论,128GB,Not Found ip
苹果出品，必属精品！！！一分钱一分货！ 外形外观：外形外观：13 mini真是小屏爱好党的福音，真心太精致了！！ 屏幕音效：屏幕效果很给力！！ 拍照效果：拍照效果特别好。 运行速度：运行速度快。 待机时间：待机时间还行。 其他特色：各方面都挺好的！！！,2022-08-03 23:53:57,5星评论,256GB,Not Found ip
外形外观：绝对一手控制 很方便 屏幕音效：小钢炮 你还能说啥 绝对的 拍照效果：拍照就那么样子了，比不过安卓那些相机手机 运行速度：小钢炮，A15，三年内不会落后 待机时间：待机还真不知道，因为买来给老婆的，男人嘛，没办法 总结：非常好、棒，轻便！,2022-03-30 22:05:39,5星评论,256GB,Not Found ip
外形外观：外形外观比较亮丽，抢眼，做工一流，材质相当好，一拿上手就有爱不释手，不想放下的感觉。 屏幕音效：屏幕流畅，颜色比较鲜艳，音效好。 拍照效果：拍照效果比原来的iPhone mini2要好。,2021-10-30 22:53:01,5星评论,256GB,Not Found ip
京东快递稳定发挥，13mini真的是理想手机，大小刚刚好，这么小的机身可以做到这么精致，续航相比12mini又大幅提升，完全可以用一整天了。猛男粉超级好看，不同角度颜色不一样程度的粉，光特别强的时候甚至透着点金色，特别好看，这才是小屏旗舰完全体，爱不释手了！,2022-06-23 22:46:31,5星评论,256GB,Not Found ip
外形外观：精典外形，无话可说 屏幕音效：显示效果和声音效果都很好，无话可说 拍照效果：拍照最强大的手机，无话可说 运行速度：相对安卓机，运行速度杠杠的，256G内存，无话可说 待机时间：一天以上，说待机，苹果无话可说 其他特色：值得购买，尤其是降价之后。,2022-07-28 13:25:09,5星评论,256GB,Not Found ip
做工很完美，和小七对比，矮了一点点，屏幕大小可以！喜欢小屏手机，不二之选。,2022-08-04 11:45:43,5星评论,128GB,Not Found ip
外形外观：非常出色的外观设计，小巧精致颜值直接拉满！真机上手蓝色非常漂亮！ 屏幕音效：小钢炮屏幕PPI居然比大哥们还高，清晰锐利，外放音质也很不错，完全超出预期！ 拍照效果：跟大哥们同款摄像头，拍摄效果相当不错 运行速度：A15加持，苹果YYDS，想卡顿都难 待机时间：待机时间比起前辈12mini有长足的进步，比起12都长这点令人惊喜！,2022-03-06 11:39:35,5星评论,128GB,Not Found ip
外形外观：小巧，女孩子用着挺好的，秀气  拍照效果：拍照整体来讲，色彩饱和度很好，特别适合户外拍景色。,2022-08-05 15:36:24,5星评论,256GB,Not Found ip
"外形外观：外观小巧精致，还是比较喜欢的 屏幕音效：暂时没发现绿屏问题，音效也是很OK的 拍照效果：拍照效果还不错，完全够用 运行速度：用了最快的处理器，运行速度完全没问题 待机时间：正常使用1天是完全没有问题的",2022-08-22 16:26:44,5星评论,128GB,Not Found ip
想买一个手机作为备用手机的，看来看去还是选择了苹果，mini的机身非常小巧，单手就可以随意操作，手感很棒。和主力机共用一个Apple ID，共享数据也很方便。,2022-01-09 17:40:04,5星评论,128GB,Not Found ip
买13mini我的初衷是他的mini，可以单手操作，5.4英寸听说要绝版了，果断在双十二入手，还用了京东白条分期，12期免息哦，非常香，太香了，说说两个月的使用感受，苹果15的系统是不错的，很多新功能很实用，比如说新加的专注模式，就很人性化。说说大家比较关心的电池问题，我不玩游戏，不看电电影，正常来说，一天一充，基本上符合我的需求，手机摄像头还没用习惯，带后续待补充，所有的苹果手机都在京东自营买的，肯定正品，绝对放心购买！,2022-02-03 19:12:58,5星评论,128GB,Not Found ip
试用效果很好！拍照片很漂亮，外形外观好，小巧。运行速度快，充电快。以前用安卓系统，目前对苹果机的使用还在学习中。,2022-07-04 13:36:56,5星评论,256GB,Not Found ip
外形外观：很小巧，手感很好，重量轻，单手操作完美 屏幕音效：显示效果很棒，很养眼 拍照效果：拍照很棒 运行速度：运行非常流畅，操作丝滑,2022-08-13 17:08:28,5星评论,128GB,Not Found ip
外形外观：很好看，小巧精致，单手操作方便，口袋好装 屏幕音效：挺好，声音大 拍照效果：拍照清晰，像素高 运行速度：飞一样的速度 待机时间：新机器，电池耐用,2022-08-07 11:46:28,5星评论,256GB,Not Found ip
外形外观：一直比较喜欢小一点的手机，13mini正好合适，手握起来正好，非常小巧精致。 屏幕音效：屏幕挺细腻的，体验很棒 拍照效果：拍照效果很好 运行速度：运行速度很快，丝毫没有任何卡顿。,2022-08-26 23:24:22,5星评论,128GB,Not Found ip
外形外观：喜欢的就是它小巧的外观。 屏幕音效：屏幕显示细腻清晰，非常赞。 拍照效果：感觉画面通透，低光照的条件下成像效果比以前的要好太多了。 运行速度：非常流畅，这也是苹果一向的优势。 待机时间：正常使用不玩游戏可以待一天。 其他特色：买这款小屏机，看重的就是它的手感，单手操作真的是方便。,2022-08-04 13:37:02,5星评论,128GB,Not Found ip
从12mini换成13mini，特别喜欢这款小屏手机，做工精致，手感很棒，屏幕流畅，色彩还原好，音质效果不错，携带方便。,2022-06-02 09:10:19,5星评论,128GB,Not Found ip
外形外观：这个粉虽然不是我想象中的 但也很好看～ 运行速度：不错的 待机时间：续航很好 拍照效果：效果很好 很出片！ 屏幕音效：屏幕看着很高级 音效也很好！ 小8终于退休了 用不惯大屏 喜欢mini的屏幕尺寸！,2022-03-30 21:11:52,5星评论,128GB,Not Found ip
外形外观：粉色很漂亮，方框比较硌手，没有前几代iPhone那种圆润的边框舒服 屏幕音效：屏幕还不错，清晰，响应速度快，看的时间长也没有感觉眼睛很累 拍照效果：很棒，这个从来都不担心 运行速度：快，快，快，顺滑 待机时间：差劲，必须配合磁吸充电宝才敢出门,2022-08-06 22:30:01,5星评论,128GB,Not Found ip
京东物流高效快速，前天下单第二天中午就可以收到货，15年卖的SE用了6年一直都很好，这次是进水了无法维修，只好买新的，就选了这款13mini，图像显示效果，工艺都很好，电池续航夜提高了不少，系统顺畅，用起来得心应手，喜欢！,2022-10-16 00:39:54,5星评论,128GB,Not Found ip
屏幕音效：屏幕不错，显示效果好 拍照效果：真实，不错&hellip;&hellip; 外形外观：适合，手感不错&hellip;&hellip; 运行速度：很快，&hellip;&hellip; 待机时间：新机够了 其他特色：单卡，可以了&hellip;&hellip;,2022-08-14 15:46:19,5星评论,128GB,Not Found ip
就喜欢小屏幕手机。之前用的是iPhonese，这次看到有猛男@的mini，毫不犹豫下手。外形外观：精致美观屏幕音效：非常不错拍照效果：和之前12promax一样的主摄和广角。运行速度：A15，傲视群雄。待机时间：比之前12mini强了很多。,2021-12-24 20:50:16,5星评论,512GB,Not Found ip
还是mini上手体验感最好，新出的绿色尤其适合炎炎的夏季，搭配同色手机壳，帅的不要不要的。,2022-06-25 14:59:52,5星评论,128GB,Not Found ip
以前就喜欢小屏手机，狠下决心来入手一台，上手手感超好的。单手就能操作。就是打游戏没大屏的好，日常使用还是小屏来的好。 外形外观：漂亮，大气 运行速度：a15不用过多解释，赞 待机时间：一天一充,2022-07-17 17:21:33,5星评论,128GB,Not Found ip
总体来说非常的不错，价格比实体店便宜了几百块，手感很好，山区的信号不太好，不过城区用起来挺流畅，一天充一次电，充一次电大概一个小时，拍照效果非常好的，粉色也是我特别喜欢的，满意?,2022-08-23 21:19:29,5星评论,128GB,Not Found ip
外形外观：很好看，不是说特别的粉 屏幕音效：很好用，很丝滑 拍照效果：很清晰，挺好用的，不错 运行速度：很快，苹果的处理还是可以的 待机时间：还行，够用,2022-07-11 14:42:04,5星评论,128GB,Not Found ip
心心念念的小蓝今天终于拿到手了 外形外观：五分 就是冲这个去的 真的美 蓝色也很年轻 屏幕音效：因为双音响 立体声很赞 很浑厚 打游戏也不会遮挡 好评 拍照效果：算是一口水准 尤其是电影模式和4k摄影很强 运行速度：这个没的说 A15仿生真的流畅 玩游戏一个小时没有掉帧卡顿 发热也不明显 待机时间：一天一冲基本可以满足日常需求,2022-09-13 23:32:54,5星评论,512GB,Not Found ip
外形外观：外观时尚，简洁大方， 屏幕音效：完美，很细腻 拍照效果：成相很不错 运行速度：很快。不愧是a16 待机时间：妥妥的用一天，续航很顶,2023-01-06 08:04:01,5星评论,128GB,Not Found ip
外形外观：喜欢，是我想要的小巧的风格，一只手就能操作 屏幕音效：音质很好 拍照效果：很好，夜视拍照还能拍到星星呢 待机时间：待机确实比x久,2022-08-08 10:33:55,5星评论,256GB,Not Found ip
入手mini星光色，小巧精致，单手操作非常方便，使用了一个多星期了，各方面都很不错的，握着就很舒服。5.4的直面屏，手感很好，屏幕显示的非常清晰，手机不会太小，也不会太大，对于女生来说是刚刚好的。音质也是非常的好，没有什么噪音，低音模式也很好。对于我来说，最惊喜的还是拍照，尤其是电影模式，摄像自动对焦，清晰度清晰的不能再清晰了。,2022-02-05 11:15:51,5星评论,256GB,Not Found ip
很喜欢苹果的手机，操作简单流畅，最主要是性能完善，安全性好吧，这次买的mini ，也挺喜欢的，因为我对精致小巧的东西没有抵抗力呀，拿在手里也轻巧，不会很累。,2022-07-22 19:45:47,5星评论,128GB,Not Found ip
外形外观：挺好看，握起来很舒服 屏幕音效：不错，苹果品质值得信赖 拍照效果：还行，当然没有13pro好，毕竟少一个镜头 运行速度：很快，流畅 待机时间：可以 其他特色：家里都是苹果的产品，手机从3gs开始用苹果，每年很新一款，旧手机给老人家用，6plus还能工作,2022-08-12 22:39:45,5星评论,128GB,Not Found ip
星光色非常好看，绝对是小尺寸旗舰里面的小钢炮。设计非常好，卧室手感绝对是无敌的，非常轻巧，是手机里面独一无二的存在。苹果a15处理器功能强大。,2022-07-03 19:56:54,5星评论,128GB,Not Found ip
配送速度超快，续航还可以，一般情况下够用1天 外形外观：很美 拍照效果：很棒，夜景也可以 运行速度：挺快的 屏幕音效：屏幕怕花的话建议贴膜，音效也很好,2022-10-06 11:56:45,5星评论,128GB,Not Found ip
"外形外观：巧精致，很喜欢这种一手可以掌握的手里 屏幕音效：屏幕较之前有了很大提升 拍照效果：苹果原相机还是很OK的 运行速度：a14比我之前的a11提升很大 待机时间：待机时间也是比我之前手机好了",2022-08-22 15:58:41,5星评论,128GB,Not Found ip
外形外观：外观无瑕疵，颜色很喜欢。 屏幕音效：屏幕效果很好，视野很广。 拍照效果：拍照效果不错，清晰。 运行速度：运行流畅，不愧为苹果。,2022-09-15 10:25:17,5星评论,128GB,Not Found ip
iPhone14没出mini，赶紧入手了13mini 12 pro退役 现在想用小手机，目前最好的小手机了 配合ipad加MacBook很够用 13 mini有点underrated 好没有试拍照等功能 从12到13，两手机放一起20分钟完成了数据传输 很方便 希望新出的iwatch能提高电池续航 外形外观：小巧，便携,2022-09-17 20:26:23,5星评论,128GB,Not Found ip
小屏 mini 性能又强的只能选择苹果了 很不错 性价比可以 性能对比安卓机也很强 不打游戏 算是很够用了,2022-06-30 21:18:31,5星评论,256GB,Not Found ip
外形外观：粉粉的太好看了 不是以前的那些粉色 淡淡的粉色 拍照效果：喜欢ios的拍照效果 运行速度：ios系统很流畅 其他特色：mini在手机刚刚好 不怕砸脸了 喜欢喜欢,2022-07-05 16:06:07,5星评论,256GB,Not Found ip
非常完美国行正品发货快速度给力非常的好用真香.本以为能比我以前用的苹果八大没想到比它还小一圈非常的完美.我就喜欢单手操作的感觉非常棒.单手玩一会一点也不觉得累非常愉快的一次购物体验.要不是14出mini就粉等党了。正好不出就果断买了真没叫我失望.非常的好,2022-07-19 18:46:52,5星评论,128GB,Not Found ip
哈哈哈哈mini真的好mini，刚拿到好不习惯，这真的是手机嘛这么小。用惯了再回到之前5.8寸就像在用平板！很精致很小巧。捧在手心都怕它化了哈哈哈哈?,2022-08-28 15:14:05,5星评论,128GB,Not Found ip
一直用苹果手机习惯了，之前的内存小了，还想用这种小屏幕的。看到这款13mini很是喜欢，屏幕大小合适，适合不玩手机的人。京东物流很快，基本2-3天到货。全新的，没有激活，不玩游戏电池基本可以待机2天。,2023-04-14 07:38:00,5星评论,128GB,山东
终于到手13mini啦 好小巧 好可爱 比官网便宜 也是分期12期 很好哦 上班族的最好选择了 超级顺手 上一个手机是用了三年的X R 该退休了 希望用得住,2021-11-04 15:18:53,5星评论,128GB,Not Found ip
目前小手机只有对它比较满意，手感不错，音质，屏幕显示都好，拍照清楚度可以，使用几天没发现信号不好，电池使用也正常，关键轻巧好玩，送发货快，很满意。 屏幕音效：好 外形外观：好 拍照效果：好 运行速度：快 其他特色：轻巧 待机时间：正常,2021-11-23 15:50:17,5星评论,256GB,Not Found ip
考虑了很久买了iPhone13mini，我对比了一下6S的大小，尽然是一样大的。之所以买小是因为希望口袋可以放的下，颜色选择了黑色，iPhone真的可以用很久很久。,2022-08-28 11:14:43,5星评论,256GB,Not Found ip
24号当天就到手了，京东速度果真没让我失望，选的午夜黑颜色真的非常惊艳，比以前的灰色高级多了，手机大小非常合适，突然感激小拇指一下就解放了，使用起来也非常流畅，nice！,2021-09-25 21:39:06,5星评论,256GB,Not Found ip
外形外观：喜欢小屏的手机 终于可以解放双手了 一只手操作 运行速度：非常好 一点都不卡顿 待机时间：日常用是完全没有问题的 拍照效果：拍照很漂亮 我最喜欢电影模式！附下图 东安湖照片,2022-04-15 12:25:41,5星评论,128GB,Not Found ip
外形外观：是我喜欢的大小，相比plus更喜欢mini，一手就能握住，很有安全感 屏幕音效：音效也不要错 拍照效果：拍照效果很好 运行速度：苹果从不失望 待机时间：不玩游戏，待机时间不错,2022-10-30 09:19:15,5星评论,256GB,Not Found ip
颜色好看，造型小巧，确实不错。 很适合手比较小的人呀，单手可握持操作 140g很轻薄,2022-08-08 14:32:07,5星评论,128GB,Not Found ip
外形外观：太喜欢这个粉色了，特定光线下还会呈现出白色，相当于同时买了白色版本的，两个愿望一次满足 待机时间：待机时间比上一代12mini实在是好了太多了，出门在外开5G也不会续航恐慌了 其他特色：如果是喜欢小屏旗舰的，那么这一款确实是最好的选择?PS：属实是我的梦中情机了,2022-08-13 00:34:42,5星评论,256GB,Not Found ip
星光色简直大爱。作为一名小手机爱好者，直接从7换到13mini，手机整体比7小了一点，但是屏幕比7略大，单手操作yyds。手机使用感非常丝滑，拍照色彩艳丽，电池续航能力对我不打游戏的人来说也完全够用，一天一充，小手机爱好者可以放心冲这款啦,2022-05-01 12:14:22,5星评论,128GB,Not Found ip
第一，价格便宜，新款苹果手机，已经不再是曾经的奢侈手机代名词，面对近年来新款安卓期间动辄五六千对比，iPhone13第一次具有很高的性价比，并且可以使用很长一段时间。  第二，iPhone 13搭载最新的A15芯片，在日常使用中，功耗更低，性能更强，以骁龙888做对比，在同等游戏性能中，骁龙888的使用为8W，而苹果A15只需要4W，在不改变性能的同时，续航更强！  第三，iPhone 13搭载的是三星最新款的OLED屏幕，在屏幕色彩的显示上，更具真实，看起来也更舒服，算是最高级的1.5k分辨率OLED屏幕。,2022-08-10 23:30:46,5星评论,128GB,Not Found ip
手机很小巧，和以前的屏幕不一样，边框现在是直角了，屏幕显示很清晰，小屏手机拿着不累，运行速度快,2022-02-05 12:05:14,5星评论,128GB,Not Found ip
小MINI不重，和以前的iPhone手机重量差不多，大小可以一个手进行操作，屏幕顺滑，刷脸开机/密码没有卡顿，使用几天后已经很习惯了，值得一提的是，把新旧手机放一起，按照新手机的提示，旧iPhone里的所有资料，可以很顺畅的传输到新手机，包括短信、APP、铃声、等等，非常便利。手机在京东上买，放心。,2022-06-24 18:44:07,5星评论,128GB,Not Found ip
iPhone迷你这个大小设计的真的是太友好了，对小手人来说太友好了。屏幕还很大，整个手机还很小，用起来非常非常舒适。而且比较轻，买了256g的内存，特别大，特别够用。颜色买的蓝色的，当时就蓝色有货了，实物感觉还可以。,2022-06-14 10:36:28,5星评论,256GB,Not Found ip
大小刚刚好，这是第5个爱疯了， 外形外观：漂亮 屏幕音效：很好，音质细腻 拍照效果：很好，比上几代的像素好了很多 运行速度：yyds 待机时间：刚开始用 其他特色：真香,2022-02-04 22:39:03,5星评论,128GB,Not Found ip
用了一天再评论，大爱绿色mini，一直想买个苹果mini，担心运行速度和手感。到手一天，效果不错，手感很好，运行速度比想象的快，自己手里还有个13pro，感觉不到多大差距，5.4的屏幕也可以接受，没有测试拍照效果。,2022-03-23 22:40:02,5星评论,128GB,Not Found ip
外形外观：很漂亮，很喜欢的外形，不错！ 屏幕音效：声音很好听，立体声很强，屏幕很靓，很好。 拍照效果：随手拍出好看的照片，视频也不错。 运行速度：很流畅，完全没有卡顿，系统很不错！ 待机时间：一天时间足够，不用带充电宝了！ 其他特色：值得入手！,2022-07-07 20:18:38,5星评论,128GB,Not Found ip
外形外观：非常棒，而且手感好好 屏幕音效：比以往更优秀 拍照效果：完美，尤其低光的时候，效果惊人 运行速度：只能说：飞&hellip;&hellip;飞&hellip;&hellip;飞快 待机时间：暂时不知道 其他特色：颜色很优秀，屏幕大小非常适合 快递哥哥很给力，上午9点下单，当天下午5点到货,2022-06-10 22:18:17,5星评论,128GB,Not Found ip
超级好看，颜值非常高，是我喜欢的颜色，手感非常 不错，摸着有质感，运行速度非常流畅，打游戏一点都不发热，拍照效果很清晰。,2022-06-13 15:12:48,5星评论,128GB,Not Found ip
京东购物，方便快捷，换了13mini，手机尺寸完美适合小屏党，单手操作便捷，放在裤兜里没压力。直角设计和一代se很像，裸机非常有质感。人脸识别也比较方便，非常不错。还没试拍照，看评测应该是非常给力的，后续追评。推荐购买的一款产品！,2022-09-02 20:24:44,5星评论,128GB,Not Found ip
手机很好，电池没有想象的那么差， 外形外观：手感超级舒服 屏幕音效：很喜欢 拍照效果：可以 运行速度：杠杠的 待机时间：早上八点多充满电，大概玩游戏三小时，晚上七点左右还剩百分之三十左右,2022-07-23 11:05:00,5星评论,128GB,Not Found ip
外形外观：外观漂亮，颜色很漂亮。很mini，很方便。 屏幕音效：屏幕很不错，显示效果好，音质好，很不错，声音够大也够小，晚上看视频不影响别人。 拍照效果：还不错，不太关注这个。 运行速度：很流畅。,2022-01-21 15:29:10,5星评论,128GB,Not Found ip
颜色好看，与14同一个CPU，嫌弃14那么大，决定买了13的mini，优惠力度不够大。13mini手感非常好，大小合适，个子比i8还要小,2022-11-02 21:57:26,5星评论,128GB,Not Found ip
用了两年多的xr终于下岗了，迎来了新伙伴13mini。256G的内存应该是够用了。 外形外观：午夜百搭，大气低调。 拍照效果：高清的不要不要的。 运行速度：快,2021-11-12 08:17:27,5星评论,256GB,Not Found ip
有模有样，边框棱角分明，很经典的设计。运行速度快，手感丝滑，关键是体积不大，携带方便，尤其是户外跑步的时候，放裤袋里毫无压力，总而言之，实用、够用、方便～这不正是我所需要的吗？,2022-07-06 08:53:33,5星评论,128GB,Not Found ip
外形很亮眼，做工也很一流，材质相当好，拿到手里就爱不释手，舍不得放下了，拍照效果也是杠杠的，大爱,2022-08-26 15:18:52,5星评论,128GB,Not Found ip
手机很好用，精巧细致，大小合适，特别适合带出去玩，好用！,2023-01-21 10:58:35,5星评论,128GB,Not Found ip
