content,creationTime,score,productSize,location物流不用说一如既往的给力，手机外观高大上，屏幕大小合适，屏幕显示清晰，信号给力，最重要的是价位超级合适！开心开心?,2022-07-30 20:57:32,5星评论,128GB,Not Found ip
mini的配置和正常版本差不多但是性价比高，手机屏幕小，单手也能轻松握住，性能方面没话说真的做的很棒棒，还是我喜欢的粉红色,2022-02-16 14:06:01,5星评论,128GB,Not Found ip
外形外观：很好看 屏幕音效：不错 拍照效果：很棒 运行速度：很快 待机时间：时间长 其他特色：一直用苹果这个系统特别的好用。红色的这个颜色也让人非常的喜欢。尤其是电影模式的摄影，让人感觉拍照片更好看了。送这个维修服务，我真是让人感觉更放心了，然后嗯，别说也更有保障。,2021-10-13 19:05:04,5星评论,128GB,Not Found ip
外形外观：小巧玲珑，一手掌控之中真好 屏幕音效：音量很大呢 拍照效果：还原度很高呢 运行速度：真的很快。游戏很yyds 待机时间：不玩游戏可以整天,2022-03-16 19:05:44,5星评论,128GB,Not Found ip
很不错，粉色很亮，给女人使用最好，漂亮！机器用起来不卡顿，听说可以用很多年，系统是一大优势，长久耐用！ 外形外观：时尚 屏幕音效：舒服 拍照效果：真实 运行速度：顺畅 待机时间：正常 其他特色：漂亮,2021-10-31 15:45:44,5星评论,128GB,Not Found ip
一直非常相信苹果的品质，从大学时候就开始用，性能稳定，注重隐私安全，另外13真的有点香,2023-04-24 10:08:34,5星评论,128GB,江苏
外形外观：很好看 运行速度：不错 待机时间：可以 屏幕音效：可以,2022-08-27 09:33:49,5星评论,256GB,Not Found ip
可以单手操作苹果13迷你的系统是不错的，很多新功能实用，比如说新加的砖模式就很人性化，大家比较关心电池的问题，我不玩游戏，看看电影，正常来说，一天充一次电，基本上符合我的需求，手机摄像头还没用，习惯补充苹果手机,2022-02-17 15:02:59,5星评论,128GB,Not Found ip
试用中，小手用着挺舒服，后面再来追评。 外形外观：蓝色很好 屏幕音效：音效增强 拍照效果：很意外 运行速度：挺快的 待机时间：正常待机。,2022-06-08 17:17:31,5星评论,128GB,Not Found ip
买给老婆的，她就喜欢小屏幕手机，听说明年不再出mini版本了，这是最后一款mini了，果断就下单了，这种小屏手机拿在手里确实很舒服，今年的iphone真的挺给力，优惠力度挺大的，物有所值，拍照也是好看的，记录美好生活，13是真的香,2021-10-16 17:36:36,5星评论,256GB,Not Found ip
商品很好。好的产品一直不需要讲太多，实际日常生活中看到使用比例就能看出来结果。手感很不错,2023-01-03 21:35:03,5星评论,128GB,Not Found ip
13mini黑色颜值超高   屏幕大小刚合适 外形外观：时尚    屏幕音效：音质没的说   拍照效果：苹果拍照大家都懂,2022-06-12 18:57:15,5星评论,128GB,Not Found ip
小屏手机真的非常有安全感. 不累手. 满分评价.携带不再是累赘. 电量控制刚刚好.实拍.,2022-08-30 15:04:18,5星评论,128GB,Not Found ip
发货速度快，送货上门，包装精致完美，运行流畅，哈哈哈，拍照效果清晰度高，非常的满意。满意,2022-07-11 21:45:01,5星评论,128GB,Not Found ip
不出意外的话，这是苹果手机出的最后一款小屏幕min机型。单手操作非常方便，功能非常强大。,2022-12-17 21:17:35,5星评论,256GB,Not Found ip
iPhone13 mini一周使用感受 使用门槛最高 外观：手感天下第一，蓝色在阳光下看也不深。猛男粉应该也不错。 续航：mini的使用门槛很高，不玩游戏，不重度刷视频，省电的最好方式就是少看手机，多观察生活 拍照：两颗镜头直接照搬去年的12pm，素质可以说手机里的前三了 完全够用,2022-04-03 00:15:57,5星评论,128GB,Not Found ip
外形外观：商品外观颜值，各个方面都是非常好的， 屏幕音效：屏幕的清晰度也是非常高的， 拍照效果：拍照像素清晰度逼真， 运行速度：运行反应速度，每一次都是非常惊艳的选择 待机时间：待机时间,2022-02-19 11:11:26,5星评论,128GB,Not Found ip
当做备用机买的，太小巧了，感觉又回到了iPhone5的手感，不错，应该能用很长时间。,2022-08-22 17:03:38,5星评论,128GB,Not Found ip
小巧精致，独爱小手机，很满意！这款颜色很大气，有气质，手机像素，音质都不错，正在体验中,2023-01-18 01:10:48,5星评论,256GB,Not Found ip
外形外观：颜色非常不错 屏幕音效：正 拍照效果：比12要好 运行速度：情,2022-08-04 13:29:39,5星评论,128GB,Not Found ip
外形外观：mini小巧精致 拍照效果：还可以吧 运行速度：杠杠滴&hellip; 待机时间：比12好太多  双十一抢的，价格便宜很多，京东自营的东西很好，服务及发货速度杠杠滴，支持京东做大做强,2021-11-18 01:12:02,5星评论,128GB,Not Found ip
外形外观：小巧便携 屏幕音效：很舒适 拍照效果：拍照效果还不错 运行速度：运行速度很快 待机时间：还不错，相对上一代提升很大 其他特色：小巧便携，适合小屏党。,2022-01-30 19:11:29,5星评论,256GB,Not Found ip
小小一个很精致，单手入手刚刚好操作，白色的很好看，心心念念的就入手的，之前都是一直黑的，确实是会视觉疲劳，该换换！,2022-06-25 09:10:29,5星评论,128GB,Not Found ip
早就种草这款手机了，家里人就喜欢小屏幕的，买个家人的，快递也很快，隔天就到了。,2022-06-18 16:06:01,5星评论,128GB,Not Found ip
手感、手感、手感， 重要的事情说三遍， 一手掌控的感觉， 14没有mini版本，已经是最后的倔强， 直接收藏价值，,2022-09-08 07:13:47,5星评论,256GB,Not Found ip
等了几天终于到货了，小巧玲珑，非常漂亮的一款手机，以前也用过几代苹果，性能及各方面都非常强大！,2022-03-19 11:14:01,5星评论,128GB,Not Found ip
很不错，手感夜很好，mini大小合适，红色颜色很 屏幕音效：屏幕比以前的效果好很多 待机时间：电池用一天勉强够，一直用的话可能还是会不太够用 运行速度：运行速度没得说,2022-02-17 10:33:50,5星评论,128GB,Not Found ip
小巧精致，操作简单流畅，性能也很够用。京东旗舰店购买很方便，这个时候物流还很顺畅不容易。挺满意的。,2022-12-19 21:50:02,5星评论,128GB,Not Found ip
可以，非常好用 运行速度：好 待机时间：好 拍照效果：好 屏幕音效：好 外形外观：好,2022-08-03 18:55:01,5星评论,128GB,Not Found ip
很小巧可爱的样子，老婆很喜欢，一直都是说喜欢用小手机，这个就刚好，适合手比较小的女生用,2021-12-24 15:23:00,5星评论,256GB,Not Found ip
外形外观：精致小巧没得说，握持手感很棒 屏幕音效：都很好，尤其外放音效 拍照效果：一如既往的苹果拍照，电影模式尚未体验 运行速度：很快，流畅没有卡顿 待机时间：轻中度不打游戏不刷视频，一天足够,2023-01-18 20:41:24,5星评论,128GB,Not Found ip
十三香的运行速度真不是盖的，后台能力比安卓强多了，手机很省电，中度使用能用一天。,2022-07-03 08:46:54,5星评论,256GB,Not Found ip
外形外观：外形外观小巧时尚，单手可以操作，方便，轻巧精致； 屏幕音效：屏幕清晰度非常高，音效非常好、音质非常高； 拍照效果：1200万像素的摄像像素 运行速度：运行速度非常快，面容解锁太快了！超赞！ 待机时间：刚刚打开使用，待机时间还未知。 其他特色：麻雀虽小、五脏俱全。喜欢小巧的手机，方便携带。一直信赖京东自营，这是在京东购买的第N台手机了。,2022-06-03 18:04:12,5星评论,128GB,Not Found ip
外形外观：很nice百搭的颜色 屏幕音效：非常好明亮清晰，高耍玩游戏很舒服 拍照效果：对比12好了很多 运行速度：a15运行很丝滑 待机时间：正常使用十几个小时问题不大,2021-11-05 09:27:25,5星评论,256GB,Not Found ip
外形外观：午夜色真的特别好看，手机特别小巧，一只手就能拿过来，很喜欢 屏幕音效：屏幕没有问题，音质也可以 拍照效果：拍照功能用的不多，够用就行 运行速度：系统很流畅，很喜欢 待机时间：小手机，电池毕竟小，不过我不是重度使用者，平时也能随用随充,2022-08-01 16:08:00,5星评论,128GB,Not Found ip
手机已经收到，苹果手机质量真的可以，从晓8到现在的13手感好，适合我这个小手党，系统流畅，反应速度块，体验超级棒，总体非常喜欢，拍照像素好,2021-11-23 11:10:20,5星评论,128GB,Not Found ip
外形外观：很好看，没有瑕疵，是正品。 屏幕音效：声音大，屏幕触感好。 拍照效果：效果非常棒。 运行速度：超级快。 待机时间：中午12 点到晚上11点，开机50，冲到85，电话，视频，打游戏，还剩40。,2022-08-20 22:52:23,5星评论,128GB,Not Found ip
从12mini换到13mini，对小尺寸机型没有抵抗力，非常棒的手感，系统流畅，拍照调色准确，主力机必备 外形外观：和12mini同样的尺寸，握持感很好，不耗手 屏幕音效：虽然不是14的高刷屏，但是Apple的动画可以秒杀（除锤子外）一切手机，音质中上水平 拍照效果：钟***效果，这个镜头下的图像精度很高，长焦也清晰 待机时间：待机时间稍短，满电使用大半天没问题,2022-10-17 23:06:06,5星评论,256GB,Not Found ip
外形外观：不错 屏幕音效：五星 拍照效果：不错 运行速度：五星 待机时间：五星,2023-01-02 12:00:33,5星评论,256GB,Not Found ip
外形外观：手感巨好，跟手度比13好太多！ 屏幕音效：白天外面也很清晰 拍照效果：挺满意的，尤其电影效果不错 运行速度：流畅丝滑非常棒！,2022-05-07 07:45:35,5星评论,128GB,Not Found ip
外形外观：小屏旗舰，名不虚传！ 屏幕音效：屏幕贼清晰！比13标准版清晰！ 拍照效果：和13差不多，夜拍效果非常棒！ 运行速度：各种APP秒开！没有卡顿！ 待机时间：续航比某些4000多毫安的安卓好多了！,2022-08-28 16:09:16,5星评论,128GB,Not Found ip
"手机很漂亮，规格大小很适合自己，特别是夏天携带方便，没有压迫感。这一代的手机比2015年的se进步很大,信号也比7好很多，买苹果手机主要是因为手机小，方便携带，单手可操作，没有负担。",2022-04-21 15:32:40,5星评论,128GB,Not Found ip
正品行货 外形外观：外面很漂亮，粉色的 屏幕音效：屏幕很清晰耐磨， 拍照效果：拍照效果好， 运行速度：运行速度快 待机时间：待机时间长 其他特色：其他特殊就是手机很小，单手握持很舒服，屏幕用起来很舒服。,2021-11-06 19:09:14,5星评论,128GB,Not Found ip
显示效果：这个蓝色真的是太好看了，纠结了很久选什 么颜色，黑白肯定不出错，但是又觉得太单调，这个蓝 色真的是惊艳到我了 运行速度：新机速度快不卡顿通信 音质：5g没毛病，冲冲冲 电池续航：续航很好，天冷也 不会冻关机， 一天冲一次电完全没问题 拍照效果：拍照 很清晰 其他特色：客服服务态度也很好，很晚了还不厌 其烦解决我的疑问，用起来和国行也没差，价格也很有 优势，家人们冲鸭,2022-02-06 15:41:52,5星评论,128GB,Not Found ip
还行，手感挺不错的，用着非常丝滑，价格也挺实惠的，刚降价就买了，还是13香啊，哈哈,2022-09-10 03:14:42,5星评论,256GB,Not Found ip
听说iPhone13mini有可能是最后一款小尺寸的手机了 所以喜欢小尺寸iPhone的赶紧买吧 手机非常精致漂亮,2022-06-12 18:02:52,5星评论,128GB,Not Found ip
已经到货，物流很快&hellip;刚拆开，壳上竟然有脏东西！,2021-12-18 11:06:42,3星评论,128GB,Not Found ip
非常不错，大小很喜欢，主要是非常轻。外观无瑕疵，在快递点当面验货。颜色也很好看，淡淡的粉色，没有太妖艳。 刚开始大量装软件有一定发热，过一会基本上就好了。续航还不错，拿到手75%，一个小时掉电8%。基本上还是比较满意的。当天下单当天送到。,2022-05-14 21:42:47,5星评论,128GB,Not Found ip
外形外观：非常的精致小巧，猛男粉很好看，单手握持无敌，备用机无敌 屏幕音效：还可以，和旗舰机几乎没差 拍照效果：丐版的，拍照效果就能看的水平 运行速度：可以很流畅，虽然就60hz，但是丝毫不卡，安卓的120hz很好用但是切应用还是容易卡 待机时间：已经和iPhone12，Pro一样了甚至更好，这很不错 其他特色：手机整体非常小巧，抛开续航（和Max比），屏幕大小，拍照，还有120hz，还是很不错的，手感就是无敌,2022-06-28 20:32:01,5星评论,128GB,Not Found ip
外形外观：外形尺寸小 屏幕音效：屏幕分辨率高，音响效果环绕 拍照效果：拍照清晰明亮 运行速度：运行速度很快 待机时间：待机时间长 其他特色：用起来很爽，一把抓,2022-02-19 11:20:36,5星评论,128GB,Not Found ip
mini也不错的，一看就非常好，手机质量非常的好，用起来我也非常的流畅，感觉我是捡到了一个大便宜，下次我肯定还要在这上面买,2022-07-17 14:58:05,5星评论,128GB,Not Found ip
给老婆买的结婚纪念礼物，老婆非常喜欢，本人用的是12mini，非常喜欢小屏手机，精致，其实用起来屏幕一点不小，非常满意！ 外形外观：非常漂亮 屏幕音效：一个字好！ 拍照效果：100分 运行速度：100分 待机时间：够用！ 其他特色：精致,2022-01-26 14:54:34,5星评论,128GB,Not Found ip
外形外观：和12mini差不多尺寸，不过摄像头比12mini好看，看起来漂亮很多。 屏幕音效：屏幕颜色看起来很舒服，音效还好，没p的大声，一分钱一分货。 拍照效果：拍照很好，比安卓机的清楚很多，一直信赖苹果手机的相机。 运行速度：运行很快，苹果手机就是快，没得说。 待机时间：这么小的手机算很厉害了，刷一天一充，没得说。 其他特色：快递超快，服务又好，物有所值，手感很好，综合非常满意！,2022-02-01 08:46:23,5星评论,128GB,Not Found ip
非常非常好，快递非非非常快，服务非常满意，屏幕一流，可以单手操作，轻盈舒适，绝对不会后悔，简直是太好了，完全对得起这个价格，无可挑剔！,2021-10-02 15:42:02,5星评论,256GB,Not Found ip
手感好的一批！单手完全握持，冬天躺床上单手操作不砸脸！ 续航也很不错，比想象中好的多，用了4个半小时还剩百分之40的电 总的来说好评！配官皮很香,2022-02-07 20:07:15,5星评论,128GB,Not Found ip
第一款苹果手机是苹果7，用了四五年了，一点没卡过，屏幕碎了，但是不影响使用，喜欢这种小型机，干活方便，也很很可爱 特别是今年的价格，真是打动我的心 哈喽，你好，萨瓦迪卡，喜喜，我爱mini 13苹果手机,2021-09-27 20:25:07,5星评论,128GB,Not Found ip
外形外观：很小巧，非常喜欢，个人比较喜欢小屏手机拿起来很轻巧，斜对称的镜头很有特色，喜欢。 屏幕音效：屏幕和音质都非常清晰。 运行速度：很赞，比11的快很多，但是手感还有点差别。,2022-02-11 10:48:44,5星评论,128GB,Not Found ip
13mini 很好看 手感很好 单手操作Yyds  电池续航能力不过一般 其他都感觉不错,2022-08-08 14:36:15,5星评论,128GB,Not Found ip
小巧可爱 真的手感很好 之前一直用华为的旗舰 这个可以当备用 开启省电模式续航很惊喜,2023-01-03 23:45:05,5星评论,128GB,Not Found ip
昨天晚上下的单今天就来了！！不用期待好几天，就喜欢这样的物流！手机可爱，很适合自己，超喜欢！,2022-12-30 13:01:44,5星评论,128GB,Not Found ip
外形外观：有点小，凑合着用 屏幕音效：屏幕分辨率真的很清透 拍照效果：拍照功能强大 运行速度：运行速速度快不卡顿，玩游戏很流畅 待机时间：待机时间长,2022-02-19 12:07:10,5星评论,128GB,Not Found ip
超好看的一款小型旗舰手机，12mini的升级版，特别喜欢这个粉色，屏幕显示细腻，ios系统就不用说了丝滑流畅，拍照功能也有一定的升级，京东购买就是放心，挺满意的。,2022-02-05 20:01:11,5星评论,256GB,Not Found ip
粉色真的超级好看，女孩子用太适合不过了，包装完好，到货就迫不及待拆了上手，运行快，拍照不错，价格京东做活动也给力，送货也是很快。,2022-07-06 15:52:52,5星评论,128GB,Not Found ip
iPhone 13mini尺寸真的是超级喜欢，蓝色yyds，毕竟是我最爱的颜色，拍照很清晰，算法处理的不错，简直同级无敌的存在，系统用起来也很流畅，缺点就是单卡，快充有点烫！喜欢的话就下手吧！,2021-11-18 11:01:00,5星评论,256GB,Not Found ip
外形外观：好看 拍照效果：很清晰，感觉很棒 屏幕音效：听着不错,2022-07-22 11:30:28,5星评论,128GB,Not Found ip
外观颜值：非常漂亮 材质手感：非常好 容量空间：空间很大 做工细。,2022-09-20 22:54:03,5星评论,128GB,Not Found ip
手机很快就收到了，屏幕分辨率显示的很清晰很细腻，拍照效果特别棒，简直太好用了，只能用完美来形容！,2022-08-13 22:48:47,5星评论,128GB,Not Found ip
外形外观：外观很好看，精致小巧，手感很圆润 屏幕音效：音效很不错，算是非常好听的 拍照效果：苹果的拍照一如既往的很好 运行速度：运行速度：运行速度挺快的，一点也不卡顿，很够用,2022-02-20 22:25:32,5星评论,128GB,Not Found ip
外形外观：小巧玲珑，拿手上沉甸甸的 屏幕音效：小屏幕大音响 拍照效果：拍照鲜艳夺目 运行速度：吃鸡王者不在话下 待机时间：待机两三天 其他特色：用起来非常丝滑,2022-02-19 11:09:07,5星评论,128GB,Not Found ip
外形外观：大小非常适合小女生使用，媳妇非常满意。 运行速度：iOS15允许杠杠的，使用起来特别丝滑 拍照效果：拍照一流，夜市效果特别棒。 屏幕音效：屏幕色彩清晰，特别nice。,2021-11-18 19:35:27,5星评论,128GB,Not Found ip
不错挺好快递小哥给力哦，闪电到货。京东买手机一直就在京东买手机，相信京东信誉。苹果13mini非常不错，小巧精致非常精致,2022-09-11 14:26:43,5星评论,256GB,Not Found ip
外形外观：非常小巧，重量比较轻，非常适合女生使用，单手操作无压力，粉色的非常漂亮 屏幕音效：显示效果非常好  运行速度：运行比较快，一点不卡顿 待机时间：目前还可以，用一天没问题,2021-11-03 14:54:15,5星评论,128GB,Not Found ip
拍照效果:很清晰电池续航:比之前的苹果都耐用。通信音质:挺好质感非常好。反应也挺灵敏，目前没有什么不好，通讯没问题。比12，稍微重一点。蓝色好看，后续追评,2022-04-08 12:13:44,5星评论,128GB,Not Found ip
超级mini的手机，比pm小了一半多，实在是太小了 外形外观：小的很 屏幕音效：屏幕看起还不错 拍照效果：就那样 运行速度：速度快 待机时间：续航确实弱点,2022-03-20 12:45:06,5星评论,128GB,Not Found ip
真香，拿到&ldquo;4S&rdquo;了开心啊? 外形外观：很美，粉嫩 屏幕音效：极佳 拍照效果：电影模式完美 运行速度：O的K 待机时间：一般般毕竟电池容量小 其他特色：手感一级棒 京东活动力度还是OK的，很满意,2021-11-07 12:26:36,5星评论,256GB,Not Found ip
外形外观：喜欢这种小型机型，携带方便，一点都不重，小手女生首选 运行速度：系统溜溜六 待机时间：可以轻松待机一整天 拍照效果：很不错? 在13的机型里纠结了很久，最终入了迷你，星空色太美丽了，大赞,2022-06-16 13:43:44,5星评论,128GB,Not Found ip
一直想要个小一点的手机，很早之前买过SE，这次618的力度足够大，果断在普通和mini里选了小的，果然没失望，很不错?,2022-07-09 12:24:42,5星评论,128GB,Not Found ip
外形外观：小巧  屏幕音效：音效很棒 有种身临其境的感觉 拍照效果：拍照清晰,2022-08-04 11:55:07,5星评论,128GB,Not Found ip
外形外观：一如既往的好 屏幕音效：很立体值得购买 拍照效果：很真实的感觉 运行速度：流畅不卡 待机时间：可以正常一天一充 其他特色：做工精细简约，方便携带,2023-02-16 09:13:46,5星评论,128GB,Not Found ip
还是很不错的 我从苹果8换的。emm确实快了些。拍照锐化很严重倒是真的。信号有时候断流。能接受吧&hellip;&hellip;,2021-11-20 19:39:04,5星评论,256GB,Not Found ip
颜色个人觉得很喜欢，耐看，做工很细腻。外观：轻薄设计，手感出色的直屏机。功能：一键触达按键，可以快捷打车、健康码、支付码扫一扫、录音、录像以及快速启动应用，这个功能非常方便。影像：一亿像素+50倍潜望式长焦，拍照相当清晰。性价比高，值得入手，用下来也很满意。,2022-08-27 15:15:39,5星评论,128GB,Not Found ip
做工很完美，外观颜色都很漂亮，系统很漂亮，非常流畅，常用的软件都很容易下载，待机时间也不错，可以好好玩游戏了。,2022-04-27 14:46:49,5星评论,128GB,Not Found ip
13mini的手感很好，续航也处于完全可用的状态，这才是小屏手机最应该有的样子了！,2022-08-19 14:17:51,5星评论,128GB,Not Found ip
好小啊这手机，打电话都怕麦克风收不到声音，哈哈哈 拍照效果：一般吧， 运行速度：无敌 屏幕音效：很舒服 待机时间：一晚掉电3% 其他特色：返回真是反人类，绝对是一大特色了,2021-12-11 08:36:59,5星评论,128GB,Not Found ip
拍照效果：暗夜也能拍的很清晰，大小适中，适合精致女生，运行非常快，续航够一天用，蓝色很清新,2022-06-13 08:44:51,5星评论,256GB,Not Found ip
手机很好，大小合适， 外形外观：精致小巧便携 屏幕音效：屏幕清晰音效很好 拍照效果：高清晰度， 运行速度：流畅的操作 待机时间：一天 其他特色：性价比可以,2022-02-16 13:04:26,5星评论,128GB,Not Found ip
用了一段时间来评价的，小手机用习惯了还是非常不错的，一只手就能操控，而且不占地方，方便携带，做工还是没的说，用起来丝滑的很，感兴趣的可以入手。,2022-04-02 18:05:58,5星评论,128GB,Not Found ip
外形外观：外观简直太喜欢。主要还是喜欢这个小小的。 屏幕音效：音效很棒。没杂音。很清晰 拍照效果：苹果原相机懂的都懂 运行速度：运行速度杠杠的 待机时间：待机时间反正我用一天不用充电。我不玩游戏。,2021-10-13 11:01:23,5星评论,256GB,Not Found ip
大小合适，很喜欢 比+宝便宜还有保障 基本今天买第二天就到了 非常满意的一次购物，支持京东商城,2022-06-24 21:44:35,5星评论,128GB,Not Found ip
非常喜欢小屏手机，外观漂亮，声音特别的大，还没正经使用，用后再来追评，还有就是物流神速&hellip;&hellip;,2022-01-12 13:58:50,5星评论,128GB,Not Found ip
外形外观：小巧可爱 屏幕音效：很好 拍照效果：和12pm一样的摄像头，很好 运行速度：很快，a15不开玩笑 待机时间：续航很强,2021-11-29 18:50:12,5星评论,256GB,Not Found ip
真的超级好用，13迷你手感很好，小小的，一只手就能拿住，而且运行超级快，还得是苹果系统,2022-08-17 13:29:26,5星评论,128GB,Not Found ip
iphone 13 mini 很小巧玲珑，放口袋刚好，不会太大，暂时用着很好，没什么问题。,2022-12-05 11:59:34,5星评论,128GB,Not Found ip
外形外观：小巧玲珑适合女孩子用 屏幕音效：屏幕小音响不小 拍照效果：像素高拍照清晰 运行速度：非常流畅顺滑 待机时间：街机时间长，两天左右 其他特色：很好用，送礼自用都可以,2022-02-19 11:13:52,5星评论,128GB,Not Found ip
外形外观：小巧精致 非常漂亮 手感很好 屏幕音效：目前完美 拍照效果：非常赞的拍摄效果 镜头又升级 运行速度：流畅完美 迄今最快 待机时间：由于电池电量设计 待机一般 同样充电时间短 其他特色：单卡之王 小屏幕之王,2021-12-17 00:00:31,5星评论,128GB,Not Found ip
"很早就拿到了,用了一段时间，拍照清晰,分辨率高,运行不发热,极速充电,外观好看,手感 错,正品,系统流畅,色彩饱和度不错,界面美观,屏幕很大绝绝子!买它",2021-11-10 09:57:44,5星评论,128GB,Not Found ip
等了好久，抢了好久！终于到手了，小屏太舒服了，迷你小巧，拿在手里又轻又舒服！红色大爱，特别好看！真不错！,2021-10-04 21:57:45,5星评论,256GB,Not Found ip
