content,creationTime,score,productSize,location
急了，我彻底急了。当我看到其他人的好评，我感同身受，确实是好用，现在很少有这个小危放袋子里很舒服，我怎么可以不给好评！！,2023-04-14 17:34:21,5星评论,256GB,广东
用苹果13mini拍的照片哦，像素是很靠谱了，最重要的是手机非常轻，特别轻盈的那种！目前各方面使用都没什么问题，以后就是贴身随行的小伙伴啦～,2023-04-08 11:17:50,5星评论,128GB,福建
外形外观：小屏手机里的机皇，握持感很好。 屏幕音效：屏幕显示细腻，音效不错。 拍照效果：成像效果好，拍照不错。 运行速度：A15处理器，对付日常使用、办公、游戏，妥妥的。 待机时间：作为备用手机，一天完全够用了，甚至可以使用两天。,2023-04-25 15:06:24,5星评论,256GB,甘肃
外形外观：非常时尚，经典星光白 优雅不过时 屏幕音效：音效很nice 拍照效果：一如既往的清晰 加上广角更加强大 运行速度：很流畅，丝滑,2023-05-02 16:58:17,5星评论,128GB,浙江
品质很不错，性价比不太高，遇上涨价的节点了，不得不说尺寸真的很小，搭配上环保手机盒也还没有现在的大屏手机一个大，遗憾的是不送充电器了吧，其他还好5g也有信号一般可以关了加续航。,2023-04-08 12:13:36,5星评论,128GB,广东
外形外观：很棒，手感超级舒服； 屏幕音效：杠杠的，非常不错 拍照效果：很好，很清晰 运行速度：很快 待机时间：还可以 其他特色：很轻很好,2023-02-16 13:49:08,5星评论,128GB,Not Found ip
小屏幕带来了非常好的操控性，大拇指指哪打哪，能覆盖屏幕大部分范围，加上ios的流畅性，有种世界尽在掌握的感觉，但是只有60帧，用惯了90帧，非常难受，mini就两个字，小，轻。手感是真的好，盈盈一握。比14pm的手感好太多。拿在手里、放在口袋轻若无物，基本没有存在感,2023-03-29 03:59:16,5星评论,256GB,四川
外形外观：大小很合适，颜色也很惊艳。 屏幕音效：音响效果很好。 拍照效果：拍照效果特别好，和相机差不多，苹果的相机果然还是一如既往的厉害！！！ 运行速度：运行速度很快，但不要随意更新版本，听说更新后就会很卡，千万慎重。,2023-02-04 21:20:14,5星评论,128GB,Not Found ip
苹果手机外观漂亮，星光色显干净，拍照效果很好，运行速度快，品质放心，电池续航时间长。快递配送服务又快又好。,2023-02-27 19:23:42,5星评论,128GB,Not Found ip
外形外观：很好看，猛男分，一开始选了个蓝的，后来觉得很普通又选了个红的结果刚要下单没了，然后就选了个粉的，很好看 拍照效果：拍照没毛病，作为备用机来说的话效果很好 运行速度：运行很快，苹果一直以系统称雄，这次的芯片加系统很舒服 待机时间：目前来说还可以，备用机来用的话到晚上就可以，所以现在还在体验，具体待机时长还没有确定,2023-02-10 13:01:29,5星评论,128GB,Not Found ip
送货真快 第二天就到了 旧手机软件直接倒入新手机 iphone系统可以说是现在手机系统里面最好用的 用了10几年苹果手机 从来没见过别的 现在手上一部14 一部13,2023-03-20 16:25:11,5星评论,128GB,北京
个人比较喜欢MiNi类型手机，一是携带方便，无论放在口袋还是手里，都比较不错；二是13的拍照功能确实强大，照片质感很不错！,2023-03-27 10:14:24,5星评论,256GB,山东
一直喜欢用苹果产品，性能各方面都没得说，这个mini拿手里面很舒服，平时用够了，如果要玩游戏不建议买这么小的哈,2023-02-16 12:05:19,5星评论,256GB,Not Found ip
用了一段时间才来评价，感觉很不错质量也没毛病，检测各方面性能都很好符合要求，很不错，颜色很好看，国货之光，值得购买，相当不错的选择好多朋友看我用都想买，售后很到位，师傅送的很快，第二天就收到，和评价基本相符，我预约了第二天就送到，速度很快，物流没毛病，很满意，不愧是头牌，五星好评，质量很好，漂亮，大品牌，质量非常好，总之特别满意,2023-02-14 15:16:17,5星评论,128GB,Not Found ip
外形外观：小巧精致可爱 屏幕音效：一如当年 拍照效果：清晰感受 运行速度：很快 苹果的感觉一直都很好 待机时间：适当 一天半的时间吧 其他特色：手感把握舒适,2023-03-26 17:39:10,5星评论,128GB,河北
首先这是我第一次购买苹果手机，到手后细腻的手感让我感到苹果能拥有一众果粉是有道理的。系统用也来也很快，可能是第一次用iOS系统，开始不太习惯，但不否认他很好。,2023-03-25 13:17:34,5星评论,128GB,山东
"非常不错的手感，精致小巧，买的晚了一些，不过喜欢就好，拍照，各方面还好用，方便携带,经典收藏，永不过时。",2023-03-11 23:18:51,5星评论,128GB,Not Found ip
上京东买Apple iPhone 13 mini ，(A2629) ，128GB ，星光色， 手机 ，支持移动联通电信5G，手感好，颜色好看，,2023-03-28 14:02:35,5星评论,128GB,广东
电池电量消耗很快，外观没得说！,2021-11-10 15:48:55,3星评论,128GB,Not Found ip
外形外观：外观时尚，很像4s。 屏幕音效：屏幕很亮，音效比4s好。 拍照效果：相比苹果4s 运行速度：对比4s有了很大的提升。 待机时间：待机时间不如4s。 其他特色：比4s多一个摄像头。,2023-03-05 00:03:17,5星评论,256GB,Not Found ip
刚收到 开始捣鼓 手感超级舒服 小手机真可可爱爱 给孩子用的 平时不沉溺电子产品 对于手机功能初级使用人也想要一个小手机 希望下一代产品继续有5.4寸的手机 ！,2023-03-11 12:01:26,5星评论,128GB,Not Found ip
外形外观：很小巧，拿在手里手感很好，边缘没有想象中的割手感 运行速度：速度很快，暂时没有遇到卡顿 待机时间：足够一天正常使用,2023-02-05 17:47:30,5星评论,128GB,Not Found ip
非常棒的手机，这个大小正好适合单手持握，使用非常方便。 外形外观：经典外形 屏幕音效：屏幕色彩很舒服 拍照效果：拍照效果比以前又提升了 运行速度：5g网速更快了,2023-03-07 05:59:16,5星评论,128GB,Not Found ip
第一次在网上买手机，感觉挺不错的，今天早上买的，下午就到了，这种心情不是一般的好，体验感十足，手机我很喜欢,2023-02-28 20:54:30,5星评论,128GB,Not Found ip
一直用苹果手机，之前用的11代，这次想换个小屏的，可单手操控，mini是想要的大小。数据传输很顺利，没多久就完成了。好评！,2023-02-24 17:16:58,5星评论,256GB,Not Found ip
这个Apple13mini手机是给老婆买的，她喜欢手机小巧一点的，不用拿包就可以方便随身携带的那种，这个13mini正和她心意，握在手里感觉正好，非常喜欢！,2023-02-20 13:36:32,5星评论,256GB,Not Found ip
手机收到了，感觉很不错的，质感好，拿在手上很有分量感，充电也是非常的快。这个小巧的我很喜欢，做工精致，充电速度快，而且价格实惠，,2023-02-22 16:58:07,5星评论,128GB,Not Found ip
外形外观：外观大气，精致很漂亮 屏幕音效：特别清晰，因为尺寸小了，看着特别清晰 拍照效果：满意，非常不错 其他特色：小巧，不喜欢大手机的福音,2023-02-12 21:04:22,5星评论,128GB,Not Found ip
XHS慕名而来，价格非常美好~年底安卓手机升级导致工作app用不了，小mini再次体验一下苹果乐趣~还是ios平台app稳。 墨绿色很漂酿~128G作为工作手机也是够用的了~棒~,2023-02-11 12:15:02,5星评论,128GB,Not Found ip
iPhone13mini的续航比我想象中的顶啊， 绿色挺好看的， 拍照特别是夜间拍视频无敌 机子特别轻巧便携,2023-02-11 13:55:47,5星评论,128GB,Not Found ip
挺好的，价格适中，质量看着不错完美，产品很惊艳，性价比合适，希望用的长久！物超所值，话不多说，这四个字已经说明了一切，夜拍也清晰,2023-03-17 04:40:46,5星评论,128GB,Not Found ip
单手操作可以的 外形外观：外观设计很好 屏幕音效：音质较好 拍照效果：像素逼真 运行速度：运行速度真快 待机时间：待机时间很长，一天没问题 其他特色：小巧轻便,2023-03-19 20:16:34,5星评论,128GB,辽宁
钟情mini好久啦，真的非常喜欢这个小巧的手感，作为备用机，使用感完美。京东送货服务很放心，包裹的严实，价格也非常实惠，比线下店卖得便宜多了，还领了优惠券。不错哦。,2023-02-10 18:42:18,5星评论,128GB,Not Found ip
外形外观：小巧好掌控，单手操作很方便 屏幕音效：屏显细腻，音量挺大音效不错 拍照效果：很棒，1200w双摄还可以 运行速度：运行很快，流畅 待机时间：还可以 其他特色：习惯了这个系统 我要拿豆豆,2023-02-10 16:25:53,5星评论,128GB,Not Found ip
京东自营的送货速度是真的可以相信，第二天准时到货，不影响情人节的礼物啊啊啊！苹果手机没得说，用了就知道了吧，产品挺好的，用起来流畅，很喜欢,2023-02-17 23:07:19,5星评论,128GB,Not Found ip
外形外观：精美小巧，手感舒适 屏幕音效：屏幕很舒服，音效很好，振动的模拟很到位 拍照效果：拍照很棒 运行速度：完全不卡，流畅，舒适,2023-02-07 23:06:23,5星评论,256GB,Not Found ip
东西不错，家人很喜欢，一直再关注，终于等到了合适的价格，等有活动的时候还会再买，喜欢小屏幕，好评再来,2023-02-21 09:24:14,5星评论,128GB,Not Found ip
用了很长一段时间了，确定正品，当时是用以旧换新活动买的，很满意。有专门的工作人员上门送新机收旧机做评估。这个手机女生用大小正合适。,2023-02-08 21:41:24,5星评论,256GB,Not Found ip
手机还行吧，就是价格可以再优惠点,2021-12-07 15:37:09,3星评论,128GB,Not Found ip
苹果手机性价比一直很高，作为一个小老百姓我只希望手机用的久一些，这一点我真的很满意！给老公也买的这款，很喜欢，希望京东以后多出优惠活动！,2023-02-28 22:14:26,5星评论,128GB,Not Found ip
京东自营值得信赖，一直等了好久才降价，立马入手了。用着很舒服，电池也在线，可以的，买贵的电子产品，吃的。一直都是京东自营，物流快还送到家，快递员也很礼貌,2023-02-04 12:30:19,5星评论,128GB,Not Found ip
买了一整套的手机和配件，手机在双十二打折的时候买的，相对便宜了一些，因为喜欢mini的手感才入的，配上外接电池，可以说还是非常不错的。,2023-02-04 11:46:31,5星评论,128GB,Not Found ip
京东自营的电话质量有保障，而且价格优惠力度非常大，个人角度喜欢小的手机。所以13mini非常合适，而且13mini价格也便宜，非常好。,2023-02-16 14:10:06,5星评论,128GB,Not Found ip
终于收到货了，非常非常喜欢，做工精致漂亮，已经被很多人夸了，真的太开心了，已经是他家的忠实粉丝了，以后还会继续买买买的外观设计漂亮，尺寸大小合适，包装仔细完整，宝贝手感不错，感觉很好，发货速度快，服务态度一流，给力！5星好评！,2023-02-13 12:27:12,5星评论,256GB,Not Found ip
外形外观：非常棒，手感好，单手操作方便，回归当年5s的感觉 屏幕音效：显示细腻度高，电影看片效果好 拍照效果：不错，算是现在手机的顶流水准 运行速度：流畅，丝滑 待机时间：待测试中，1天还是没问题的 其他特色：棱角分明，外观尺寸设计到位，握持感不错，战个5年没问题。,2023-02-13 10:09:11,5星评论,256GB,Not Found ip
很快就到了，全新正品?，包装很仔细，没有问题 当时买的时候还在犹豫价格，买来之后一点都不后悔，而且物流还快，可以入手,2023-02-15 23:49:15,5星评论,256GB,Not Found ip
实物与描述的一样，质量相当好，卖家态度也好，有问必答，发货速度杠杠的，值得购买哦比平时要便宜，囤了不少，特别特别满意?，超级好看?，客服很有礼貌，很客气，良心商家，支持！物流速度真的是没话说，就是一个字：快。商品从外包装来看非常高档，真是一分钱一分货，贵有贵的道理,2023-02-11 11:36:22,5星评论,128GB,Not Found ip
收到货，第一时间拆包装，感觉质量还是比较好的，与卖家描述的还是一致的，非常满意，发货速度比较快，物流公司服务态度很好，运送速度很快，总的来说这次是很满意的一次购物，,2023-03-11 18:59:28,5星评论,128GB,Not Found ip
(*^__^*)非常满意的一次购物，物有所值，比实体店里实惠多了！想买的别犹豫哇！没有廉价的感觉，很高端，特别棒！想买的别犹豫哇！没有廉价的感觉，很高端，特别棒！(*^__^*)非常满意的一次购物，物有所值，比实体店里实惠多了！,2023-02-27 11:22:28,5星评论,128GB,Not Found ip
很满意的一次购物，商家服务好，发货神速，物流也很给力，宝贝收到后非常喜欢，买得放心，用得安心 ?心仪已久，果断下手，用过之后感觉很不错，是正品，快递也很给力，果然名副其实?,2023-03-01 21:33:58,5星评论,128GB,Not Found ip
外形外观：小巧喜欢 屏幕音效：好不错 拍照效果：很好看 运行速度：非常快，喜欢小屏幕手机，这个尺寸很喜欢?。 待机时间：还不错 其他特色：好看高颜值,2023-02-04 22:53:55,5星评论,256GB,Not Found ip
不得不说，苹果手机的配色非常美丽，对比自己安卓机，有点土，不过现在安卓和苹果也是越来越像，用下来，各有特点，各有优劣，这个小mini做个备机还是不错的,2023-03-10 01:35:46,5星评论,128GB,Not Found ip
果粉来报道，大品牌，一如即往的喜欢，这个是小手的福音，太爱了，除了电池小，小贵点，真没啥缺点了，主要是太好看了,2023-03-19 00:37:04,5星评论,128GB,广东
手机收到了，看着小巧是身姿还不错，唯一缺点手机信号有点差。这可能和电信和地区也有关系吧，拍的照片也很清晰，通话音质很清晰，处理器很很快！,2023-02-16 09:22:17,4星评论,256GB,Not Found ip
iPhone13mini 外形外观：特别小巧好操作 屏幕音效：可以的 拍照效果：可以的 运行速度：挺快 待机时间：还可以 适合喜欢小手机的人,2023-02-26 22:01:39,5星评论,128GB,Not Found ip
一直想入一台mini的iphone作为副机，正好13mini搞活动有特价，就入手一台。颜色挑了粉色的，挺耐看。做工啥的非常好，全新的没有提前被激活过。安装app也很流畅。总体使用不错，就是电池续航表现一般，毕竟手机很小。摄像头素质不错，可惜没有近焦，不过已经很令人满意了。,2023-02-24 23:59:43,4星评论,128GB,Not Found ip
苹果最后一代mini。最担心的续航问题在我使用下来之后，也感觉可以接受。精致的外观，合适的大小。加上苹果稳定的拍照和视频录制。抓人心弦。最后的最后感觉只有一个问题。就是适不适合自己。每个人使用的环境事不一样的。适合才最重要。,2023-02-10 11:14:14,5星评论,128GB,Not Found ip
一直想用一个小屏手机，手感好，虽然已经到了产品周期的尾声，但是依然不可否认有用户需求，开机以后不升级，就一直用应该没啥问题。,2023-03-05 10:45:10,5星评论,128GB,Not Found ip
快递一天就到了 京东物流速度一直ok的 13mini的手感没得说 因为之前的xr单手拿多少有点累赘 所以才会选择了mini版本 机器也没有任何问题 苹果官方自营 放心冲好吧,2023-02-15 16:55:04,5星评论,128GB,Not Found ip
客观评价水果机的蓄电量仍然是～～～～～,2021-11-07 23:20:08,3星评论,512GB,Not Found ip
价格便宜质量好，买电器还得去京东！???????????????????,2023-03-12 07:25:42,5星评论,128GB,Not Found ip
用得挺好的，适合我这个小手 外形外观：很喜欢，好看，适合手不大的 屏幕音效：屏幕正常，音效OK 拍照效果：满足需求 运行速度：很快，没有见过卡顿 待机时间：一天足够了,2023-02-16 12:47:01,5星评论,128GB,Not Found ip
外形外观：小巧精致 屏幕音效：屏幕不错，音质也可以 拍照效果：不错很真实 运行速度：快 待机时间：中 其他特色：这才是我心目中手机应该的大小,2023-02-25 23:46:25,5星评论,256GB,Not Found ip
新手机到手女儿就帮我用苹果自带功能快速定制了这样的墙纸，也挺好玩的?手机小巧好用，绿色在正面也非常细节地有一圈若有若无的边，很好看！电池也还可以，工作时也不会总用手机，一天充一次，谁用谁知道！,2023-02-10 10:49:52,5星评论,128GB,Not Found ip
在京东买过几次手机了，都很好，没有出现任何质量问题。这次把12mini换成了种草很久的13mini，讲真，这个苍岭绿的颜色不要太好看，超级超级喜欢。 续航其实就那样，但是自己喜欢，么得办法。,2023-04-03 20:33:18,5星评论,128GB,广东
mini小小的很可爱哈哈哈哈，配置啥的都不错，拍照挺真实的，没有微距，除了电池稍微小点企业都挺好的，喜欢小屏手机的可以买，算是近年来唯一的小屏旗舰了诶,2023-02-10 17:05:58,5星评论,128GB,Not Found ip
外形外观：高端大气上档次，经典耐看，直角边握着非常舒服。小巧，适合女士的手拿，太宽了一个手打字就费劲了。 屏幕音效：屏幕边框小，视野大，视觉效果好。音质好，音效也可随心调式，nice 拍照效果：拍照视频没啥说的，用过都知道，好感依旧。 运行速度：A15处理器，苹果系统和安卓系统还是有点小区别的，用着丝滑的很 待机时间：待机时间要是能在长一些就好了,2023-01-02 14:01:27,5星评论,128GB,Not Found ip
iPhone13mini宝贝到手，真的是太精致了，有点舍不得使用了，哈哈 待电续航:从来不玩游戏，mini的电池完全能满足日常需求 外观手感:小屏手机的忠实粉丝，5.4寸mini外观精致手感一流 通用体验:A15芯片性能强悍，使用流畅度风驰电掣啊 配送速度:快递服务态度非常好，在这个疫情期间，很感谢！ 服务保障:京东客服有求必应，耐心的解答客户提出的问题，客服小姐姐?? 13mini是我理想中的产品，质量不错，京东自营性价比很高，值得点赞??????,2023-01-04 12:44:26,5星评论,128GB,Not Found ip
外形外观：星光色搭配金属边框真的很美 屏幕音效：OLED屏幕艳丽，强光下清晰，音质OK 拍照效果：清晰，人物不变形 运行速度：运行流畅 待机时间：十几个小时 其他特色：mini小巧，单手使用方便,2022-12-31 13:03:55,5星评论,128GB,Not Found ip
外形外观：精致小巧 运行速度：流畅无卡顿 待机时间：理想 屏幕音效：完美 整体很满意 除了不能双卡 其他用起来挺不错 主要轻巧 手感好,2022-12-31 08:10:47,5星评论,256GB,Not Found ip
小屏幕党最爱，单手握持，完美尺寸，尽管带上保护壳，也还是很小，很精致！很精致，货真价实的小屏旗 舰，在苹果14系列砍掉mini系列后，安卓几乎没有与之 抗衡的小屏旗舰的情况下，13mini绝对算是小屏旗舰最后的荣光，也我们小屏党的最佳选择（本来12min换到13min感觉续航提示很多）。最大的优点就是小尺寸带来的便携与便利，精致的外观，一手掌握的快感。ios系统带来的舒适流畅度，A15不错的能耗和性能。,2022-12-29 18:54:32,5星评论,128GB,Not Found ip
入手mini星光色，小巧精致，单手操作非常 方便，各方面都很不错的，握着就很舒服。5.4的直面屏，屏幕品示的非常清晰，手机不会太小，也不会太大，音质也是非常的好，没有什么燥音。低音模式也很好。对于我来说。最惊的还是拍照。尤其是电影模式，摄像自动对焦。清晰度清晰的不能再清晰了,2022-12-16 22:47:12,5星评论,128GB,Not Found ip
手感真好，用完MINI再用别的，感觉好重好大啊，屏幕调一下，也没有网上说的那么闪，上班族不玩游戏续航能接受,2022-11-18 16:26:57,5星评论,128GB,Not Found ip
被种草iPhone13mini很久了，之前老婆生日的时候送她一部13mini，可以说手感完美，可以单手操作，各方面满意。趁着年货节在jd我也入手了一部13mini，这次选择了猛男粉颜色?，果然没让我失望，hhhhh,2022-12-31 16:14:53,5星评论,128GB,Not Found ip
到手之后非常好用，非常流畅，建议大家购买手机背面是玻璃亮镜面的材质，这种磨砂与亮面的搭配，看上去非常时尚大气，外观看上去很上档次，方正的外观设计给人感觉非常稳重，很经典的设计。不过还有一点就是今年这款iPhone13的外观设计，跟上一代iPhone12改变不大。一直就是很喜欢苹果手机，就是因为它的系统流畅，升级的A15处理器有不少的省电提升，还有对5G网络的优化，而且还有快充,2022-11-07 22:01:30,5星评论,128GB,Not Found ip
颜色很可爱，屏幕大小合适，非常喜欢。很好用，原来是苹果SE，用了6年多，习惯用小屏。这款比SE大一些，全屏显示，大小刚好。,2022-12-12 13:39:00,5星评论,128GB,Not Found ip
先说物流，受口罩大环境的影响，京东物流绝对算是不错的，下单5天后收到。 再说商品，迫不及待的拆封，心心念念的mini，心心念念的绿色，开启好心情。 写在最后，无论是选择哪款机型，不用看别人的评论和感受，你要记住，手机是买来自己用的，喜欢的就是最好的，适合的就是最好的，当下的就是最好的。,2022-12-10 15:44:52,5星评论,256GB,Not Found ip
老婆的手机被摔坏了，他又比较喜欢小手机，不喜欢大的，所以最后选来选去还是买了iphone13 mini，大小手感很合适，对于我们这种不需要看手机电影的就很合适,2022-12-23 18:17:48,5星评论,256GB,Not Found ip
价格实惠，赶在优惠活动时买的，基本是年度最低价了，手感好，自己很喜欢，网上说的缺点在我使用过程中没有出现，想买就买！,2023-01-02 07:43:20,5星评论,256GB,Not Found ip
京东优惠力度大，发货速度快，头天发货，第二天一早就收到了，包装完美，收到后迫不及待的拆开，机器没有问题，马上上手导入旧手机资料，反应流畅非常满意。,2022-12-30 12:43:48,5星评论,128GB,Not Found ip
期待了一年多的13mini终于趁年货节入手拔草了，配合消费券价格很美丽。作为小屏爱好者来说mini系列手感确实无敌，性能小钢炮且用且珍惜吧，墨绿色很奈斯。,2023-01-02 21:18:08,5星评论,128GB,Not Found ip
买给小学生用的，挑来挑去选了这款，用苹果X以旧换新再补贴一部分费用成功拿下，果然好用，非常丝滑。 赞一下拍拍回收，守时且专业，效率也很高。,2022-12-04 12:21:35,5星评论,128GB,Not Found ip
手机到的很快，苹果手机确实不会错，很喜欢13mini的手感，一直相信京东，所以选择京东，但我买的时间可能不是最优惠的时段,2022-12-14 09:54:53,5星评论,128GB,Not Found ip
?宝贝收到了，很惊喜?，设计合理，时尚大方，继续关注，以后会回购的???想买的别犹豫哇！没有廉价的感觉，很高端，特别棒！真心喜欢，颜色、款式都非常棒！包装好，物流快，价格实惠，比超市便宜多了,2023-01-29 10:20:01,5星评论,128GB,Not Found ip
东西已经收到！手感不错！用料扎实！质量很好！平常用基本没有问题！以后还会光顾的。祝你们生意兴隆，财源广进零售多多大吉大利！,2022-11-05 13:59:50,5星评论,128GB,Not Found ip
说到底还是白色最经典，从iPhone 8换到了iPhone 13 Mini，两者大小差不多，握持感基本没什么区别，但是可视面积大了很多，看电影也非常舒服。,2023-01-04 20:52:32,5星评论,256GB,Not Found ip
外形外观：我喜欢单手用的小屏幕，这个竟比我的6s还小巧精致 屏幕音效：是我爱用的 拍照效果：不是主业，要求不高能用就行 运行速度：速度流畅 待机时间：电池不太够用啊，尤其是现在基本一天都耍在手里 其他特色：我的6s在使用8年后终究因为电池实在是撑不住了才光荣下岗，而且手机用了8年依然流畅好用，系统体验感的确超过安卓机好多啊，电池在第六年的时候换过一次。希望这个手机依然可以陪伴我下一个八年,2022-12-23 15:20:35,5星评论,128GB,Not Found ip
粉粉的，非常适合小女孩，而且买的苹果13mini，小孩子手小，也方便携带，主要夏令营什么的独自出门时用用，平时都放那儿给我当电子字典查询，非常赞,2022-11-07 21:56:32,5星评论,128GB,Not Found ip
